period,time,seconds_left,call_type,committing_player,disadvantaged_player,review_decision,comment,video,game_id,play_id,disadvantaged_team,committing_team,ref_made_call
Q4,0:01:54,114,Foul: Shooting,Dwight Howard,CJ McCollum,CNC,Howard (ATL) maintains legal guarding position and makes incidental contact with McCollum (POR) that does not affect his drive to the basket and shot attempt.,http://official.nba.com/last-two-minute-report/?gameNo=0021600830&eventNum=1113,20170213ATLPOR,20170213ATLPOR-0,POR,ATL,
Q4,0:01:45,105,Foul: Shooting,Ed Davis,Kent Bazemore,CC,Davis (POR) makes contact with Bazemore's (ATL) body that affects his driving shot attempt.,http://official.nba.com/last-two-minute-report/?gameNo=0021600830&eventNum=565,20170213ATLPOR,20170213ATLPOR-1,ATL,POR,
Q4,0:01:45,105,Violation: Lane,Damian Lillard,,,[Incidental or immaterial] Lillard (POR) enters the area inside the three-point line prior to the free throw being released.,http://official.nba.com/last-two-minute-report/?gameNo=0021600830&eventNum=1114,20170213ATLPOR,20170213ATLPOR-2,ATL,POR,
Q4,0:01:25,85,Foul: Personal,Dennis Schroder,Damian Lillard,CNC,Schroder (ATL) makes incidental contact with Lillard (POR) that does not affect his SQBR.,http://official.nba.com/last-two-minute-report/?gameNo=0021600830&eventNum=1115,20170213ATLPOR,20170213ATLPOR-3,POR,ATL,
Q4,0:01:20,80,Foul: Loose Ball,Paul Millsap,Maurice Harkless,CNC,Millsap (ATL) and Harkless (POR) make incidental contact with one another during rebounding.,http://official.nba.com/last-two-minute-report/?gameNo=0021600830&eventNum=1116,20170213ATLPOR,20170213ATLPOR-4,POR,ATL,
Q4,0:01:07,67,Turnover: Discontinue Dribble,Tim Hardaway Jr.,,INC,Hardaway Jr. (ATL) pins the ball against his hip and continues his dribble.,http://official.nba.com/last-two-minute-report/?gameNo=0021600830&eventNum=1117,20170213ATLPOR,20170213ATLPOR-5,,,
Q4,0:00:39.700000,39.7,Foul: Offensive,Ed Davis,Dennis Schroder,CNC,Davis (POR) sets the screen on Schroder (ATL) and gives him room to avoid the contact.,http://official.nba.com/last-two-minute-report/?gameNo=0021600830&eventNum=1119,20170213ATLPOR,20170213ATLPOR-6,ATL,POR,
Q4,0:00:36.100000,36.1,Foul: Personal,Kent Bazemore,Ed Davis,CC,Bazemore (ATL) commits a take foul on Davis (POR).,http://official.nba.com/last-two-minute-report/?gameNo=0021600830&eventNum=576,20170213ATLPOR,20170213ATLPOR-7,POR,ATL,
Q4,0:00:36.100000,36.1,Foul: Loose Ball,Dwight Howard,Maurice Harkless,CNC,Howard (ATL) and Harkless (POR) make incidental contact with one another during rebounding.,http://official.nba.com/last-two-minute-report/?gameNo=0021600830&eventNum=1120,20170213ATLPOR,20170213ATLPOR-8,POR,ATL,
Q4,0:00:30.800000,30.8,Turnover: Traveling,Dennis Schroder,,,[Observable in enhanced video] Schroder (ATL) hops consecutively on the same foot prior to starting his dribble.,http://official.nba.com/last-two-minute-report/?gameNo=0021600830&eventNum=1121,20170213ATLPOR,20170213ATLPOR-9,POR,ATL,
Q4,0:00:28.600000,28.6,Foul: Shooting,Al-Farouq Aminu,Dwight Howard,CC,Aminu (POR) makes contact to Howard's (ATL) head that affects his catch and finish shot attempt.,http://official.nba.com/last-two-minute-report/?gameNo=0021600830&eventNum=589,20170213ATLPOR,20170213ATLPOR-10,ATL,POR,
Q4,0:00:04.200000,4.2,Foul: Loose Ball,Pat Connaughton,Taurean Prince,CNC,Connaughton (POR) makes contact with the ball attempting to retrieve the rebound.,http://official.nba.com/last-two-minute-report/?gameNo=0021600830&eventNum=1122,20170213ATLPOR,20170213ATLPOR-11,ATL,POR,
Q4,0:00:01,1,Foul: Personal,Al-Farouq Aminu,Paul Millsap,CNC,Aminu (POR) makes incidental contact with Millsap (ATL) that does not affect his SQBR.,http://official.nba.com/last-two-minute-report/?gameNo=0021600830&eventNum=1123,20170213ATLPOR,20170213ATLPOR-12,ATL,POR,
Q4,0:00:00.300000,0.3,Foul: Shooting,Al-Farouq Aminu,Paul Millsap,CNC,Aminu (POR) maintains legal guarding position and makes incidental contact with Millsap (ATL) that does not affect his drive to the basket and shot attempt.,http://official.nba.com/last-two-minute-report/?gameNo=0021600830&eventNum=1124,20170213ATLPOR,20170213ATLPOR-13,ATL,POR,
Q4,0:00:00,0,Instant Replay: Support Ruling,,,CC,"After communicating with the Replay Center, the ruling on the floor that Millsap (ATL) released his field goal attempt prior to the game clock expiring is confirmed.",http://official.nba.com/last-two-minute-report/?gameNo=0021600830&eventNum=609,20170213ATLPOR,20170213ATLPOR-14,,,
Q5,0:01:59,119,Foul: Offensive,Paul Millsap,Damian Lillard,CNC,Millsap (ATL) sets the screen on Lillard (POR) and gives him room to avoid the contact.,http://official.nba.com/last-two-minute-report/?gameNo=0021600830&eventNum=1125,20170213ATLPOR,20170213ATLPOR-15,POR,ATL,
Q5,0:01:52,112,Foul: Personal,Maurice Harkless,Paul Millsap,CNC,Harkless (POR) makes legal contact with the ball on the drive to the basket by Millsap (ATL).,http://official.nba.com/last-two-minute-report/?gameNo=0021600830&eventNum=1126,20170213ATLPOR,20170213ATLPOR-16,ATL,POR,
Q5,0:01:29,89,Foul: Offensive,Al-Farouq Aminu,Taurean Prince,CC,Prince (ATL) obtains a legal guarding position outside of the RA prior to the contact with Aminu (POR).,http://official.nba.com/last-two-minute-report/?gameNo=0021600830&eventNum=644,20170213ATLPOR,20170213ATLPOR-17,ATL,POR,
Q5,0:01:17,77,Foul: Personal,Al-Farouq Aminu,Dennis Schroder,CNC,Aminu (POR) maintains legal guarding position on the drive by Schroder (ATL).,http://official.nba.com/last-two-minute-report/?gameNo=0021600830&eventNum=1127,20170213ATLPOR,20170213ATLPOR-18,ATL,POR,
Q5,0:00:27.800000,27.8,Foul: Shooting,Kent Bazemore,Maurice Harkless,CNC,Bazemore (ATL) makes legal contact with the ball on the shot attempt by Harkless (POR).,http://official.nba.com/last-two-minute-report/?gameNo=0021600830&eventNum=1128,20170213ATLPOR,20170213ATLPOR-19,POR,ATL,
Q5,0:00:17.800000,17.8,Foul: Shooting,Tim Hardaway Jr.,CJ McCollum,CNC,Hardaway Jr. (ATL) maintains legal guarding position and makes incidental contact with McCollum (POR) that does not affect his drive to the basket and shot attempt.,http://official.nba.com/last-two-minute-report/?gameNo=0021600830&eventNum=1129,20170213ATLPOR,20170213ATLPOR-20,POR,ATL,
Q5,0:00:15.900000,15.9,Foul: Loose Ball,Maurice Harkless,Taurean Prince,CNC,Harkless (POR) and Prince (ATL) make incidental contact with one another during rebounding.,http://official.nba.com/last-two-minute-report/?gameNo=0021600830&eventNum=1130,20170213ATLPOR,20170213ATLPOR-21,ATL,POR,
Q5,0:00:12.700000,12.7,Foul: Loose Ball,Taurean Prince,Maurice Harkless,CC,"Prince (ATL) clamps the arm of Harkless (POR), affecting his ability to retrieve the rebound.",http://official.nba.com/last-two-minute-report/?gameNo=0021600830&eventNum=663,20170213ATLPOR,20170213ATLPOR-22,POR,ATL,
Q5,0:00:09.600000,9.6,Foul: Personal,Dennis Schroder,Damian Lillard,INC,LHH shows that Schroder (ATL) makes leg to leg contact with Lillard (POR) that affects his SQBR.,http://official.nba.com/last-two-minute-report/?gameNo=0021600830&eventNum=1131,20170213ATLPOR,20170213ATLPOR-23,POR,ATL,
Q5,0:00:06.400000,6.4,Foul: Personal,Allen Crabbe,Taurean Prince,CC,Crabbe (POR) commits a take foul on Prince (ATL).,http://official.nba.com/last-two-minute-report/?gameNo=0021600830&eventNum=668,20170213ATLPOR,20170213ATLPOR-24,ATL,POR,
Q5,0:00:05.400000,5.4,Foul: Personal,Allen Crabbe,Paul Millsap,CC,Crabbe (POR) commits a take foul on Millsap (ATL).,http://official.nba.com/last-two-minute-report/?gameNo=0021600830&eventNum=672,20170213ATLPOR,20170213ATLPOR-25,ATL,POR,
Q5,0:00:05.400000,5.4,Foul: Personal,Taurean Prince,Allen Crabbe,CNC,Prince (ATL) cleanly steals the ball from Crabbe (POR).,http://official.nba.com/last-two-minute-report/?gameNo=0021600830&eventNum=1132,20170213ATLPOR,20170213ATLPOR-26,POR,ATL,
Q5,0:00:02.200000,2.2,Foul: Personal,Pat Connaughton,Taurean Prince,CC,Connaughton (POR) commits a take foul on Prince (ATL).,http://official.nba.com/last-two-minute-report/?gameNo=0021600830&eventNum=680,20170213ATLPOR,20170213ATLPOR-27,ATL,POR,
Q4,0:01:57,117,Foul: Personal,Tyson Chandler,Anthony Davis,CNC,Chandler (PHO) makes incidental contact with Davis (NOP) on the perimeter that does not affect his FOM.,http://official.nba.com/last-two-minute-report/?gameNo=0021600829&eventNum=1124,20170213NOPPHO,20170213NOPPHO-0,NOP,PHO,
Q4,0:01:37,97,Foul: Offensive,Tyson Chandler,Jrue Holiday,CNC,Chandler (PHO) sets the screen on Holiday (NOP) and gives him room to avoid the contact.,http://official.nba.com/last-two-minute-report/?gameNo=0021600829&eventNum=1125,20170213NOPPHO,20170213NOPPHO-1,NOP,PHO,
Q4,0:01:35,95,Foul: Shooting,Tyreke Evans,Eric Bledsoe,CNC,Evans (NOP) maintains legal guarding position and makes incidental contact with Bledsoe (PHO) that does not affect his drive to the basket and shot attempt.,http://official.nba.com/last-two-minute-report/?gameNo=0021600829&eventNum=1126,20170213NOPPHO,20170213NOPPHO-2,PHO,NOP,
Q4,0:01:23,83,Foul: Personal,Tyson Chandler,Anthony Davis,CNC,Chandler (PHO) makes incidental contact with Davis (NOP) on the perimeter.,http://official.nba.com/last-two-minute-report/?gameNo=0021600829&eventNum=1127,20170213NOPPHO,20170213NOPPHO-3,NOP,PHO,
Q4,0:01:23,83,Foul: Defense 3 Second,Devin Booker,,,[Detectable with stop watch] Booker (PHO) is in the paint without actively guarding an opponent for longer than three seconds.,http://official.nba.com/last-two-minute-report/?gameNo=0021600829&eventNum=1127,20170213NOPPHO,20170213NOPPHO-4,NOP,PHO,
Q4,0:01:12,72,Foul: Shooting,Tyson Chandler,Anthony Davis,CNC,Chandler (PHO) makes incidental body contact to Davis (NOP) after the shot attempt.,http://official.nba.com/last-two-minute-report/?gameNo=0021600829&eventNum=1128,20170213NOPPHO,20170213NOPPHO-5,NOP,PHO,
Q4,0:01:04,64,Foul: Offensive,Tyson Chandler,Jrue Holiday,CNC,Chandler (PHO) sets the screen on Holiday (NOP) and gives him room to avoid the contact.,http://official.nba.com/last-two-minute-report/?gameNo=0021600829&eventNum=1129,20170213NOPPHO,20170213NOPPHO-6,NOP,PHO,
Q4,0:00:45.600000,45.6,Foul: Offensive,Anthony Davis,Devin Booker,CNC,Davis (NOP) sets the screen and firms up his position upon contact with Booker (PHO).,http://official.nba.com/last-two-minute-report/?gameNo=0021600829&eventNum=1130,20170213NOPPHO,20170213NOPPHO-7,PHO,NOP,
Q4,0:00:43.700000,43.7,Foul: Shooting,Devin Booker,Tyreke Evans,CNC,Booker (PHO) maintains legal guarding position during on the drive to the basket and shot attempt by Evans (NOP).,http://official.nba.com/last-two-minute-report/?gameNo=0021600829&eventNum=1131,20170213NOPPHO,20170213NOPPHO-8,NOP,PHO,
Q4,0:00:42.600000,42.6,Foul: Loose Ball,Anthony Davis,PJ Tucker,CNC,Davis (NOP) and Tucker (PHO) make incidental contact with one another during rebounding.,http://official.nba.com/last-two-minute-report/?gameNo=0021600829&eventNum=1132,20170213NOPPHO,20170213NOPPHO-9,PHO,NOP,
Q4,0:00:41.200000,41.2,Foul: Shooting,TJ Warren,Anthony Davis,INC,Warren (PHO) makes contact with Davis' (NOP) arm on the shot attempt.,http://official.nba.com/last-two-minute-report/?gameNo=0021600829&eventNum=1133,20170213NOPPHO,20170213NOPPHO-10,NOP,PHO,
Q4,0:00:36.500000,36.5,Foul: Offensive,Tyson Chandler,Jrue Holiday,INC,Chandler (PHO) extends his arms into Holiday (NOP) on the screen.,http://official.nba.com/last-two-minute-report/?gameNo=0021600829&eventNum=1134,20170213NOPPHO,20170213NOPPHO-11,NOP,PHO,
Q4,0:00:24.800000,24.8,Foul: Shooting,Anthony Davis,Eric Bledsoe,CNC,Davis (NOP) allows Bledsoe (PHO) to land following the jump shot attempt.,http://official.nba.com/last-two-minute-report/?gameNo=0021600829&eventNum=1135,20170213NOPPHO,20170213NOPPHO-12,PHO,NOP,
Q4,0:00:24,24,Foul: Loose Ball,Jrue Holiday,PJ Tucker,CNC,Holiday (NOP) and Tucker (PHO) make incidental contact with one another during rebounding.,http://official.nba.com/last-two-minute-report/?gameNo=0021600829&eventNum=1136,20170213NOPPHO,20170213NOPPHO-13,PHO,NOP,
Q4,0:00:18.400000,18.4,Foul: Personal,Tyson Chandler,Tyreke Evans,CC,Chandler (PHO) commits a take foul on Evans (NOP).,http://official.nba.com/last-two-minute-report/?gameNo=0021600829&eventNum=569,20170213NOPPHO,20170213NOPPHO-14,NOP,PHO,
Q4,0:00:16.800000,16.8,Foul: Personal,Jrue Holiday,Eric Bledsoe,CC,Holiday (NOP) commits a take foul on Bledsoe (PHO).,http://official.nba.com/last-two-minute-report/?gameNo=0021600829&eventNum=579,20170213NOPPHO,20170213NOPPHO-15,PHO,NOP,
Q4,0:00:12.800000,12.8,Foul: Shooting,Jrue Holiday,Eric Bledsoe,CNC,Holiday (NOP) maintains legal guarding position on the drive to the basket by Bledsoe (PHO).,http://official.nba.com/last-two-minute-report/?gameNo=0021600829&eventNum=1137,20170213NOPPHO,20170213NOPPHO-16,PHO,NOP,
Q4,0:00:08.800000,8.8,Foul: Shooting,Anthony Davis,PJ Tucker,CNC,Davis (NOP) maintains legal guarding position on the shot attempt by Tucker (PHO).,http://official.nba.com/last-two-minute-report/?gameNo=0021600829&eventNum=1138,20170213NOPPHO,20170213NOPPHO-17,PHO,NOP,
Q4,0:00:05.500000,5.5,Foul: Shooting,Anthony Davis,PJ Tucker,CNC,Davis (NOP) maintains legal guarding position on the shot attempt by Tucker (PHO).,http://official.nba.com/last-two-minute-report/?gameNo=0021600829&eventNum=1139,20170213NOPPHO,20170213NOPPHO-18,PHO,NOP,
Q4,0:01:54,114,Foul: Offensive,Nikola Vucevic,Goran Dragic,CNC,Vucevic (ORL) sets the screen on Dragic (MIA) and gives him room to avoid the contact.,http://official.nba.com/last-two-minute-report/?gameNo=0021600823&eventNum=1106,20170213ORLMIA,20170213ORLMIA-0,MIA,ORL,
Q4,0:01:42,102,Instant Replay: Support Ruling,,,CC,"After communicating with the Replay Center, Ibaka (ORL) is assessed a common foul.",http://official.nba.com/last-two-minute-report/?gameNo=0021600823&eventNum=535,20170213ORLMIA,20170213ORLMIA-1,,,
Q4,0:01:42,102,Foul: Shooting,Serge Ibaka,Goran Dragic,CC,Ibaka (ORL) makes contact to Dragic's (MIA) body that affects his shot attempt in transition.,http://official.nba.com/last-two-minute-report/?gameNo=0021600823&eventNum=534,20170213ORLMIA,20170213ORLMIA-2,MIA,ORL,
Q4,0:01:33,93,Foul: Defense 3 Second,James Johnson,,,[Incidental or immaterial] Johnson (MIA) never fully clears the lane and is not actively guarding an opponent for longer than three seconds.,http://official.nba.com/last-two-minute-report/?gameNo=0021600823&eventNum=1107,20170213ORLMIA,20170213ORLMIA-3,ORL,MIA,
Q4,0:01:31,91,Foul: Shooting,Tyler Johnson,Evan Fournier,CNC,Johnson (MIA) maintains legal guarding position and makes incidental contact with Fournier (ORL) that does not affect his drive to the basket and shot attempt.,http://official.nba.com/last-two-minute-report/?gameNo=0021600823&eventNum=1108,20170213ORLMIA,20170213ORLMIA-4,ORL,MIA,
Q4,0:01:02,62,Foul: Shooting,Tyler Johnson,Evan Fournier,CNC,Johnson (MIA) legally contests Fournier's (ORL) jump shot attempt.,http://official.nba.com/last-two-minute-report/?gameNo=0021600823&eventNum=1109,20170213ORLMIA,20170213ORLMIA-5,ORL,MIA,
Q4,0:00:40.100000,40.1,Foul: Personal,Hassan Whiteside,Evan Fournier,CNC,Whiteside (MIA) makes legal contact with the ball.,http://official.nba.com/last-two-minute-report/?gameNo=0021600823&eventNum=1111,20170213ORLMIA,20170213ORLMIA-6,ORL,MIA,
Q4,0:00:28.700000,28.7,Foul: Shooting,Serge Ibaka,James Johnson,CNC,Ibaka (ORL) maintains legal guarding position on the driving shot attempt by Johnson (MIA).,http://official.nba.com/last-two-minute-report/?gameNo=0021600823&eventNum=1112,20170213ORLMIA,20170213ORLMIA-7,MIA,ORL,
Q4,0:00:25.300000,25.3,Foul: Personal,James Johnson,Nikola Vucevic,CC,Johnson (MIA) commits a take foul on Vucevic (ORL).,http://official.nba.com/last-two-minute-report/?gameNo=0021600823&eventNum=551,20170213ORLMIA,20170213ORLMIA-8,ORL,MIA,
Q4,0:00:22.700000,22.7,Foul: Shooting,Evan Fournier,Dion Waiters,CNC,"Fournier (ORL) legally contests Waiters' (MIA) jump shot attempt. Any ""high-five"" contact after the release is considered incidental.",http://official.nba.com/last-two-minute-report/?gameNo=0021600823&eventNum=1113,20170213ORLMIA,20170213ORLMIA-9,MIA,ORL,
Q4,0:00:19.400000,19.4,Foul: Personal,Tyler Johnson,Serge Ibaka,CC,Johnson (MIA) commits a take foul on Ibaka (ORL).,http://official.nba.com/last-two-minute-report/?gameNo=0021600823&eventNum=562,20170213ORLMIA,20170213ORLMIA-10,ORL,MIA,
Q4,0:01:45,105,Foul: Offensive,Kawhi Leonard,Jeff Teague,,Leonard (SAS) makes marginal contact with Teague (IND) on the screen.,http://official.nba.com/last-two-minute-report/?gameNo=0021600825&eventNum=1029,20170213SASIND,20170213SASIND-0,IND,SAS,
Q4,0:01:44,104,Foul: Defense 3 Second,Kevin Seraphin,,INC,Seraphin (IND) is in the paint without actively guarding an opponent for longer than three seconds.,http://official.nba.com/last-two-minute-report/?gameNo=0021600825&eventNum=1030,20170213SASIND,20170213SASIND-1,SAS,IND,
Q4,0:01:40,100,Foul: Personal,Paul George,Kawhi Leonard,CNC,RHH shows that George (IND) makes legal contact with the ball.,http://official.nba.com/last-two-minute-report/?gameNo=0021600825&eventNum=1031,20170213SASIND,20170213SASIND-2,SAS,IND,
Q4,0:01:35,95,Foul: Shooting,Paul George,Kawhi Leonard,CNC,George (IND) avoids making contact with Leonard (SAS) on the jump shot attempt.,http://official.nba.com/last-two-minute-report/?gameNo=0021600825&eventNum=1032,20170213SASIND,20170213SASIND-3,SAS,IND,
Q4,0:01:32,92,Foul: Loose Ball,Myles Turner,LaMarcus Aldridge,CC,"Turner (IND) clamps the arm of Aldridge (SAS), affecting his ability to retrieve the rebound.",http://official.nba.com/last-two-minute-report/?gameNo=0021600825&eventNum=503,20170213SASIND,20170213SASIND-4,SAS,IND,
Q4,0:01:23,83,Foul: Personal,Kawhi Leonard,Paul George,CNC,Leonard (SAS) briefly engages with George (IND) off ball.,http://official.nba.com/last-two-minute-report/?gameNo=0021600825&eventNum=1033,20170213SASIND,20170213SASIND-5,IND,SAS,
Q4,0:01:02,62,Foul: Defense 3 Second,Kevin Seraphin,,,[Incidental or immaterial] Seraphin (IND) is in the paint without actively guarding an opponent for longer than three seconds.,http://official.nba.com/last-two-minute-report/?gameNo=0021600825&eventNum=1034,20170213SASIND,20170213SASIND-6,SAS,IND,
Q4,0:00:56.700000,56.7,Turnover: Traveling,Dewayne Dedmon,,INC,Dedmon (SAS) moves his pivot foot heel to toe.,http://official.nba.com/last-two-minute-report/?gameNo=0021600825&eventNum=1035,20170213SASIND,20170213SASIND-7,IND,SAS,
Q4,0:00:52.200000,52.2,Foul: Shooting,Myles Turner,LaMarcus Aldridge,CC,Turner (IND) makes contact to Aldridge (SAS) that affects his catch and finish shot attempt.,http://official.nba.com/last-two-minute-report/?gameNo=0021600825&eventNum=510,20170213SASIND,20170213SASIND-8,SAS,IND,
Q4,0:00:48.800000,48.8,Foul: Personal,LaMarcus Aldridge,Paul George,CC,Aldridge (SAS) makes contact to George (IND) that affects his FOM off ball.,http://official.nba.com/last-two-minute-report/?gameNo=0021600825&eventNum=517,20170213SASIND,20170213SASIND-9,IND,SAS,
Q4,0:00:37.900000,37.9,Foul: Defense 3 Second,Kevin Seraphin,,INC,Seraphin (IND) is in the paint without actively guarding an opponent for longer than three seconds.,http://official.nba.com/last-two-minute-report/?gameNo=0021600825&eventNum=1036,20170213SASIND,20170213SASIND-10,SAS,IND,
Q4,0:00:32.600000,32.6,Foul: Personal,Paul George,Kawhi Leonard,CNC,George (IND) maintains legal guarding position on the drive to the basket by Leonard (SAS).,http://official.nba.com/last-two-minute-report/?gameNo=0021600825&eventNum=1037,20170213SASIND,20170213SASIND-11,SAS,IND,
Q4,0:00:29.100000,29.1,Foul: Personal,Kawhi Leonard,Paul George,CNC,Leonard (SAS) cleanly strips the ball from George (IND).,http://official.nba.com/last-two-minute-report/?gameNo=0021600825&eventNum=1038,20170213SASIND,20170213SASIND-12,IND,SAS,
Q4,0:00:23.500000,23.5,Foul: Personal,Jeff Teague,Tony Parker,CC,Teague (IND) commits a take foul on Parker (SAS).,http://official.nba.com/last-two-minute-report/?gameNo=0021600825&eventNum=527,20170213SASIND,20170213SASIND-13,SAS,IND,
Q4,0:00:22.700000,22.7,Foul: Shooting,LaMarcus Aldridge,Paul George,CNC,"Aldridge (SAS) legally contests George's (IND) jump shot attempt. Any ""high-five"" contact after the release is considered incidental.",http://official.nba.com/last-two-minute-report/?gameNo=0021600825&eventNum=1039,20170213SASIND,20170213SASIND-14,IND,SAS,
Q4,0:00:20.400000,20.4,Foul: Personal,CJ Miles,Kawhi Leonard,CC,Miles (IND) commits a take foul on Leonard (SAS).,http://official.nba.com/last-two-minute-report/?gameNo=0021600825&eventNum=538,20170213SASIND,20170213SASIND-15,SAS,IND,
Q4,0:00:04.500000,4.5,Foul: Personal,Myles Turner,Danny Green,CC,Turner (IND) commits a take foul on Green (SAT),http://official.nba.com/last-two-minute-report/?gameNo=0021600825&eventNum=548,20170213SASIND,20170213SASIND-16,SAT,IND,
