period,time,seconds_left,call_type,committing_player,disadvantaged_player,review_decision,comment,video,game_id,play_id,disadvantaged_team,committing_team,ref_made_call
Q4,0:01:50,110,Foul: Loose Ball,Giannis Antetokounmpo,Domantas Sabonis,CNC,Antetokounmpo (MIL) and Sabonis (IND) make incidental contact with each other during rebounding. 01:50.1 01:50.1,http://official.nba.com/last-two-minute-report/?gameNo=0021700932&eventNum=1047,20180302INDMIL,20180302INDMIL-3,IND,MIL,
Q4,0:01:32,92,Foul: Shooting,John Henson,Victor Oladipo,CNC,Henson (MIL) maintains legal guarding position on Oladipo's (IND) driving shot attempt. 01:30.1 01:30.1,http://official.nba.com/last-two-minute-report/?gameNo=0021700932&eventNum=1048,20180302INDMIL,20180302INDMIL-4,IND,MIL,
Q4,0:01:28,88,Foul: Personal,Cory Joseph,Eric Bledsoe,CC,Joseph (IND) makes body to body contact with Bledsoe (MIL) that affects his SQBR prior to his gather. 01:28.1 01:28.1,http://official.nba.com/last-two-minute-report/?gameNo=0021700932&eventNum=623,20180302INDMIL,20180302INDMIL-5,MIL,IND,
Q4,0:01:15,75,Foul: Shooting,John Henson,Victor Oladipo,CNC,Henson (MIL) legally contests Oladipo's (IND) jump shot attempt. 01:13.1 01:13.1,http://official.nba.com/last-two-minute-report/?gameNo=0021700932&eventNum=1049,20180302INDMIL,20180302INDMIL-6,IND,MIL,
Q4,0:01:06,66,Foul: Personal,Domantas Sabonis,John Henson,CNC,Sabonis (IND) makes marginal contact with Henson (MIL) that does not affect his FOM.,http://official.nba.com/last-two-minute-report/?gameNo=0021700932&eventNum=1050,20180302INDMIL,20180302INDMIL-7,MIL,IND,
Q4,0:01:04,64,Foul: Offensive,John Henson,Bojan Bogdanovic,CNC,Henson (MIL) sets the screen on Bogdanovic (IND) and does not deliver the contact.,http://official.nba.com/last-two-minute-report/?gameNo=0021700932&eventNum=1051,20180302INDMIL,20180302INDMIL-8,IND,MIL,
Q4,0:01:02,62,Foul: Shooting,Domantas Sabonis,Khris Middleton,CC,Sabonis (IND) makes contact to Middleton's (MIL) body that affects his driving shot attempt. 01:02.1 01:02.1,http://official.nba.com/last-two-minute-report/?gameNo=0021700932&eventNum=631,20180302INDMIL,20180302INDMIL-9,MIL,IND,
Q4,0:00:46.100000,46.1,Foul: Loose Ball,Khris Middleton,Thaddeus Young,CNC,Middleton (MIL) makes incidental contact with Young (IND) during rebounding. Period 00:43.5 00:43.5,http://official.nba.com/last-two-minute-report/?gameNo=0021700932&eventNum=1052,20180302INDMIL,20180302INDMIL-10,IND,MIL,
Q4,0:00:37.300000,37.3,Foul: Personal,Bojan Bogdanovic,John Henson,CNC,Bogdanovic (IND) makes marginal contact with Henson (MIL) after the screen. 00:30.3 00:30.3,http://official.nba.com/last-two-minute-report/?gameNo=0021700932&eventNum=1053,20180302INDMIL,20180302INDMIL-11,MIL,IND,
Q4,0:00:20.800000,20.8,Foul: Personal,Jason Terry,Victor Oladipo,CC,Terry (MIL) commits a take foul on Oladipo (IND). 00:20.9 00:20.9,http://official.nba.com/last-two-minute-report/?gameNo=0021700932&eventNum=641,20180302INDMIL,20180302INDMIL-12,IND,MIL,
Q4,0:00:13.600000,13.6,Foul: Shooting,Cory Joseph,Eric Bledsoe,CNC,Joseph (IND) legally contests Bledsoe's (MIL) jump shot attempt.,http://official.nba.com/last-two-minute-report/?gameNo=0021700932&eventNum=1054,20180302INDMIL,20180302INDMIL-13,MIL,IND,
Q4,0:00:11.400000,11.4,Foul: Shooting,Myles Turner,Giannis Antetokounmpo,CNC,Turner (IND) makes incidental contact with Antetokounmpo (MIL) that does not affect his dunk. 00:10.9 00:10.9,http://official.nba.com/last-two-minute-report/?gameNo=0021700932&eventNum=1055,20180302INDMIL,20180302INDMIL-14,MIL,IND,
Q4,0:00:08.900000,8.9,Foul: Personal,Giannis Antetokounmpo,Bojan Bogdanovic,CC,Antetokounmpo (MIL) commits a take foul on Bogdanovic (IND).,http://official.nba.com/last-two-minute-report/?gameNo=0021700932&eventNum=649,20180302INDMIL,20180302INDMIL-15,IND,MIL,
Q4,0:00:08.900000,8.9,Foul: Offensive,John Henson,Bojan Bogdanovic,CNC,Henson (MIL) sets the screen on Bogdanovic (IND) and gives him room to avoid the contact. 00:09.0 00:09.0,http://official.nba.com/last-two-minute-report/?gameNo=0021700932&eventNum=1056,20180302INDMIL,20180302INDMIL-16,IND,MIL,
Q4,0:00:08.200000,8.2,Foul: Shooting,Bojan Bogdanovic,Khris Middleton,CNC,Bogdanovic (IND) legally contests Middleton's (MIL) jump shot attempt.,http://official.nba.com/last-two-minute-report/?gameNo=0021700932&eventNum=1057,20180302INDMIL,20180302INDMIL-17,MIL,IND,
Q4,0:00:06.300000,6.3,Foul: Loose Ball,Giannis Antetokounmpo,Thaddeus Young,CNC,Antetokounmpo (MIL) and Young (IND) make incidental contact with one another during rebounding.,http://official.nba.com/last-two-minute-report/?gameNo=0021700932&eventNum=1058,20180302INDMIL,20180302INDMIL-18,IND,MIL,
Q4,0:00:04.100000,4.1,Foul: Personal,Khris Middleton,Bojan Bogdanovic,CC,Middleton (MIL) commits a take foul on Bogdanovic (IND). 00:00.1 00:00.1,http://official.nba.com/last-two-minute-report/?gameNo=0021700932&eventNum=656,20180302INDMIL,20180302INDMIL-19,IND,MIL,
Q4,0:00:00,0,Instant Replay: Support Ruling,,,CC,"After communicating with the Replay Center, the ruling on the floor of no basket is confirmed. Event Assessments: CC = Correct Call, IC = Incorrect Call, CNC = Correct Non-Call, INC = Incorrect Non-Call",http://official.nba.com/last-two-minute-report/?gameNo=0021700932&eventNum=661,20180302INDMIL,20180302INDMIL-20,,,
Q4,0:01:54,114,Foul: Shooting,Alex Len,Paul George,INC,Len (PHO) makes contact to George's (OKC) arm and body that affects his driving shot attempt.,http://official.nba.com/last-two-minute-report/?gameNo=0021700933&eventNum=1057,20180302OKCPHO,20180302OKCPHO-0,OKC,PHO,
Q4,0:01:53,113,Foul: Loose Ball,Elfrid Payton,Russell Westbrook,CNC,Payton (PHO) makes incidental contact with Westbrook (OKC) during rebounding.,http://official.nba.com/last-two-minute-report/?gameNo=0021700933&eventNum=1057,20180302OKCPHO,20180302OKCPHO-1,OKC,PHO,
Q4,0:01:52,112,Instant Replay: Overturn Ruling,,,CC,"After communicating with the Replay Center, the ruling on the floor of Thunder possession is overturned to Suns possession. 01:52.1 01:52.1",http://official.nba.com/last-two-minute-report/?gameNo=0021700933&eventNum=654,20180302OKCPHO,20180302OKCPHO-2,,,
Q4,0:01:44,104,Foul: Offensive,Alex Len,Paul George,CNC,Len (PHO) sets the screen on George (OKC) and gives him room to avoid the contact.,http://official.nba.com/last-two-minute-report/?gameNo=0021700933&eventNum=1058,20180302OKCPHO,20180302OKCPHO-3,OKC,PHO,
Q4,0:01:40,100,Foul: Personal,Steven Adams,Alex Len,CC,Adams (OKC) makes body to body contact with Len (PHO) that affects his SQBR. 01:40.1 01:40.1,http://official.nba.com/last-two-minute-report/?gameNo=0021700933&eventNum=656,20180302OKCPHO,20180302OKCPHO-4,PHO,OKC,
Q4,0:01:35,95,Foul: Offensive,Steven Adams,Elfrid Payton,CNC,Adams (OKC) sets the screen on Payton (PHO) and gives him room to avoid the contact.,http://official.nba.com/last-two-minute-report/?gameNo=0021700933&eventNum=1059,20180302OKCPHO,20180302OKCPHO-5,PHO,OKC,
Q4,0:01:34,94,Foul: Shooting,Alex Len,Russell Westbrook,CNC,Len (PHO) obtains a legal guarding position and jumps vertically as he contests Westbrook's (OKC) driving shot attempt. 01:32.1 01:32.1,http://official.nba.com/last-two-minute-report/?gameNo=0021700933&eventNum=1060,20180302OKCPHO,20180302OKCPHO-6,OKC,PHO,
Q4,0:01:13,73,Foul: Shooting,Paul George,Elfrid Payton,CNC,George (OKC) legally contests Payton's (PHO) jump shot attempt.,http://official.nba.com/last-two-minute-report/?gameNo=0021700933&eventNum=1061,20180302OKCPHO,20180302OKCPHO-7,PHO,OKC,
Q4,0:01:11,71,Foul: Loose Ball,Alex Len,Steven Adams,CNC,Len (PHO) and Adams (OKC) briefly engage and separate during rebounding. 01:08.1 01:08.1,http://official.nba.com/last-two-minute-report/?gameNo=0021700933&eventNum=1062,20180302OKCPHO,20180302OKCPHO-8,OKC,PHO,
Q4,0:01:02,62,Foul: Offensive,Steven Adams,Josh Jackson,CNC,Adams (OKC) sets the screen on Jackson (PHO) and does not deliver the contact.,http://official.nba.com/last-two-minute-report/?gameNo=0021700933&eventNum=1063,20180302OKCPHO,20180302OKCPHO-9,PHO,OKC,
Q4,0:00:59.600000,59.6,Foul: Defense 3 Second,Devin Booker,,,[Observable in enhanced video] Booker (PHO) never fully clears and is in the lane without actively guarding an opponent for longer than three seconds.,http://official.nba.com/last-two-minute-report/?gameNo=0021700933&eventNum=1064,20180302OKCPHO,20180302OKCPHO-10,OKC,PHO,
Q4,0:00:57.400000,57.4,Foul: Shooting,Alex Len,Russell Westbrook,CNC,Len (PHO) legally contests Westbrook's (OKC) jump shot attempt.,http://official.nba.com/last-two-minute-report/?gameNo=0021700933&eventNum=1065,20180302OKCPHO,20180302OKCPHO-11,OKC,PHO,
Q4,0:00:56,56,Foul: Personal,Paul George,Devin Booker,CNC,George (OKC) makes incidental contact with Booker (PHO) that does not affect his FOM. Period 00:56.1 00:56.1,http://official.nba.com/last-two-minute-report/?gameNo=0021700933&eventNum=1066,20180302OKCPHO,20180302OKCPHO-12,PHO,OKC,
Q4,0:00:46.600000,46.6,Foul: Loose Ball,Steven Adams,Devin Booker,CNC,Adams (OKC) and Booker (PHO) make incidental contact with each other during rebounding.,http://official.nba.com/last-two-minute-report/?gameNo=0021700933&eventNum=1067,20180302OKCPHO,20180302OKCPHO-13,PHO,OKC,
Q4,0:00:44.800000,44.8,Foul: Personal,Elfrid Payton,Jerami Grant,CNC,Payton (PHO) makes incidental contact with Grant (OKC) that does not affect his SQBR. 00:44.6 00:44.6,http://official.nba.com/last-two-minute-report/?gameNo=0021700933&eventNum=1068,20180302OKCPHO,20180302OKCPHO-14,OKC,PHO,
Q4,0:00:29,29,Foul: Shooting,Elfrid Payton,Russell Westbrook,CNC,"Payton (PHO) legally contests Westbrook's (OKC) jump shot attempt. Any ""high-five"" contact after the release is considered incidental.",http://official.nba.com/last-two-minute-report/?gameNo=0021700933&eventNum=1069,20180302OKCPHO,20180302OKCPHO-15,OKC,PHO,
Q4,0:00:27.200000,27.2,Foul: Loose Ball,Steven Adams,Dragan Bender,CNC,Adams (OKC) and Bender (PHO) make incidental contact with each other during rebounding.,http://official.nba.com/last-two-minute-report/?gameNo=0021700933&eventNum=1070,20180302OKCPHO,20180302OKCPHO-16,PHO,OKC,
Q4,0:00:25.600000,25.6,Foul: Shooting,Elfrid Payton,Russell Westbrook,CNC,Payton (PHO) legally contests Westbrook's (OKC) shot attempt.,http://official.nba.com/last-two-minute-report/?gameNo=0021700933&eventNum=1071,20180302OKCPHO,20180302OKCPHO-17,OKC,PHO,
Q4,0:00:19,19,Foul: Personal,Devin Booker,Jerami Grant,CC,Booker (PHO) commits a take foul on Grant (OKC).,http://official.nba.com/last-two-minute-report/?gameNo=0021700933&eventNum=684,20180302OKCPHO,20180302OKCPHO-18,OKC,PHO,
Q4,0:00:19,19,Foul: Personal,Shaquille Harrison,Russell Westbrook,CNC,"Harrison (PHO) briefly grasps Westbrook's (OKC) jersey, but does not affect his FOM.",http://official.nba.com/last-two-minute-report/?gameNo=0021700933&eventNum=1072,20180302OKCPHO,20180302OKCPHO-19,OKC,PHO,
Q4,0:00:18.200000,18.2,Foul: Personal,Shaquille Harrison,Russell Westbrook,CC,Harrison (PHO) commits a take foul on Westbrook (OKC). 00:18.3 00:18.3,http://official.nba.com/last-two-minute-report/?gameNo=0021700933&eventNum=690,20180302OKCPHO,20180302OKCPHO-20,OKC,PHO,
Q4,0:00:16.200000,16.2,Foul: Offensive,Dragan Bender,Paul George,CNC,Bender (PHO) sets the screen on George (OKC) and gives him room to avoid the contact.,http://official.nba.com/last-two-minute-report/?gameNo=0021700933&eventNum=1073,20180302OKCPHO,20180302OKCPHO-21,OKC,PHO,
Q4,0:00:15.300000,15.3,Foul: Personal,Carmelo Anthony,Devin Booker,CNC,Anthony (OKC) cleanly deflects the ball away from Booker (PHO). 00:10.9 00:10.9,http://official.nba.com/last-two-minute-report/?gameNo=0021700933&eventNum=1074,20180302OKCPHO,20180302OKCPHO-22,PHO,OKC,
Q4,0:00:05.400000,5.4,Foul: Offensive,Elfrid Payton,Paul George,CNC,Payton (PHO) makes incidental contact with George (OKC) during the driving shot attempt.,http://official.nba.com/last-two-minute-report/?gameNo=0021700933&eventNum=1075,20180302OKCPHO,20180302OKCPHO-23,OKC,PHO,
Q4,0:00:04.400000,4.4,Foul: Shooting,Steven Adams,Elfrid Payton,CNC,Adams (OKC) cleanly blocks Payton's (PHO) driving shot attempt.,http://official.nba.com/last-two-minute-report/?gameNo=0021700933&eventNum=1076,20180302OKCPHO,20180302OKCPHO-24,PHO,OKC,
Q4,0:00:01.500000,1.5,Foul: Personal,Elfrid Payton,Carmelo Anthony,CC,"Payton (PHO) commits a take foul on Anthony (OKC). Event Assessments: CC = Correct Call, IC = Incorrect Call, CNC = Correct Non-Call, INC = Incorrect Non-Call",http://official.nba.com/last-two-minute-report/?gameNo=0021700933&eventNum=707,20180302OKCPHO,20180302OKCPHO-25,OKC,PHO,
