period,time,seconds_left,call_type,committing_player,disadvantaged_player,review_decision,comment,video,game_id,play_id,away,home,date,ref_1,ref_2,ref_3,score_away,score_home,original_pdf,box_score_url,disadvantaged_team,committing_team
Q4,01:36.0,96,Turnover: 3 Second Violation,Allen Crabbe,,,[Incidental or immaterial] Crabbe (POR) is in the paint for longer than three seconds.,http://official.nba.com/last-two-minute-report/?gameNo=0021500457&eventNum=1270,20151227PORSAC,20151227PORSAC-0,POR,SAC,20151227,Steve Anderson,Matt Boland,Derrick Stafford,98,94,L2M-POR-SAC-12-27-2015.pdf,http://www.basketball-reference.com/boxscores/201512270SAC.html,SAC,POR
Q4,01:31.0,91,Foul: Shooting,Rajon Rondo,CJ McCollum,CNC,R-Slash shows Rondo (SAC) gets his hands on the ball and cleanly strips McCollum (POR).,http://official.nba.com/last-two-minute-report/?gameNo=0021500457&eventNum=531,20151227PORSAC,20151227PORSAC-1,POR,SAC,20151227,Steve Anderson,Matt Boland,Derrick Stafford,98,94,L2M-POR-SAC-12-27-2015.pdf,http://www.basketball-reference.com/boxscores/201512270SAC.html,POR,SAC
Q4,01:22.0,82,Turnover: Traveling,Marco Belinelli,,,"[Observable in enhanced video] Belinelli (SAC) gathers the ball in the air, landing on both feet. He can use either foot to pivot. Stepping back with his left, he establishes his",http://official.nba.com/last-two-minute-report/?gameNo=0021500457&eventNum=549,20151227PORSAC,20151227PORSAC-2,POR,SAC,20151227,Steve Anderson,Matt Boland,Derrick Stafford,98,94,L2M-POR-SAC-12-27-2015.pdf,http://www.basketball-reference.com/boxscores/201512270SAC.html,POR,SAC
Q4,01:07.0,67,Foul: Shooting,Tim Frazier,DeMarcus Cousins,CC,"Frazier (POR) makes contact to Cousins' (SAC) arm, affecting his shot.",http://official.nba.com/last-two-minute-report/?gameNo=0021500457&eventNum=550,20151227PORSAC,20151227PORSAC-3,POR,SAC,20151227,Steve Anderson,Matt Boland,Derrick Stafford,98,94,L2M-POR-SAC-12-27-2015.pdf,http://www.basketball-reference.com/boxscores/201512270SAC.html,SAC,POR
Q4,00:23.5,23.5,Foul: Personal,Omri Casspi,Allen Crabbe,CC,Casspi (SAC) commits a take foul on Crabbe (POR).,http://official.nba.com/last-two-minute-report/?gameNo=0021500457&eventNum=558,20151227PORSAC,20151227PORSAC-4,POR,SAC,20151227,Steve Anderson,Matt Boland,Derrick Stafford,98,94,L2M-POR-SAC-12-27-2015.pdf,http://www.basketball-reference.com/boxscores/201512270SAC.html,POR,SAC
Q4,00:20.0,20,Foul: Personal,Darren Collison,CJ McCollum,CC,Collison (SAC) commits a take foul on McCollum (POR).,http://official.nba.com/last-two-minute-report/?gameNo=0021500457&eventNum=1271,20151227PORSAC,20151227PORSAC-5,POR,SAC,20151227,Steve Anderson,Matt Boland,Derrick Stafford,98,94,L2M-POR-SAC-12-27-2015.pdf,http://www.basketball-reference.com/boxscores/201512270SAC.html,POR,SAC
Q4,00:12.5,12.5,Foul: Personal,Rajon Rondo,Meyers Leonard,CC,Rondo (SAC) commits a take foul on Leonard (POR).,,20151227PORSAC,20151227PORSAC-6,POR,SAC,20151227,Steve Anderson,Matt Boland,Derrick Stafford,98,94,L2M-POR-SAC-12-27-2015.pdf,http://www.basketball-reference.com/boxscores/201512270SAC.html,POR,SAC
Q4,00:02.0,2,Foul: Shooting,Maurice Harkless,Rudy Gay,CNC,"LHH shows Harkless (POR) makes contact with the ball first on tip-back by Gay (SAC), followed by incidental contact to his hand/arm.",,20151227PORSAC,20151227PORSAC-7,POR,SAC,20151227,Steve Anderson,Matt Boland,Derrick Stafford,98,94,L2M-POR-SAC-12-27-2015.pdf,http://www.basketball-reference.com/boxscores/201512270SAC.html,SAC,POR