period,time,seconds_left,call_type,committing_player,disadvantaged_player,review_decision,comment,video,game_id,play_id,away,home,date,ref_1,ref_2,ref_3,score_away,score_home,original_pdf,box_score_url,disadvantaged_team,committing_team
Q4,01:53.0,113,Foul: Shooting,Robert Covington,Andrea Bargnani,CC,LATR shows that Covington (PHI) makes contact with Bargnani's (BKN) arm that affects his drive to the basket and shot attempt.,http://official.nba.com/last-two-minute-report/?gameNo=0021500329&eventNum=514,20151210PHIBKN,20151210PHIBKN-0,PHI,BKN,20151210,Kevin Cutler,Rodney Mott,Sean Wright,91,100,L2M-PHI-BKN-12-10-15.pdf,http://www.basketball-reference.com/boxscores/201512100BRK.html,BKN,PHI
Q4,01:49.0,109,Foul: Offensive,Jahlil Okafor,Shane Larkin,CNC,Okafor (PHI) sets the screen on Larkin (BKN) and gives him room to avoid the contact.,http://official.nba.com/last-two-minute-report/?gameNo=0021500329&eventNum=1221,20151210PHIBKN,20151210PHIBKN-1,PHI,BKN,20151210,Kevin Cutler,Rodney Mott,Sean Wright,91,100,L2M-PHI-BKN-12-10-15.pdf,http://www.basketball-reference.com/boxscores/201512100BRK.html,BKN,PHI
Q4,01:44.0,104,Foul: Shooting,Thaddeus Young,Isaiah Canaan,CNC,Young (BKN) maintains legal guarding position as he defends Canaan's (PHI) driving shot attempt.,http://official.nba.com/last-two-minute-report/?gameNo=0021500329&eventNum=1222,20151210PHIBKN,20151210PHIBKN-2,PHI,BKN,20151210,Kevin Cutler,Rodney Mott,Sean Wright,91,100,L2M-PHI-BKN-12-10-15.pdf,http://www.basketball-reference.com/boxscores/201512100BRK.html,PHI,BKN
Q4,01:10.0,70,Foul: Offensive,Hollis Thompson,Andrea Bargnani,CNC,Thompson (PHI) sets the screen on Bargnani (BKN) and gives him room to avoid the contact.,http://official.nba.com/last-two-minute-report/?gameNo=0021500329&eventNum=1223,20151210PHIBKN,20151210PHIBKN-3,PHI,BKN,20151210,Kevin Cutler,Rodney Mott,Sean Wright,91,100,L2M-PHI-BKN-12-10-15.pdf,http://www.basketball-reference.com/boxscores/201512100BRK.html,BKN,PHI
Q4,01:04.0,64,Foul: Shooting,Andrea Bargnani,Jahlil Okafor,CNC,Bargnani (BKN) maintains legal guarding position on the jump shot by Okafor (PHI).,http://official.nba.com/last-two-minute-report/?gameNo=0021500329&eventNum=1224,20151210PHIBKN,20151210PHIBKN-4,PHI,BKN,20151210,Kevin Cutler,Rodney Mott,Sean Wright,91,100,L2M-PHI-BKN-12-10-15.pdf,http://www.basketball-reference.com/boxscores/201512100BRK.html,PHI,BKN
Q4,00:50.6,50.6,Foul: Offensive,Andrea Bargnani,Hollis Thompson,CNC,Bargnani (BKN) sets the screen on Thompson (PHI) and gives him room to avoid the contact.,http://official.nba.com/last-two-minute-report/?gameNo=0021500329&eventNum=1225,20151210PHIBKN,20151210PHIBKN-5,PHI,BKN,20151210,Kevin Cutler,Rodney Mott,Sean Wright,91,100,L2M-PHI-BKN-12-10-15.pdf,http://www.basketball-reference.com/boxscores/201512100BRK.html,PHI,BKN
Q4,00:30.7,30.7,Foul: Personal,Jerami Grant,Thaddeus Young,CC,Grant (PHI) commits a take foul on Young (BKN).,http://official.nba.com/last-two-minute-report/?gameNo=0021500329&eventNum=532,20151210PHIBKN,20151210PHIBKN-6,PHI,BKN,20151210,Kevin Cutler,Rodney Mott,Sean Wright,91,100,L2M-PHI-BKN-12-10-15.pdf,http://www.basketball-reference.com/boxscores/201512100BRK.html,BKN,PHI
Q4,00:28.1,28.1,Foul: Offensive,Jerami Grant,Shane Larkin,CNC,Grant (PHI) sets the screen on Larkin (BKN) and gives him room to avoid the contact.,http://official.nba.com/last-two-minute-report/?gameNo=0021500329&eventNum=1226,20151210PHIBKN,20151210PHIBKN-7,PHI,BKN,20151210,Kevin Cutler,Rodney Mott,Sean Wright,91,100,L2M-PHI-BKN-12-10-15.pdf,http://www.basketball-reference.com/boxscores/201512100BRK.html,BKN,PHI
Q4,00:24.6,24.6,Foul: Shooting,Shane Larkin,Isaiah Canaan,CNC,"Larkin (BKN) legally contests Canaan's (PHI) jump shot attempt. Any ""high-five"" contact after the ball has been released is considered incidental.",http://official.nba.com/last-two-minute-report/?gameNo=0021500329&eventNum=1227,20151210PHIBKN,20151210PHIBKN-8,PHI,BKN,20151210,Kevin Cutler,Rodney Mott,Sean Wright,91,100,L2M-PHI-BKN-12-10-15.pdf,http://www.basketball-reference.com/boxscores/201512100BRK.html,PHI,BKN