period,time,seconds_left,call_type,committing_player,disadvantaged_player,review_decision,comment,video,game_id,play_id,away,home,date,ref_1,ref_2,ref_3,score_away,score_home,original_pdf,box_score_url,disadvantaged_team,committing_team
Q4,01:45.0,105,Foul: Personal,Rodney Hood,Anthony Davis,CC,Hood (UTA) makes contact with Davis (NOP) that affects his FOM.,http://official.nba.com/last-two-minute-report/?gameNo=0021500798&eventNum=467,20160210UTANOP,20160210UTANOP-0,UTA,NOP,20160210,Eric Lewis,Rodney Mott,Derek Richardson,96,100,L2M-UTA@NOP-2-10-16.pdf,http://www.basketball-reference.com/boxscores/201602100NOP.html,NOP,UTA
Q4,00:47.1,47.1,Foul: Shooting,Ryan Anderson,Derrick Favors,CC,Anderson (NOP) makes contact with Favors' (UTA) body that affects his drive to the basket and shot attempt.,http://official.nba.com/last-two-minute-report/?gameNo=0021500798&eventNum=480,20160210UTANOP,20160210UTANOP-1,UTA,NOP,20160210,Eric Lewis,Rodney Mott,Derek Richardson,96,100,L2M-UTA@NOP-2-10-16.pdf,http://www.basketball-reference.com/boxscores/201602100NOP.html,UTA,NOP
Q4,00:35.7,35.7,Instant Replay: Support Ruling,,,CC,"After communicating with the Replay Center, the ruling on the court that Davis (NOP) was behind the three-point line on his made shot was upheld.",http://official.nba.com/last-two-minute-report/?gameNo=0021500798&eventNum=488,20160210UTANOP,20160210UTANOP-2,UTA,NOP,20160210,Eric Lewis,Rodney Mott,Derek Richardson,96,100,L2M-UTA@NOP-2-10-16.pdf,http://www.basketball-reference.com/boxscores/201602100NOP.html,,
Q4,00:27.8,27.8,Foul: Shooting,Dante Cunningham,Gordon Hayward,CC,Cunningham (NOP) makes A -> B contact with Hayward (UTA) that affects his drive to the basket and shot attempt.,http://official.nba.com/last-two-minute-report/?gameNo=0021500798&eventNum=490,20160210UTANOP,20160210UTANOP-3,UTA,NOP,20160210,Eric Lewis,Rodney Mott,Derek Richardson,96,100,L2M-UTA@NOP-2-10-16.pdf,http://www.basketball-reference.com/boxscores/201602100NOP.html,UTA,NOP
Q4,00:22.6,22.6,Foul: Personal,Chris Johnson,Norris Cole,CC,Johnson (UTA) commits a take foul on Cole (NOP).,http://official.nba.com/last-two-minute-report/?gameNo=0021500798&eventNum=501,20160210UTANOP,20160210UTANOP-4,UTA,NOP,20160210,Eric Lewis,Rodney Mott,Derek Richardson,96,100,L2M-UTA@NOP-2-10-16.pdf,http://www.basketball-reference.com/boxscores/201602100NOP.html,NOP,UTA
Q4,00:18.9,18.9,Foul: Personal,Norris Cole,Rodney Hood,CNC,Cole (NOP) maintains legal guarding position as he defends Hood (UTA) and does not affect his RSBQ.,http://official.nba.com/last-two-minute-report/?gameNo=0021500798&eventNum=1279,20160210UTANOP,20160210UTANOP-5,UTA,NOP,20160210,Eric Lewis,Rodney Mott,Derek Richardson,96,100,L2M-UTA@NOP-2-10-16.pdf,http://www.basketball-reference.com/boxscores/201602100NOP.html,UTA,NOP
Q4,00:10.5,10.5,Foul: Personal,Gordon Hayward,Jrue Holiday,CC,Hayward (UTA) commits a take foul on Holiday (NOP).,http://official.nba.com/last-two-minute-report/?gameNo=0021500798&eventNum=511,20160210UTANOP,20160210UTANOP-6,UTA,NOP,20160210,Eric Lewis,Rodney Mott,Derek Richardson,96,100,L2M-UTA@NOP-2-10-16.pdf,http://www.basketball-reference.com/boxscores/201602100NOP.html,NOP,UTA