period,time,seconds_left,call_type,committing_player,disadvantaged_player,review_decision,comment,video,game_id,play_id,away,home,date,ref_1,ref_2,ref_3,score_away,score_home,original_pdf,box_score_url,disadvantaged_team,committing_team
Q4,01:45.0,105,Foul: Offensive,Justise Winslow,Pau Gasol,CNC,Winslow (MIA) and Gasol (CHI) briefly engage and separate following the legal screen.,http://official.nba.com/last-two-minute-report/?gameNo=0021500669&eventNum=1260,20160125MIACHI,20160125MIACHI-0,MIA,CHI,20160125,Tony Brown,Leroy Richardson,Bill Spooner,89,84,L2M-MIA-CHI-1-25-16.pdf,http://www.basketball-reference.com/boxscores/201601250CHI.html,CHI,MIA
Q4,01:35.0,95,Instant Replay: Overturn Ruling,,,CC,"After communicating with the Replay Center, there was conclusive video evidence that showed that the ball was last touched by Butler (CHI) prior to going OOB. The ruling",http://official.nba.com/last-two-minute-report/?gameNo=0021500669&eventNum=479,20160125MIACHI,20160125MIACHI-1,MIA,CHI,20160125,Tony Brown,Leroy Richardson,Bill Spooner,89,84,L2M-MIA-CHI-1-25-16.pdf,http://www.basketball-reference.com/boxscores/201601250CHI.html,,
Q4,01:23.0,83,Foul: Offensive,Jimmy Butler,Chris Bosh,CNC,Butler (CHI) sets the screen on Bosh (MIA) and gives him room to avoid the contact.,http://official.nba.com/last-two-minute-report/?gameNo=0021500669&eventNum=1261,20160125MIACHI,20160125MIACHI-2,MIA,CHI,20160125,Tony Brown,Leroy Richardson,Bill Spooner,89,84,L2M-MIA-CHI-1-25-16.pdf,http://www.basketball-reference.com/boxscores/201601250CHI.html,MIA,CHI
Q4,00:45.7,45.7,Foul: Personal,Chris Bosh,Pau Gasol,CNC,Bosh (MIA) maintains legal guarding position and makes incidental contact with Gasol (CHI) that does not affect his RSBQ.,http://official.nba.com/last-two-minute-report/?gameNo=0021500669&eventNum=1262,20160125MIACHI,20160125MIACHI-3,MIA,CHI,20160125,Tony Brown,Leroy Richardson,Bill Spooner,89,84,L2M-MIA-CHI-1-25-16.pdf,http://www.basketball-reference.com/boxscores/201601250CHI.html,CHI,MIA
Q4,00:43.4,43.4,Foul: Loose Ball,Taj Gibson,Luol Deng,CNC,Gibson (CHI) and Deng (MIA) briefly engage and separate during rebounding.,http://official.nba.com/last-two-minute-report/?gameNo=0021500669&eventNum=1263,20160125MIACHI,20160125MIACHI-4,MIA,CHI,20160125,Tony Brown,Leroy Richardson,Bill Spooner,89,84,L2M-MIA-CHI-1-25-16.pdf,http://www.basketball-reference.com/boxscores/201601250CHI.html,MIA,CHI
Q4,00:19.5,19.5,Turnover: Traveling,Jimmy Butler,,CNC,Butler (CHI) does not move his pivot foot after he ends his dribble.,http://official.nba.com/last-two-minute-report/?gameNo=0021500669&eventNum=1264,20160125MIACHI,20160125MIACHI-5,MIA,CHI,20160125,Tony Brown,Leroy Richardson,Bill Spooner,89,84,L2M-MIA-CHI-1-25-16.pdf,http://www.basketball-reference.com/boxscores/201601250CHI.html,MIA,CHI
Q4,00:13.4,13.4,Foul: Shooting,Chris Bosh,Pau Gasol,CNC,Bosh (MIA) maintains legal guarding position and cleanly strips the ball from Gasol (CHI) during his drive to the basket.,http://official.nba.com/last-two-minute-report/?gameNo=0021500669&eventNum=1265,20160125MIACHI,20160125MIACHI-6,MIA,CHI,20160125,Tony Brown,Leroy Richardson,Bill Spooner,89,84,L2M-MIA-CHI-1-25-16.pdf,http://www.basketball-reference.com/boxscores/201601250CHI.html,CHI,MIA
Q4,00:07.7,7.7,Foul: Personal,Aaron Brooks,Dwyane Wade,CC,Brooks (CHI) commits a take foul on Wade (MIA).,http://official.nba.com/last-two-minute-report/?gameNo=0021500669&eventNum=501,20160125MIACHI,20160125MIACHI-7,MIA,CHI,20160125,Tony Brown,Leroy Richardson,Bill Spooner,89,84,L2M-MIA-CHI-1-25-16.pdf,http://www.basketball-reference.com/boxscores/201601250CHI.html,MIA,CHI
Q4,00:02.5,2.5,Foul: Shooting,Chris Bosh,Aaron Brooks,CNC,Bosh (MIA) obtains a legal guarding position and legally contests Brooks's (CHI) jump shot attempt. Any contact on the play is initiated by Brooks.,http://official.nba.com/last-two-minute-report/?gameNo=0021500669&eventNum=1266,20160125MIACHI,20160125MIACHI-8,MIA,CHI,20160125,Tony Brown,Leroy Richardson,Bill Spooner,89,84,L2M-MIA-CHI-1-25-16.pdf,http://www.basketball-reference.com/boxscores/201601250CHI.html,CHI,MIA