period,time,seconds_left,call_type,committing_player,disadvantaged_player,review_decision,comment,video,game_id,play_id,away,home,date,ref_1,ref_2,ref_3,score_away,score_home,original_pdf,box_score_url,disadvantaged_team,committing_team
Q4,01:25.0,85,Foul: Personal,Mario Chalmers,Brandon Jennings,INC,Chalmers (MEM) makes body to body contact with Jennings (DET) that affects his RSBQ.,http://official.nba.com/last-two-minute-report/?gameNo=0021500589&eventNum=1275,20160114DETMEM,20160114DETMEM-0,DET,MEM,20160114,Mark Lindsay,Rodney Mott,Ben Taylor,101,103,L2M-DET-MEM-1-14-16.pdf,http://www.basketball-reference.com/boxscores/201601140MEM.html,DET,MEM
Q4,00:59.1,59.1,Foul: Personal,Tony Allen,Andre Drummond,CC,Allen (MEM) grabs Drummond (DET) after he secures the rebound.,http://official.nba.com/last-two-minute-report/?gameNo=0021500589&eventNum=452,20160114DETMEM,20160114DETMEM-1,DET,MEM,20160114,Mark Lindsay,Rodney Mott,Ben Taylor,101,103,L2M-DET-MEM-1-14-16.pdf,http://www.basketball-reference.com/boxscores/201601140MEM.html,DET,MEM
Q4,00:28.8,28.8,Foul: Shooting,Brandon Jennings,Mario Chalmers,CC,Jennings (DET) makes contact with Chalmers' (MEM) arm and affects his shot attempt.,http://official.nba.com/last-two-minute-report/?gameNo=0021500589&eventNum=456,20160114DETMEM,20160114DETMEM-2,DET,MEM,20160114,Mark Lindsay,Rodney Mott,Ben Taylor,101,103,L2M-DET-MEM-1-14-16.pdf,http://www.basketball-reference.com/boxscores/201601140MEM.html,MEM,DET
Q4,00:10.0,10,Foul: Personal,Matt Barnes,Marcus Morris,INC,RHH shows Barnes (MEM) makes contact with Morris' (DET) off-arm that prevents him from gathering and causes him to lose possession of the ball.,http://official.nba.com/last-two-minute-report/?gameNo=0021500589&eventNum=1277,20160114DETMEM,20160114DETMEM-3,DET,MEM,20160114,Mark Lindsay,Rodney Mott,Ben Taylor,101,103,L2M-DET-MEM-1-14-16.pdf,http://www.basketball-reference.com/boxscores/201601140MEM.html,DET,MEM
Q4,00:00.8,0.8,Foul: Shooting,Aron Baynes,Mario Chalmers,CC,Baynes' (DET) momentum carries him into Chalmers (MEM) and he makes contact with his legs while he is in the act of shooting.,http://official.nba.com/last-two-minute-report/?gameNo=0021500589&eventNum=466,20160114DETMEM,20160114DETMEM-4,DET,MEM,20160114,Mark Lindsay,Rodney Mott,Ben Taylor,101,103,L2M-DET-MEM-1-14-16.pdf,http://www.basketball-reference.com/boxscores/201601140MEM.html,MEM,DET
Q4,00:00.8,0.8,Instant Replay: Support Ruling,,,CC,"After communicating with the Replay Center, the ruling on the court that the free throw hit the rim was confirmed.",http://official.nba.com/last-two-minute-report/?gameNo=0021500589&eventNum=465,20160114DETMEM,20160114DETMEM-5,DET,MEM,20160114,Mark Lindsay,Rodney Mott,Ben Taylor,101,103,L2M-DET-MEM-1-14-16.pdf,http://www.basketball-reference.com/boxscores/201601140MEM.html,,