period,time,seconds_left,call_type,committing_player,disadvantaged_player,review_decision,comment,video,game_id,play_id,away,home,date,ref_1,ref_2,ref_3,score_away,score_home,original_pdf,box_score_url,disadvantaged_team,committing_team
Q4,01:51.0,111,Foul: Personal,Trevor Ariza,Ricky Rubio,CC,Ariza (HOU) runs through Rubio's (MIN) space while trying to fight through the hand-off screen.,http://official.nba.com/last-two-minute-report/?gameNo=0021500581&eventNum=562,20160113MINHOU,20160113MINHOU-0,MIN,HOU,20160113,Sean Corbin,Aaron Smith,Derrick Stafford,104,107,L2M-MIN-HOU-1-13-16.pdf,http://www.basketball-reference.com/boxscores/201601130HOU.html,MIN,HOU
Q4,01:33.0,93,Foul: Offensive,Karl-Anthony Towns,Terrence Jones,CNC,Towns (MIN) sets the screen on Jones (HOU) and gives him room to avoid the contact.,http://official.nba.com/last-two-minute-report/?gameNo=0021500581&eventNum=1267,20160113MINHOU,20160113MINHOU-1,MIN,HOU,20160113,Sean Corbin,Aaron Smith,Derrick Stafford,104,107,L2M-MIN-HOU-1-13-16.pdf,http://www.basketball-reference.com/boxscores/201601130HOU.html,HOU,MIN
Q4,00:51.2,51.2,Foul: Personal,Dwight Howard,Karl-Anthony Towns,CC,"LHH shows that after first having his left hand on the ball, Howard (HOU) makes contact with Towns' (MIN) shoulder and neck area while trying to get his right hand on the ball.",http://official.nba.com/last-two-minute-report/?gameNo=0021500581&eventNum=574,20160113MINHOU,20160113MINHOU-2,MIN,HOU,20160113,Sean Corbin,Aaron Smith,Derrick Stafford,104,107,L2M-MIN-HOU-1-13-16.pdf,http://www.basketball-reference.com/boxscores/201601130HOU.html,MIN,HOU
Q4,00:36.1,36.1,Foul: Loose Ball,Karl-Anthony Towns,Dwight Howard,INC,Towns (MIN) grabs and holds Howard (HOU) around the waist affecting his ability to retrieve the rebound.,http://official.nba.com/last-two-minute-report/?gameNo=0021500581&eventNum=1268,20160113MINHOU,20160113MINHOU-3,MIN,HOU,20160113,Sean Corbin,Aaron Smith,Derrick Stafford,104,107,L2M-MIN-HOU-1-13-16.pdf,http://www.basketball-reference.com/boxscores/201601130HOU.html,HOU,MIN
Q4,00:04.7,4.7,Foul: Shooting,Trevor Ariza,Kevin Martin,CNC,Ariza (HOU) legally contests Martin's (MIN) jump shot attempt.,http://official.nba.com/last-two-minute-report/?gameNo=0021500581&eventNum=1269,20160113MINHOU,20160113MINHOU-4,MIN,HOU,20160113,Sean Corbin,Aaron Smith,Derrick Stafford,104,107,L2M-MIN-HOU-1-13-16.pdf,http://www.basketball-reference.com/boxscores/201601130HOU.html,MIN,HOU
Q4,00:01.7,1.7,Turnover: Out of Bounds,Ricky Rubio,,CNC,Rubio (MIN) lands OOB after securing the rebound. The timeout request is not granted because both of his feet are in the air and he has broken the vertical plane of the boundary line.,http://official.nba.com/last-two-minute-report/?gameNo=0021500581&eventNum=1270,20160113MINHOU,20160113MINHOU-5,MIN,HOU,20160113,Sean Corbin,Aaron Smith,Derrick Stafford,104,107,L2M-MIN-HOU-1-13-16.pdf,http://www.basketball-reference.com/boxscores/201601130HOU.html,HOU,MIN
Q4,00:01.4,1.4,Foul: Personal,Andrew Wiggins,James Harden,CNC,Wiggins (MIN) and Harden (HOU) briefly engage and separate during the inbounds pass.,http://official.nba.com/last-two-minute-report/?gameNo=0021500581&eventNum=1271,20160113MINHOU,20160113MINHOU-6,MIN,HOU,20160113,Sean Corbin,Aaron Smith,Derrick Stafford,104,107,L2M-MIN-HOU-1-13-16.pdf,http://www.basketball-reference.com/boxscores/201601130HOU.html,HOU,MIN