period,time,seconds_left,call_type,committing_player,disadvantaged_player,review_decision,comment,video,game_id,play_id,away,home,date,ref_1,ref_2,ref_3,score_away,score_home,original_pdf,box_score_url,disadvantaged_team,committing_team
Q4,01:54.0,114,Turnover: Traveling,Jimmy Butler,,INC,Butler (CHI) slides his pivot foot after ending his dribble.,http://official.nba.com/last-two-minute-report/?gameNo=0021501208&eventNum=1284,20160411CHINOP,20160411CHINOP-0,CHI,NOP,20160411,Nick Buchert,Scott Foster,Derek Richardson,121,116,L2M-CHI-NOP-4-11-16.pdf,http://www.basketball-reference.com/boxscores/201604110NOP.html,NOP,CHI
Q4,01:53.0,113,Foul: Personal,Tim Frazier,Jimmy Butler,CC,Frazier (NOP) makes contact with Butler's (CHI) arm that affects his ability to complete the pass.,http://official.nba.com/last-two-minute-report/?gameNo=0021501208&eventNum=457,20160411CHINOP,20160411CHINOP-1,CHI,NOP,20160411,Nick Buchert,Scott Foster,Derek Richardson,121,116,L2M-CHI-NOP-4-11-16.pdf,http://www.basketball-reference.com/boxscores/201604110NOP.html,CHI,NOP
Q4,01:33.0,93,Foul: Offensive,Justin Holiday,James Ennis,CNC,Holiday (CHI) sets the screen on Ennis (NOP) and gives him room to avoid the contact.,http://official.nba.com/last-two-minute-report/?gameNo=0021501208&eventNum=1285,20160411CHINOP,20160411CHINOP-2,CHI,NOP,20160411,Nick Buchert,Scott Foster,Derek Richardson,121,116,L2M-CHI-NOP-4-11-16.pdf,http://www.basketball-reference.com/boxscores/201604110NOP.html,NOP,CHI
Q4,01:27.0,87,Foul: Loose Ball,Dante Cunningham,Bobby Portis,CNC,Cunningham (NOP) makes incidental contact with Portis (CHI) during rebounding.,http://official.nba.com/last-two-minute-report/?gameNo=0021501208&eventNum=1286,20160411CHINOP,20160411CHINOP-3,CHI,NOP,20160411,Nick Buchert,Scott Foster,Derek Richardson,121,116,L2M-CHI-NOP-4-11-16.pdf,http://www.basketball-reference.com/boxscores/201604110NOP.html,CHI,NOP
Q4,01:25.0,85,Instant Replay: Overturn Ruling,,,CC,"After communicating with the Replay Center, there was conclusive video evidence that showed that Cunningham (NOP) was the last player to touch the ball prior to it going",http://official.nba.com/last-two-minute-report/?gameNo=0021501208&eventNum=469,20160411CHINOP,20160411CHINOP-4,CHI,NOP,20160411,Nick Buchert,Scott Foster,Derek Richardson,121,116,L2M-CHI-NOP-4-11-16.pdf,http://www.basketball-reference.com/boxscores/201604110NOP.html,,
Q4,01:11.0,71,Foul: Offensive,Jimmy Butler,Tim Frazier,CNC,Butler (CHI) does not go through the space of Frazier (NOP) on his drive and spin move.,http://official.nba.com/last-two-minute-report/?gameNo=0021501208&eventNum=1287,20160411CHINOP,20160411CHINOP-5,CHI,NOP,20160411,Nick Buchert,Scott Foster,Derek Richardson,121,116,L2M-CHI-NOP-4-11-16.pdf,http://www.basketball-reference.com/boxscores/201604110NOP.html,NOP,CHI
Q4,01:01.0,61,Violation: Kicked Ball,Justin Holiday,,CC,Holiday (CHI) intentionally kicks the ball on the play.,http://official.nba.com/last-two-minute-report/?gameNo=0021501208&eventNum=471,20160411CHINOP,20160411CHINOP-6,CHI,NOP,20160411,Nick Buchert,Scott Foster,Derek Richardson,121,116,L2M-CHI-NOP-4-11-16.pdf,http://www.basketball-reference.com/boxscores/201604110NOP.html,NOP,CHI
Q4,00:55.4,55.4,Foul: Shooting,Nikola Mirotic,James Ennis,CC,RHH shows that Mirotic (CHI) makes contact with Ennis' (NOP) arms during his driving shot attempt.,http://official.nba.com/last-two-minute-report/?gameNo=0021501208&eventNum=475,20160411CHINOP,20160411CHINOP-7,CHI,NOP,20160411,Nick Buchert,Scott Foster,Derek Richardson,121,116,L2M-CHI-NOP-4-11-16.pdf,http://www.basketball-reference.com/boxscores/201604110NOP.html,NOP,CHI
Q4,00:50.9,50.9,Foul: Personal,James Ennis,Jimmy Butler,CC,Ennis (NOP) makes body contact with Butler (CHI) that affects his RSBQ.,http://official.nba.com/last-two-minute-report/?gameNo=0021501208&eventNum=478,20160411CHINOP,20160411CHINOP-8,CHI,NOP,20160411,Nick Buchert,Scott Foster,Derek Richardson,121,116,L2M-CHI-NOP-4-11-16.pdf,http://www.basketball-reference.com/boxscores/201604110NOP.html,CHI,NOP
Q4,00:42.3,42.3,Foul: Personal,Dante Cunningham,Doug McDermott,CC,Cunningham (NOP) commits a take foul on McDermott (CHI).,http://official.nba.com/last-two-minute-report/?gameNo=0021501208&eventNum=489,20160411CHINOP,20160411CHINOP-9,CHI,NOP,20160411,Nick Buchert,Scott Foster,Derek Richardson,121,116,L2M-CHI-NOP-4-11-16.pdf,http://www.basketball-reference.com/boxscores/201604110NOP.html,CHI,NOP
Q4,00:37.2,37.2,Turnover: Stepped out of Bounds,James Ennis,,CNC,"Using all available video angles, there is no conclusive video evidence that shows that Ennis (NOP) steps OOB while in possession of the ball.",http://official.nba.com/last-two-minute-report/?gameNo=0021501208&eventNum=1288,20160411CHINOP,20160411CHINOP-10,CHI,NOP,20160411,Nick Buchert,Scott Foster,Derek Richardson,121,116,L2M-CHI-NOP-4-11-16.pdf,http://www.basketball-reference.com/boxscores/201604110NOP.html,CHI,NOP
Q4,00:26.0,26,Foul: Personal,Toney Douglas,Doug McDermott,INC,Douglas (NOP) commits a take foul on McDermott (CHI) prior to the timeout being called.,http://official.nba.com/last-two-minute-report/?gameNo=0021501208&eventNum=1289,20160411CHINOP,20160411CHINOP-11,CHI,NOP,20160411,Nick Buchert,Scott Foster,Derek Richardson,121,116,L2M-CHI-NOP-4-11-16.pdf,http://www.basketball-reference.com/boxscores/201604110NOP.html,CHI,NOP
Q4,00:17.8,17.8,Foul: Personal,Dante Cunningham,Nikola Mirotic,CC,Cunningham (NOP) commits a take foul on Mirotic (CHI).,http://official.nba.com/last-two-minute-report/?gameNo=0021501208&eventNum=501,20160411CHINOP,20160411CHINOP-12,CHI,NOP,20160411,Nick Buchert,Scott Foster,Derek Richardson,121,116,L2M-CHI-NOP-4-11-16.pdf,http://www.basketball-reference.com/boxscores/201604110NOP.html,CHI,NOP
Q4,00:09.3,9.3,Foul: Shooting,Justin Holiday,Jordan Hamilton,CC,Holiday (CHI) makes contact with Hamilton's (NOP) body during his driving shot attempt.,http://official.nba.com/last-two-minute-report/?gameNo=0021501208&eventNum=507,20160411CHINOP,20160411CHINOP-13,CHI,NOP,20160411,Nick Buchert,Scott Foster,Derek Richardson,121,116,L2M-CHI-NOP-4-11-16.pdf,http://www.basketball-reference.com/boxscores/201604110NOP.html,NOP,CHI
Q4,00:09.3,9.3,Turnover: Inbound Turnover,Bobby Portis,,,[Incidental or immaterial] Portis (CHI) steps OOB to inbound the ball but then dribbles the ball inbounds. A throw-in which touches the floor on or outside the boundary line,http://official.nba.com/last-two-minute-report/?gameNo=0021501208&eventNum=1290,20160411CHINOP,20160411CHINOP-14,CHI,NOP,20160411,Nick Buchert,Scott Foster,Derek Richardson,121,116,L2M-CHI-NOP-4-11-16.pdf,http://www.basketball-reference.com/boxscores/201604110NOP.html,NOP,CHI