period,time,seconds_left,call_type,committing_player,disadvantaged_player,review_decision,comment,video,game_id,play_id,away,home,date,ref_1,ref_2,ref_3,score_away,score_home,original_pdf,box_score_url,disadvantaged_team,committing_team
Q4,01:58.0,118,Foul: Personal,Patrick Beverley,Jared Dudley,IC,RHH and R-Slash shows that Beverley (HOU) and Dudley (WAS) stumble and collide. No foul is warranted.,http://official.nba.com/last-two-minute-report/?gameNo=0021500711&eventNum=556,20160130WASHOU,20160130WASHOU-0,WAS,HOU,20160130,Mitchell Ervin,John Goble,Josh Tiven,123,122,L2M-WAS@HOU-1-30-16.pdf,http://www.basketball-reference.com/boxscores/201601300HOU.html,WAS,HOU
Q4,01:33.0,93,Foul: Loose Ball,Jared Dudley,James Harden,,[Incidental or immaterial] Dudley (WAS) and Harden (HOU) engage under the rim.,http://official.nba.com/last-two-minute-report/?gameNo=0021500711&eventNum=1350,20160130WASHOU,20160130WASHOU-1,WAS,HOU,20160130,Mitchell Ervin,John Goble,Josh Tiven,123,122,L2M-WAS@HOU-1-30-16.pdf,http://www.basketball-reference.com/boxscores/201601300HOU.html,HOU,WAS
Q4,01:13.0,73,Foul: Personal,Ty Lawson,John Wall,CC,Lawson (HOU) makes contact with Wall (WAS) that affects his RSBQ.,http://official.nba.com/last-two-minute-report/?gameNo=0021500711&eventNum=571,20160130WASHOU,20160130WASHOU-2,WAS,HOU,20160130,Mitchell Ervin,John Goble,Josh Tiven,123,122,L2M-WAS@HOU-1-30-16.pdf,http://www.basketball-reference.com/boxscores/201601300HOU.html,WAS,HOU
Q4,01:00.0,60,Foul: Shooting,Jared Dudley,James Harden,CC,Dudley (WAS) makes contact with Harden (HOU) that affects his drive to the basket and shot attempt.,http://official.nba.com/last-two-minute-report/?gameNo=0021500711&eventNum=578,20160130WASHOU,20160130WASHOU-3,WAS,HOU,20160130,Mitchell Ervin,John Goble,Josh Tiven,123,122,L2M-WAS@HOU-1-30-16.pdf,http://www.basketball-reference.com/boxscores/201601300HOU.html,HOU,WAS
Q4,00:39.0,39,Foul: Shooting,James Harden,John Wall,INC,"Harden (HOU) grabs Wall's (WAS) right arm, affecting his drive to the basket and shot attempt.",http://official.nba.com/last-two-minute-report/?gameNo=0021500711&eventNum=586,20160130WASHOU,20160130WASHOU-4,WAS,HOU,20160130,Mitchell Ervin,John Goble,Josh Tiven,123,122,L2M-WAS@HOU-1-30-16.pdf,http://www.basketball-reference.com/boxscores/201601300HOU.html,WAS,HOU
Q4,00:38.2,38.2,Instant Replay: Support Ruling,,,CC,"After communicating with the Replay Center, the ruling on the court that possession be awarded to Washington was upheld.",http://official.nba.com/last-two-minute-report/?gameNo=0021500711&eventNum=587,20160130WASHOU,20160130WASHOU-5,WAS,HOU,20160130,Mitchell Ervin,John Goble,Josh Tiven,123,122,L2M-WAS@HOU-1-30-16.pdf,http://www.basketball-reference.com/boxscores/201601300HOU.html,,
Q4,00:32.2,32.2,Foul: Shooting,Garrett Temple,James Harden,CC,Temple (WAS) makes contact with Harden's (HOU) body that affects his drive to the basket and shot attempt.,http://official.nba.com/last-two-minute-report/?gameNo=0021500711&eventNum=590,20160130WASHOU,20160130WASHOU-6,WAS,HOU,20160130,Mitchell Ervin,John Goble,Josh Tiven,123,122,L2M-WAS@HOU-1-30-16.pdf,http://www.basketball-reference.com/boxscores/201601300HOU.html,HOU,WAS
Q4,00:11.9,11.9,Foul: Shooting,James Harden,John Wall,CNC,Harden (HOU) maintains legal guarding position as he defends Wall's (WAS) drive to the basket and shot attempt.,http://official.nba.com/last-two-minute-report/?gameNo=0021500711&eventNum=1351,20160130WASHOU,20160130WASHOU-7,WAS,HOU,20160130,Mitchell Ervin,John Goble,Josh Tiven,123,122,L2M-WAS@HOU-1-30-16.pdf,http://www.basketball-reference.com/boxscores/201601300HOU.html,WAS,HOU
Q4,00:05.3,5.3,Foul: Shooting,Jared Dudley,James Harden,CNC,"Dudley (WAS) maintains a legal guarding position on Harden's (HOU) drive and attempt. The mere fact that there is hand contact, whether intentional or not, does not constitute a foul. Contact must affect the player's RSBQ to be a foul, and it does not in this case.",http://official.nba.com/last-two-minute-report/?gameNo=0021500711&eventNum=1352,20160130WASHOU,20160130WASHOU-8,WAS,HOU,20160130,Mitchell Ervin,John Goble,Josh Tiven,123,122,L2M-WAS@HOU-1-30-16.pdf,http://www.basketball-reference.com/boxscores/201601300HOU.html,HOU,WAS