period,time,seconds_left,call_type,committing_player,disadvantaged_player,review_decision,comment,video,game_id,play_id,away,home,date,ref_1,ref_2,ref_3,score_away,score_home,original_pdf,box_score_url,disadvantaged_team,committing_team
Q4,01:51.0,111,Foul: Personal,Briante Weber,Toney Douglas,CNC,Weber (MEM) makes incidental contact with Douglas (NOP) as he attempts to retrieve the loose ball.,http://official.nba.com/last-two-minute-report/?gameNo=0021500967&eventNum=1336,20160311NOPMEM,20160311NOPMEM-0,NOP,MEM,20160311,Eric Lewis,Eli Roe,Sean Wright,114,121,L2M-NOP-MEM-3-11-16.pdf,http://www.basketball-reference.com/boxscores/201603110MEM.html,NOP,MEM
Q4,01:34.0,94,Foul: Personal,Briante Weber,Anthony Davis,CNC,Weber (MEM) makes incidental contact with Davis (NOP) that does not affect his FOM.,http://official.nba.com/last-two-minute-report/?gameNo=0021500967&eventNum=1337,20160311NOPMEM,20160311NOPMEM-1,NOP,MEM,20160311,Eric Lewis,Eli Roe,Sean Wright,114,121,L2M-NOP-MEM-3-11-16.pdf,http://www.basketball-reference.com/boxscores/201603110MEM.html,NOP,MEM
Q4,01:09.0,69,Foul: Personal,Toney Douglas,Briante Weber,CNC,Douglas (NOP) makes incidental contact with Weber (MEM) that does not affect his RSBQ.,http://official.nba.com/last-two-minute-report/?gameNo=0021500967&eventNum=1338,20160311NOPMEM,20160311NOPMEM-2,NOP,MEM,20160311,Eric Lewis,Eli Roe,Sean Wright,114,121,L2M-NOP-MEM-3-11-16.pdf,http://www.basketball-reference.com/boxscores/201603110MEM.html,MEM,NOP
Q4,01:07.0,67,Foul: Offensive,JaMychal Green,Toney Douglas,CNC,Green (MEM) sets the screen on Douglas (NOP) and gives him room to avoid the contact.,http://official.nba.com/last-two-minute-report/?gameNo=0021500967&eventNum=1339,20160311NOPMEM,20160311NOPMEM-3,NOP,MEM,20160311,Eric Lewis,Eli Roe,Sean Wright,114,121,L2M-NOP-MEM-3-11-16.pdf,http://www.basketball-reference.com/boxscores/201603110MEM.html,NOP,MEM
Q4,01:03.0,63,Foul: Loose Ball,Toney Douglas,Matt Barnes,CC,Douglas (NOP) makes contact with Barnes (MEM) that affects his ability to retrieve the loose ball.,http://official.nba.com/last-two-minute-report/?gameNo=0021500967&eventNum=527,20160311NOPMEM,20160311NOPMEM-4,NOP,MEM,20160311,Eric Lewis,Eli Roe,Sean Wright,114,121,L2M-NOP-MEM-3-11-16.pdf,http://www.basketball-reference.com/boxscores/201603110MEM.html,MEM,NOP
Q4,00:53.0,53,Foul: Shooting,Dante Cunningham,Matt Barnes,CNC,Cunningham (NOP) maintains legal guarding position and makes incidental contact with Barnes (MEM) that does not affect his shot attempt.,http://official.nba.com/last-two-minute-report/?gameNo=0021500967&eventNum=1340,20160311NOPMEM,20160311NOPMEM-5,NOP,MEM,20160311,Eric Lewis,Eli Roe,Sean Wright,114,121,L2M-NOP-MEM-3-11-16.pdf,http://www.basketball-reference.com/boxscores/201603110MEM.html,MEM,NOP
Q4,00:50.7,50.7,Foul: Shooting,Anthony Davis,JaMychal Green,INC,LHH shows that Davis (NOP) makes contact with Green's (MEM) arm as he goes up for the shot attempt.,http://official.nba.com/last-two-minute-report/?gameNo=0021500967&eventNum=1341,20160311NOPMEM,20160311NOPMEM-6,NOP,MEM,20160311,Eric Lewis,Eli Roe,Sean Wright,114,121,L2M-NOP-MEM-3-11-16.pdf,http://www.basketball-reference.com/boxscores/201603110MEM.html,MEM,NOP
Q4,00:40.4,40.4,Foul: Defense 3 Second,Matt Barnes,,INC,Barnes (MEM) is in the paint without actively guarding an opponent for longer than three seconds.,http://official.nba.com/last-two-minute-report/?gameNo=0021500967&eventNum=1342,20160311NOPMEM,20160311NOPMEM-7,NOP,MEM,20160311,Eric Lewis,Eli Roe,Sean Wright,114,121,L2M-NOP-MEM-3-11-16.pdf,http://www.basketball-reference.com/boxscores/201603110MEM.html,NOP,MEM
Q4,00:27.6,27.6,Foul: Loose Ball,Matt Barnes,Anthony Davis,CNC,Barnes (MEM) and Davis (NOP) briefly engage and separate during rebounding.,http://official.nba.com/last-two-minute-report/?gameNo=0021500967&eventNum=1343,20160311NOPMEM,20160311NOPMEM-8,NOP,MEM,20160311,Eric Lewis,Eli Roe,Sean Wright,114,121,L2M-NOP-MEM-3-11-16.pdf,http://www.basketball-reference.com/boxscores/201603110MEM.html,NOP,MEM
Q5,04:49.0,289,Turnover: Traveling,Lance Stephenson,,INC,Stephenson (MEM) moves his pivot foot as he gains possession of the ball.,http://official.nba.com/last-two-minute-report/?gameNo=0021500967&eventNum=1344,20160311NOPMEM,20160311NOPMEM-9,NOP,MEM,20160311,Eric Lewis,Eli Roe,Sean Wright,114,121,L2M-NOP-MEM-3-11-16.pdf,http://www.basketball-reference.com/boxscores/201603110MEM.html,NOP,MEM
Q5,04:44.0,284,Foul: Shooting,Ryan Anderson,JaMychal Green,CC,Anderson (NOP) makes contact with Green's (MEM) body that affects his driving shot attempt.,http://official.nba.com/last-two-minute-report/?gameNo=0021500967&eventNum=560,20160311NOPMEM,20160311NOPMEM-10,NOP,MEM,20160311,Eric Lewis,Eli Roe,Sean Wright,114,121,L2M-NOP-MEM-3-11-16.pdf,http://www.basketball-reference.com/boxscores/201603110MEM.html,MEM,NOP
Q5,02:58.0,178,Foul: Personal,JaMychal Green,Anthony Davis,CC,Green (MEM) grabs the body of Davis (NOP) restricting his FOM as he runs into the lane.,http://official.nba.com/last-two-minute-report/?gameNo=0021500967&eventNum=578,20160311NOPMEM,20160311NOPMEM-11,NOP,MEM,20160311,Eric Lewis,Eli Roe,Sean Wright,114,121,L2M-NOP-MEM-3-11-16.pdf,http://www.basketball-reference.com/boxscores/201603110MEM.html,NOP,MEM
Q5,02:34.0,154,Foul: Defense 3 Second,Jrue Holiday,,INC,Holiday (NOP) is in the paint without actively guarding an opponent for longer than three seconds.,http://official.nba.com/last-two-minute-report/?gameNo=0021500967&eventNum=1345,20160311NOPMEM,20160311NOPMEM-12,NOP,MEM,20160311,Eric Lewis,Eli Roe,Sean Wright,114,121,L2M-NOP-MEM-3-11-16.pdf,http://www.basketball-reference.com/boxscores/201603110MEM.html,MEM,NOP
Q5,02:21.0,141,Foul: Shooting,Briante Weber,Toney Douglas,CNC,Weber (MEM) maintains legal guarding position and makes incidental contact with Douglas (NOP) that does not affect his drive to the basket.,http://official.nba.com/last-two-minute-report/?gameNo=0021500967&eventNum=1346,20160311NOPMEM,20160311NOPMEM-13,NOP,MEM,20160311,Eric Lewis,Eli Roe,Sean Wright,114,121,L2M-NOP-MEM-3-11-16.pdf,http://www.basketball-reference.com/boxscores/201603110MEM.html,NOP,MEM
Q5,02:16.0,136,Foul: Shooting,Anthony Davis,Tony Allen,CC,Davis (NOP) makes contact with Allen's (MEM) body that affects his driving shot attempt.,http://official.nba.com/last-two-minute-report/?gameNo=0021500967&eventNum=583,20160311NOPMEM,20160311NOPMEM-14,NOP,MEM,20160311,Eric Lewis,Eli Roe,Sean Wright,114,121,L2M-NOP-MEM-3-11-16.pdf,http://www.basketball-reference.com/boxscores/201603110MEM.html,MEM,NOP
Q5,02:16.0,136,Violation: Lane,Ryan Anderson,Tony Allen,INC,PXP shows that Anderson (NOP) enters the paint area prior to the free throw being released.,http://official.nba.com/last-two-minute-report/?gameNo=0021500967&eventNum=1347,20160311NOPMEM,20160311NOPMEM-15,NOP,MEM,20160311,Eric Lewis,Eli Roe,Sean Wright,114,121,L2M-NOP-MEM-3-11-16.pdf,http://www.basketball-reference.com/boxscores/201603110MEM.html,MEM,NOP
Q5,01:50.0,110,Foul: Personal,Dante Cunningham,Lance Stephenson,CNC,Stephenson (MEM) incidentally trips over the leg of Cunningham (NOP) on the baseline cut towards the basket.,http://official.nba.com/last-two-minute-report/?gameNo=0021500967&eventNum=1348,20160311NOPMEM,20160311NOPMEM-16,NOP,MEM,20160311,Eric Lewis,Eli Roe,Sean Wright,114,121,L2M-NOP-MEM-3-11-16.pdf,http://www.basketball-reference.com/boxscores/201603110MEM.html,MEM,NOP
Q5,01:37.0,97,Foul: Shooting,Tony Allen,Ryan Anderson,CC,Allen (MEM) makes contact with Anderson's (NOP) body that affects his jump shot attempt.,http://official.nba.com/last-two-minute-report/?gameNo=0021500967&eventNum=594,20160311NOPMEM,20160311NOPMEM-17,NOP,MEM,20160311,Eric Lewis,Eli Roe,Sean Wright,114,121,L2M-NOP-MEM-3-11-16.pdf,http://www.basketball-reference.com/boxscores/201603110MEM.html,NOP,MEM
Q5,01:20.0,80,Foul: Offensive,Matt Barnes,Alonzo Gee,CNC,Barnes (MEM) sets the screen on Gee (NOP) and gives him room to avoid the contact.,http://official.nba.com/last-two-minute-report/?gameNo=0021500967&eventNum=1349,20160311NOPMEM,20160311NOPMEM-18,NOP,MEM,20160311,Eric Lewis,Eli Roe,Sean Wright,114,121,L2M-NOP-MEM-3-11-16.pdf,http://www.basketball-reference.com/boxscores/201603110MEM.html,NOP,MEM
Q5,01:14.0,74,Foul: Shooting,JaMychal Green,Toney Douglas,CNC,Green (MEM) maintains legal guarding position and makes incidental contact with Douglas (NOP) that does not affect his drive to the basket and shot attempt.,http://official.nba.com/last-two-minute-report/?gameNo=0021500967&eventNum=1350,20160311NOPMEM,20160311NOPMEM-19,NOP,MEM,20160311,Eric Lewis,Eli Roe,Sean Wright,114,121,L2M-NOP-MEM-3-11-16.pdf,http://www.basketball-reference.com/boxscores/201603110MEM.html,NOP,MEM
Q5,01:03.0,63,Foul: Personal Take,Lance Stephenson,Alonzo Gee,CC,Stephenson (MEM) commits a take foul on Gee (NOP).,http://official.nba.com/last-two-minute-report/?gameNo=0021500967&eventNum=604,20160311NOPMEM,20160311NOPMEM-20,NOP,MEM,20160311,Eric Lewis,Eli Roe,Sean Wright,114,121,L2M-NOP-MEM-3-11-16.pdf,http://www.basketball-reference.com/boxscores/201603110MEM.html,NOP,MEM
Q5,00:55.7,55.7,Turnover: Traveling,Matt Barnes,,,[Incidental or immaterial] Barnes (MEM) hops consecutively on the same foot upon gaining possession of the basketball.,http://official.nba.com/last-two-minute-report/?gameNo=0021500967&eventNum=1351,20160311NOPMEM,20160311NOPMEM-21,NOP,MEM,20160311,Eric Lewis,Eli Roe,Sean Wright,114,121,L2M-NOP-MEM-3-11-16.pdf,http://www.basketball-reference.com/boxscores/201603110MEM.html,NOP,MEM
Q5,00:36.1,36.1,Foul: Shooting,Matt Barnes,Anthony Davis,CC,Barnes (MEM) makes contact with Davis' (NOP) body that affects his shot attempt.,http://official.nba.com/last-two-minute-report/?gameNo=0021500967&eventNum=612,20160311NOPMEM,20160311NOPMEM-22,NOP,MEM,20160311,Eric Lewis,Eli Roe,Sean Wright,114,121,L2M-NOP-MEM-3-11-16.pdf,http://www.basketball-reference.com/boxscores/201603110MEM.html,NOP,MEM
Q5,00:28.6,28.6,Foul: Personal Take,Alonzo Gee,Lance Stephenson,CC,Gee (NOP) commits a take foul on Stephenson (MEM).,http://official.nba.com/last-two-minute-report/?gameNo=0021500967&eventNum=620,20160311NOPMEM,20160311NOPMEM-23,NOP,MEM,20160311,Eric Lewis,Eli Roe,Sean Wright,114,121,L2M-NOP-MEM-3-11-16.pdf,http://www.basketball-reference.com/boxscores/201603110MEM.html,MEM,NOP
Q5,00:26.3,26.3,Foul: Personal,Toney Douglas,Matt Barnes,CC,Douglas (NOP) makes body to body contact with Barnes (MEM) that affects his RSBQ.,http://official.nba.com/last-two-minute-report/?gameNo=0021500967&eventNum=621,20160311NOPMEM,20160311NOPMEM-24,NOP,MEM,20160311,Eric Lewis,Eli Roe,Sean Wright,114,121,L2M-NOP-MEM-3-11-16.pdf,http://www.basketball-reference.com/boxscores/201603110MEM.html,MEM,NOP
Q5,00:26.0,26,Foul: Personal,Matt Barnes,Anthony Davis,INC,Barnes (MEM) places two hands on Davis' (NOP) body as he defends him and the contact affects his RSBQ.,http://official.nba.com/last-two-minute-report/?gameNo=0021500967&eventNum=1352,20160311NOPMEM,20160311NOPMEM-25,NOP,MEM,20160311,Eric Lewis,Eli Roe,Sean Wright,114,121,L2M-NOP-MEM-3-11-16.pdf,http://www.basketball-reference.com/boxscores/201603110MEM.html,NOP,MEM
Q5,00:21.7,21.7,Foul: Personal Take,Luke Babbitt,Briante Weber,CC,Babbitt (NOP) commits a take foul on Weber (MEM).,http://official.nba.com/last-two-minute-report/?gameNo=0021500967&eventNum=631,20160311NOPMEM,20160311NOPMEM-26,NOP,MEM,20160311,Eric Lewis,Eli Roe,Sean Wright,114,121,L2M-NOP-MEM-3-11-16.pdf,http://www.basketball-reference.com/boxscores/201603110MEM.html,MEM,NOP
Q5,00:14.5,14.5,Foul: Personal Take,Luke Babbitt,JaMychal Green,CC,Babbitt (NOP) commits a take foul on Green (MEM).,http://official.nba.com/last-two-minute-report/?gameNo=0021500967&eventNum=638,20160311NOPMEM,20160311NOPMEM-27,NOP,MEM,20160311,Eric Lewis,Eli Roe,Sean Wright,114,121,L2M-NOP-MEM-3-11-16.pdf,http://www.basketball-reference.com/boxscores/201603110MEM.html,MEM,NOP
Q5,00:09.3,9.3,Turnover: Traveling,Luke Babbitt,,CNC,Babbitt (NOP) makes a legal move toward the basket.,http://official.nba.com/last-two-minute-report/?gameNo=0021500967&eventNum=1353,20160311NOPMEM,20160311NOPMEM-28,NOP,MEM,20160311,Eric Lewis,Eli Roe,Sean Wright,114,121,L2M-NOP-MEM-3-11-16.pdf,http://www.basketball-reference.com/boxscores/201603110MEM.html,MEM,NOP
Q5,00:06.4,6.4,Foul: Shooting,Matt Barnes,Ryan Anderson,INC,Barnes (MEM) makes contact with Anderson's (NOP) arm that affects his putback shot attempt.,http://official.nba.com/last-two-minute-report/?gameNo=0021500967&eventNum=1354,20160311NOPMEM,20160311NOPMEM-29,NOP,MEM,20160311,Eric Lewis,Eli Roe,Sean Wright,114,121,L2M-NOP-MEM-3-11-16.pdf,http://www.basketball-reference.com/boxscores/201603110MEM.html,NOP,MEM
Q5,00:00.0,0,Instant Replay: Support Ruling,,,CC,"After communicating with the Replay Center, the ruling on the court that the game clock had expired prior to the foul call was confirmed.",http://official.nba.com/last-two-minute-report/?gameNo=0021500967&eventNum=654,20160311NOPMEM,20160311NOPMEM-30,NOP,MEM,20160311,Eric Lewis,Eli Roe,Sean Wright,114,121,L2M-NOP-MEM-3-11-16.pdf,http://www.basketball-reference.com/boxscores/201603110MEM.html,,