period,time,seconds_left,call_type,committing_player,disadvantaged_player,review_decision,comment,video,game_id,play_id,away,home,date,ref_1,ref_2,ref_3,score_away,score_home,original_pdf,box_score_url,disadvantaged_team,committing_team
Q4,01:52.0,112,Foul: Offensive,Mason Plumlee,Shelvin Mack,CNC,Plumlee (POR) sets the screen on Mack (UTA) and gives him room to avoid the contact.,http://official.nba.com/last-two-minute-report/?gameNo=0021500832&eventNum=1300,20160221UTAPOR,20160221UTAPOR-0,UTA,POR,20160221,Nick Buchert,Eli Roe,Tom Washington,111,115,L2M-UTA-POR-2-21-16.pdf,http://www.basketball-reference.com/boxscores/201602210POR.html,UTA,POR
Q4,01:51.0,111,Foul: Shooting,Shelvin Mack,Damian Lillard,CNC,"There is no angle that definitively shows Mack (UTA) make contact with Lillard (POR) during his upward shooting motion, however if any contact occurs, it does not affect",http://official.nba.com/last-two-minute-report/?gameNo=0021500832&eventNum=1301,20160221UTAPOR,20160221UTAPOR-1,UTA,POR,20160221,Nick Buchert,Eli Roe,Tom Washington,111,115,L2M-UTA-POR-2-21-16.pdf,http://www.basketball-reference.com/boxscores/201602210POR.html,POR,UTA
Q4,01:22.0,82,Foul: Offensive,Mason Plumlee,Rodney Hood,CNC,Plumlee (POR) sets the screen on Hood (UTA) and gives him room to avoid the contact. He is firming up and absorbs the contact when it occurs.,http://official.nba.com/last-two-minute-report/?gameNo=0021500832&eventNum=1302,20160221UTAPOR,20160221UTAPOR-2,UTA,POR,20160221,Nick Buchert,Eli Roe,Tom Washington,111,115,L2M-UTA-POR-2-21-16.pdf,http://www.basketball-reference.com/boxscores/201602210POR.html,UTA,POR
Q4,01:10.0,70,Turnover: Traveling,Rodney Hood,,INC,"Hood (UTA) gathers the ball on his left foot, establishing his pivot. He then drops this foot back when starting his dribble.",http://official.nba.com/last-two-minute-report/?gameNo=0021500832&eventNum=1303,20160221UTAPOR,20160221UTAPOR-3,UTA,POR,20160221,Nick Buchert,Eli Roe,Tom Washington,111,115,L2M-UTA-POR-2-21-16.pdf,http://www.basketball-reference.com/boxscores/201602210POR.html,POR,UTA
Q4,00:19.8,19.8,Foul: Shooting,Ed Davis,Derrick Favors,CNC,Davis (POR) maintains legal guarding position as he defends Favors' (UTA) shot attempt.,http://official.nba.com/last-two-minute-report/?gameNo=0021500832&eventNum=1304,20160221UTAPOR,20160221UTAPOR-4,UTA,POR,20160221,Nick Buchert,Eli Roe,Tom Washington,111,115,L2M-UTA-POR-2-21-16.pdf,http://www.basketball-reference.com/boxscores/201602210POR.html,UTA,POR
Q4,00:15.1,15.1,Instant Replay: Support Ruling,,,CC,"After communicating with the Replay Center, the ruling on the court that the ball was last touched by Favors (UTA) prior to going OOB was upheld.",http://official.nba.com/last-two-minute-report/?gameNo=0021500832&eventNum=576,20160221UTAPOR,20160221UTAPOR-5,UTA,POR,20160221,Nick Buchert,Eli Roe,Tom Washington,111,115,L2M-UTA-POR-2-21-16.pdf,http://www.basketball-reference.com/boxscores/201602210POR.html,,
Q4,00:13.3,13.3,Foul: Personal,Rodney Hood,CJ McCollum,CC,Hood (UTA) commits a take foul on McCollum (POR).,http://official.nba.com/last-two-minute-report/?gameNo=0021500832&eventNum=582,20160221UTAPOR,20160221UTAPOR-6,UTA,POR,20160221,Nick Buchert,Eli Roe,Tom Washington,111,115,L2M-UTA-POR-2-21-16.pdf,http://www.basketball-reference.com/boxscores/201602210POR.html,POR,UTA
Q4,00:02.7,2.7,Foul: Personal,Shelvin Mack,CJ McCollum,CC,Mack (UTA) commits a take foul on McCollum (POR).,http://official.nba.com/last-two-minute-report/?gameNo=0021500832&eventNum=601,20160221UTAPOR,20160221UTAPOR-7,UTA,POR,20160221,Nick Buchert,Eli Roe,Tom Washington,111,115,L2M-UTA-POR-2-21-16.pdf,http://www.basketball-reference.com/boxscores/201602210POR.html,POR,UTA