period,time,seconds_left,call_type,committing_player,disadvantaged_player,review_decision,comment,video,game_id,play_id,away,home,date,ref_1,ref_2,ref_3,score_away,score_home,original_pdf,box_score_url,disadvantaged_team,committing_team
Q4,01:55.0,115,Instant Replay: Support Ruling,,,CC,"After communicating with the Replay Center, the ruling on the court that the field goal attempt by Lin (CHA) at Q4 2:35 was released before the shot clock expired was overturned.",http://official.nba.com/last-two-minute-report/?gameNo=0021500443&eventNum=516,20151226MEMCHA,20151226MEMCHA-0,MEM,CHA,20151226,David Guthrie,Michael Smith,Haywoode Workman,92,98,L2M-MEM@CHA-12-26-15.pdf,http://www.basketball-reference.com/boxscores/201512260CHO.html,,
Q4,01:43.0,103,Foul: Shooting,Cody Zeller,Marc Gasol,INC,Zeller (CHA) makes contact with Gasol's (MEM) arm that affects his layup attempt. LHH shows contact to the arm prior to any contact with the ball.,http://official.nba.com/last-two-minute-report/?gameNo=0021500443&eventNum=1293,20151226MEMCHA,20151226MEMCHA-1,MEM,CHA,20151226,David Guthrie,Michael Smith,Haywoode Workman,92,98,L2M-MEM@CHA-12-26-15.pdf,http://www.basketball-reference.com/boxscores/201512260CHO.html,MEM,CHA
Q4,01:19.0,79,Foul: Personal,Courtney Lee,Jeremy Lin,CNC,RHH shows Lee (MEM) cleanly strips the ball away from Lin (CHA) as he drives to the basket.,http://official.nba.com/last-two-minute-report/?gameNo=0021500443&eventNum=1294,20151226MEMCHA,20151226MEMCHA-2,MEM,CHA,20151226,David Guthrie,Michael Smith,Haywoode Workman,92,98,L2M-MEM@CHA-12-26-15.pdf,http://www.basketball-reference.com/boxscores/201512260CHO.html,CHA,MEM
Q4,00:57.9,57.9,Foul: Loose Ball,Zach Randolph,Frank Kaminsky,CNC,Randolph (MEM) and Kaminsky (CHA) briefly engage and separate during rebound.,http://official.nba.com/last-two-minute-report/?gameNo=0021500443&eventNum=1295,20151226MEMCHA,20151226MEMCHA-3,MEM,CHA,20151226,David Guthrie,Michael Smith,Haywoode Workman,92,98,L2M-MEM@CHA-12-26-15.pdf,http://www.basketball-reference.com/boxscores/201512260CHO.html,CHA,MEM
Q4,00:23.6,23.6,Foul: Shooting,Cody Zeller,Zach Randolph,CC,Zeller (CHA) makes contact to Randolph's (MEM) arm as he attempts to put back the rebound.,http://official.nba.com/last-two-minute-report/?gameNo=0021500443&eventNum=531,20151226MEMCHA,20151226MEMCHA-4,MEM,CHA,20151226,David Guthrie,Michael Smith,Haywoode Workman,92,98,L2M-MEM@CHA-12-26-15.pdf,http://www.basketball-reference.com/boxscores/201512260CHO.html,MEM,CHA
Q4,00:22.7,22.7,Foul: Personal,Courtney Lee,Kemba Walker,CC,Lee (MEM) commits a take foul on Walker (CHA).,http://official.nba.com/last-two-minute-report/?gameNo=0021500443&eventNum=541,20151226MEMCHA,20151226MEMCHA-5,MEM,CHA,20151226,David Guthrie,Michael Smith,Haywoode Workman,92,98,L2M-MEM@CHA-12-26-15.pdf,http://www.basketball-reference.com/boxscores/201512260CHO.html,CHA,MEM
Q4,00:09.9,9.9,Foul: Personal,Courtney Lee,Jeremy Lin,CC,Lee (MEM) commits a take foul on Lin (CHA).,http://official.nba.com/last-two-minute-report/?gameNo=0021500443&eventNum=554,20151226MEMCHA,20151226MEMCHA-6,MEM,CHA,20151226,David Guthrie,Michael Smith,Haywoode Workman,92,98,L2M-MEM@CHA-12-26-15.pdf,http://www.basketball-reference.com/boxscores/201512260CHO.html,CHA,MEM
Q4,00:02.6,2.6,Foul: Personal,Matt Barnes,Jeremy Lin,CC,Barnes (MEM) commits a take foul on Lin (CHA).,http://official.nba.com/last-two-minute-report/?gameNo=0021500443&eventNum=567,20151226MEMCHA,20151226MEMCHA-7,MEM,CHA,20151226,David Guthrie,Michael Smith,Haywoode Workman,92,98,L2M-MEM@CHA-12-26-15.pdf,http://www.basketball-reference.com/boxscores/201512260CHO.html,CHA,MEM