period,time,seconds_left,call_type,committing_player,disadvantaged_player,review_decision,comment,video,game_id,play_id,away,home,date,ref_1,ref_2,ref_3,ref_4,score_away,score_home,original_pdf,box_score_url,disadvantaged_team,committing_team
Q4,01:35.0,95,Foul: Offensive,Dwight Howard,Bojan Bogdanovic,CNC,Howard (HOU) sets the screen on Bogdanovic (BKN) and gives him room to avoid the contact.,http://official.nba.com/last-two-minute-report/?gameNo=0021500119&eventNum=1287,20151111BKNHOU,20151111BKNHOU-0,BKN,HOU,20151111,Bennie Adams,Lauren Holtkamp,Sean Wright,,106,98,L2M-BKN-HOU-11-11-15.pdf,https://www.basketball-reference.com/boxscores/201511110HOU.html,BKN,HOU
Q4,01:18.0,78,Turnover: Traveling,Joe Johnson,,,"[Observable in enhanced video] During close defensive coverage, Johnson (BKN) moves his pivot foot heel-to-toe, changing his floor position. A player may move heel-to-toe provided he doesn't gain space. Deemed unobservable because the referee must focus on the close contact.",http://official.nba.com/last-two-minute-report/?gameNo=0021500119&eventNum=1288,20151111BKNHOU,20151111BKNHOU-1,BKN,HOU,20151111,Bennie Adams,Lauren Holtkamp,Sean Wright,,106,98,L2M-BKN-HOU-11-11-15.pdf,https://www.basketball-reference.com/boxscores/201511110HOU.html,HOU,BKN
Q4,01:01.0,61,Foul: Loose Ball,Ty Lawson,Jarrett Jack,CNC,Lawson (HOU) does not dislodge Jack (BKN) during rebounding.,http://official.nba.com/last-two-minute-report/?gameNo=0021500119&eventNum=1289,20151111BKNHOU,20151111BKNHOU-2,BKN,HOU,20151111,Bennie Adams,Lauren Holtkamp,Sean Wright,,106,98,L2M-BKN-HOU-11-11-15.pdf,https://www.basketball-reference.com/boxscores/201511110HOU.html,BKN,HOU
Q4,00:59.8,59.8,Foul: Shooting,Thaddeus Young,Ty Lawson,CNC,Young (BKN) cleanly blocks Lawson's (HOU) layup attempt.,http://official.nba.com/last-two-minute-report/?gameNo=0021500119&eventNum=1290,20151111BKNHOU,20151111BKNHOU-3,BKN,HOU,20151111,Bennie Adams,Lauren Holtkamp,Sean Wright,,106,98,L2M-BKN-HOU-11-11-15.pdf,https://www.basketball-reference.com/boxscores/201511110HOU.html,HOU,BKN
Q4,00:19.2,19.2,Foul: Personal,Ty Lawson,Jarrett Jack,CC,Lawson (HOU) commits a take foul on Jack (BKN).,http://official.nba.com/last-two-minute-report/?gameNo=0021500119&eventNum=559,20151111BKNHOU,20151111BKNHOU-4,BKN,HOU,20151111,Bennie Adams,Lauren Holtkamp,Sean Wright,,106,98,L2M-BKN-HOU-11-11-15.pdf,https://www.basketball-reference.com/boxscores/201511110HOU.html,BKN,HOU
Q4,00:18.2,18.2,Foul: Personal,Trevor Ariza,Joe Johnson,CC,Ariza (HOU) commits a take foul on Johnson (BKN).,http://official.nba.com/last-two-minute-report/?gameNo=0021500119&eventNum=562,20151111BKNHOU,20151111BKNHOU-5,BKN,HOU,20151111,Bennie Adams,Lauren Holtkamp,Sean Wright,,106,98,L2M-BKN-HOU-11-11-15.pdf,https://www.basketball-reference.com/boxscores/201511110HOU.html,BKN,HOU
Q4,00:18.2,18.2,Foul: Offensive,Dwight Howard,Jarrett Jack,,"[Incidental or immaterial] Howard (HOU) uses his hands to set a screen on Jack (BKN), affecting his ability to defend Thornton's (HOU) missed shot.",http://official.nba.com/last-two-minute-report/?gameNo=0021500119&eventNum=1291,20151111BKNHOU,20151111BKNHOU-6,BKN,HOU,20151111,Bennie Adams,Lauren Holtkamp,Sean Wright,,106,98,L2M-BKN-HOU-11-11-15.pdf,https://www.basketball-reference.com/boxscores/201511110HOU.html,BKN,HOU
Q4,00:17.8,17.8,Foul: Shooting,Jarrett Jack,Marcus Thornton,CNC,"Thornton (HOU) jumps into Jack (BKN) who maintains legal guarding position as he defends the jump shot. NOTE: Due to technical issues, video of plays may be unavailable or not matched to the correct time code. We apologize for any inconvenience and will post an update after the issue is resolved.",http://official.nba.com/last-two-minute-report/?gameNo=0021500119&eventNum=1292,20151111BKNHOU,20151111BKNHOU-7,BKN,HOU,20151111,Bennie Adams,Lauren Holtkamp,Sean Wright,,106,98,L2M-BKN-HOU-11-11-15.pdf,https://www.basketball-reference.com/boxscores/201511110HOU.html,HOU,BKN