period,time,seconds_left,call_type,committing_player,disadvantaged_player,review_decision,comment,video,game_id,play_id,away,home,date,ref_1,ref_2,ref_3,ref_4,score_away,score_home,original_pdf,box_score_url,disadvantaged_team,committing_team
Q4,01:43.0,103,Foul: Shooting,Deron Williams,Harrison Barnes,CC,LHH shows Williams (BKN) does not beat Barnes (GSW) to the spot and also continues to turn when contact occurs.,http://official.nba.com/last-two-minute-report/?gameNo=0021400886&eventNum=468,20150302GSWBKN,20150302GSWBKN-0,GSW,BKN,20150302,Nick Buchert,Jason Phillips,Haywoode Workman,,108,110,L2M-GSW-BKN-3-2-15.pdf,https://www.basketball-reference.com/boxscores/201503020BRK.html,GSW,BKN
Q4,01:12.0,72,Foul: Offensive,Andrew Bogut,Jarrett Jack,CNC,Bogut (GSW) sets the screen on Jack (PHO) and gives him the opportunity to stop and/or change direction.,http://official.nba.com/last-two-minute-report/?gameNo=0021400886&eventNum=1264,20150302GSWBKN,20150302GSWBKN-1,GSW,BKN,20150302,Nick Buchert,Jason Phillips,Haywoode Workman,,108,110,L2M-GSW-BKN-3-2-15.pdf,https://www.basketball-reference.com/boxscores/201503020BRK.html,PHO,GSW
Q4,00:54.5,54.5,Foul: Offensive,Brook Lopez,Klay Thompson,CNC,Lopez (BKN) sets the screen on Thompson (GSW) and gives him the opportunity to stop and/or change direction.,http://official.nba.com/last-two-minute-report/?gameNo=0021400886&eventNum=1265,20150302GSWBKN,20150302GSWBKN-2,GSW,BKN,20150302,Nick Buchert,Jason Phillips,Haywoode Workman,,108,110,L2M-GSW-BKN-3-2-15.pdf,https://www.basketball-reference.com/boxscores/201503020BRK.html,GSW,BKN
Q4,00:53.7,53.7,Foul: Personal,Draymond Green,Deron Williams,CNC,R-Slash shows Williams (BKN) losing control of the ball and bumping into Bogut (GSW) as he stumbles.,http://official.nba.com/last-two-minute-report/?gameNo=0021400886&eventNum=1266,20150302GSWBKN,20150302GSWBKN-3,GSW,BKN,20150302,Nick Buchert,Jason Phillips,Haywoode Workman,,108,110,L2M-GSW-BKN-3-2-15.pdf,https://www.basketball-reference.com/boxscores/201503020BRK.html,BKN,GSW
Q4,00:51.0,51,Instant Replay: Overturn Ruling,,,CC,"After communicating with the Replay Center, the ruling on the court was overturned and the ball was awarded to Brooklyn.",http://official.nba.com/last-two-minute-report/?gameNo=0021400886&eventNum=481,20150302GSWBKN,20150302GSWBKN-4,GSW,BKN,20150302,Nick Buchert,Jason Phillips,Haywoode Workman,,108,110,L2M-GSW-BKN-3-2-15.pdf,https://www.basketball-reference.com/boxscores/201503020BRK.html,,
Q4,00:49.5,49.5,Foul: Personal,Andrew Bogut,Brook Lopez,CC,Bogut (GSW) grabs Lopez's (BKN) arm and affects his RSBQ on his drive to the basket.,http://official.nba.com/last-two-minute-report/?gameNo=0021400886&eventNum=484,20150302GSWBKN,20150302GSWBKN-5,GSW,BKN,20150302,Nick Buchert,Jason Phillips,Haywoode Workman,,108,110,L2M-GSW-BKN-3-2-15.pdf,https://www.basketball-reference.com/boxscores/201503020BRK.html,BKN,GSW
Q4,00:38.6,38.6,Foul: Shooting,Andrew Bogut,Brook Lopez,CNC,Bogut (GSW) cleanly strips the ball from Lopez (BKN) as he attempts to gather it for a layup.,http://official.nba.com/last-two-minute-report/?gameNo=0021400886&eventNum=1268,20150302GSWBKN,20150302GSWBKN-6,GSW,BKN,20150302,Nick Buchert,Jason Phillips,Haywoode Workman,,108,110,L2M-GSW-BKN-3-2-15.pdf,https://www.basketball-reference.com/boxscores/201503020BRK.html,BKN,GSW
Q4,00:04.6,4.6,Foul: Offensive,Brook Lopez,Stephen Curry,CNC,Lopez (BKN) sets a screen on Curry (GSW) and gives him the opportunity to stop and/or change direction.,http://official.nba.com/last-two-minute-report/?gameNo=0021400886&eventNum=1269,20150302GSWBKN,20150302GSWBKN-7,GSW,BKN,20150302,Nick Buchert,Jason Phillips,Haywoode Workman,,108,110,L2M-GSW-BKN-3-2-15.pdf,https://www.basketball-reference.com/boxscores/201503020BRK.html,GSW,BKN