period,time,seconds_left,call_type,committing_player,disadvantaged_player,review_decision,comment,video,game_id,play_id,away,home,date,ref_1,ref_2,ref_3,score_away,score_home,original_pdf,box_score_url,disadvantaged_team,committing_team
Q4,01:50.0,110,Foul: Offensive,Thaddeus Young,DeMarre Carroll,CC,Carroll (ATL) is outside the restricted area and establishes himself in Young's (BKN) path before the contact.,http://official.nba.com/last-two-minute-report/?gameNo=0021401163&eventNum=496,20150408ATLBKN,20150408ATLBKN-0,ATL,BKN,20150408,Steve Anderson,James Capers,Derrick Collins,114,111,L2M-ATL-BKN-4-8-15.pdf,http://www.basketball-reference.com/boxscores/201504080BRK.html,ATL,BKN
Q4,01:50.0,110,Instant Replay: Support Ruling,,,CC,"After communicating with the Replay Center, the ruling on the court that Carroll (ATL) was outside of the restricted area when the contact occurred was upheld.",http://official.nba.com/last-two-minute-report/?gameNo=0021401163&eventNum=499,20150408ATLBKN,20150408ATLBKN-1,ATL,BKN,20150408,Steve Anderson,James Capers,Derrick Collins,114,111,L2M-ATL-BKN-4-8-15.pdf,http://www.basketball-reference.com/boxscores/201504080BRK.html,,
Q4,01:16.0,76,Foul: Shooting,Mike Scott,Brook Lopez,CNC,Scott (ATL) does not affect Lopez' (BKN) shot with the contact.,http://official.nba.com/last-two-minute-report/?gameNo=0021401163&eventNum=1282,20150408ATLBKN,20150408ATLBKN-2,ATL,BKN,20150408,Steve Anderson,James Capers,Derrick Collins,114,111,L2M-ATL-BKN-4-8-15.pdf,http://www.basketball-reference.com/boxscores/201504080BRK.html,BKN,ATL
Q4,00:48.0,48,Foul: Personal,Thaddeus Young,Jeff Teague,CNC,Young (BKN) does not affect Teague's (ATL) RSBQ with any contact to the body.,http://official.nba.com/last-two-minute-report/?gameNo=0021401163&eventNum=1283,20150408ATLBKN,20150408ATLBKN-3,ATL,BKN,20150408,Steve Anderson,James Capers,Derrick Collins,114,111,L2M-ATL-BKN-4-8-15.pdf,http://www.basketball-reference.com/boxscores/201504080BRK.html,ATL,BKN
Q4,00:46.8,46.8,Turnover: Traveling,Jeff Teague,,CC,Teague (ATL) moves his pivot foot before releasing the ball.,http://official.nba.com/last-two-minute-report/?gameNo=0021401163&eventNum=511,20150408ATLBKN,20150408ATLBKN-4,ATL,BKN,20150408,Steve Anderson,James Capers,Derrick Collins,114,111,L2M-ATL-BKN-4-8-15.pdf,http://www.basketball-reference.com/boxscores/201504080BRK.html,BKN,ATL
Q4,00:24.1,24.1,Foul: Personal,Thaddeus Young,Jeff Teague,CC,Young (BKN) bumps Teague (ATL) and affects his RSBQ on the drive to the basket.,http://official.nba.com/last-two-minute-report/?gameNo=0021401163&eventNum=521,20150408ATLBKN,20150408ATLBKN-5,ATL,BKN,20150408,Steve Anderson,James Capers,Derrick Collins,114,111,L2M-ATL-BKN-4-8-15.pdf,http://www.basketball-reference.com/boxscores/201504080BRK.html,ATL,BKN
Q4,00:02.7,2.7,Foul: Personal,Jarrett Jack,Jeff Teague,CC,Jack (BKN) commits a take foul on Teague (ATL).,http://official.nba.com/last-two-minute-report/?gameNo=0021401163&eventNum=535,20150408ATLBKN,20150408ATLBKN-6,ATL,BKN,20150408,Steve Anderson,James Capers,Derrick Collins,114,111,L2M-ATL-BKN-4-8-15.pdf,http://www.basketball-reference.com/boxscores/201504080BRK.html,ATL,BKN