period,time,seconds_left,call_type,committing_player,disadvantaged_player,review_decision,comment,video,game_id,play_id,away,home,date,ref_1,ref_2,ref_3,score_away,score_home,original_pdf,box_score_url,disadvantaged_team,committing_team
Q4,01:56.0,116,Foul: Shooting,Carmelo Anthony,Nicolas Batum,CNC,Anthony (NYK) cleanly blocks Batum's (CHA) jump shot. Any contact during the follow-through is incidental.,http://official.nba.com/last-two-minute-report/?gameNo=0021500162&eventNum=1271,20151117CHANYK,20151117CHANYK-0,CHA,NYK,20151117,Sean Corbin,David Guthrie,Marat Kogut,94,102,L2M-CHA-NYK-11-17-15.pdf,http://www.basketball-reference.com/boxscores/201511170NYK.html,CHA,NYK
Q4,01:22.0,82,Foul: Personal,Langston Galloway,Kemba Walker,CC,Galloway (NYK) affects Walker's (CHA) RSBQ at the start of his drive.,http://official.nba.com/last-two-minute-report/?gameNo=0021500162&eventNum=500,20151117CHANYK,20151117CHANYK-1,CHA,NYK,20151117,Sean Corbin,David Guthrie,Marat Kogut,94,102,L2M-CHA-NYK-11-17-15.pdf,http://www.basketball-reference.com/boxscores/201511170NYK.html,CHA,NYK
Q4,00:59.7,59.7,Foul: Offensive,Carmelo Anthony,Nicolas Batum,CNC,Batum (CHA) maintains legal guarding position and Anthony (NYK) legally creates space on his drive.,http://official.nba.com/last-two-minute-report/?gameNo=0021500162&eventNum=1272,20151117CHANYK,20151117CHANYK-2,CHA,NYK,20151117,Sean Corbin,David Guthrie,Marat Kogut,94,102,L2M-CHA-NYK-11-17-15.pdf,http://www.basketball-reference.com/boxscores/201511170NYK.html,CHA,NYK
Q4,00:49.7,49.7,Foul: Offensive,Cody Zeller,Carmelo Anthony,CNC,Zeller (CHA) sets the screen on Anthony (NYK) and gives him room to avoid the contact.,http://official.nba.com/last-two-minute-report/?gameNo=0021500162&eventNum=1273,20151117CHANYK,20151117CHANYK-3,CHA,NYK,20151117,Sean Corbin,David Guthrie,Marat Kogut,94,102,L2M-CHA-NYK-11-17-15.pdf,http://www.basketball-reference.com/boxscores/201511170NYK.html,NYK,CHA
Q4,00:45.2,45.2,Foul: Shooting,Carmelo Anthony,Jeremy Lamb,CNC,Anthony (NYK) legally contests the jump shot by Lamb (CHA) and allows him to land.,http://official.nba.com/last-two-minute-report/?gameNo=0021500162&eventNum=1274,20151117CHANYK,20151117CHANYK-4,CHA,NYK,20151117,Sean Corbin,David Guthrie,Marat Kogut,94,102,L2M-CHA-NYK-11-17-15.pdf,http://www.basketball-reference.com/boxscores/201511170NYK.html,CHA,NYK
Q4,00:11.3,11.3,Foul: Personal,Jeremy Lin,Kristaps Porzingis,CC,Lin (CHA) commits a take foul on Porzingis (NYK).,http://official.nba.com/last-two-minute-report/?gameNo=0021500162&eventNum=516,20151117CHANYK,20151117CHANYK-5,CHA,NYK,20151117,Sean Corbin,David Guthrie,Marat Kogut,94,102,L2M-CHA-NYK-11-17-15.pdf,http://www.basketball-reference.com/boxscores/201511170NYK.html,NYK,CHA
Q4,00:08.1,8.1,Turnover: Traveling,Nicolas Batum,,INC,Batum (CHA) splits his feet on the perimeter.,http://official.nba.com/last-two-minute-report/?gameNo=0021500162&eventNum=1275,20151117CHANYK,20151117CHANYK-6,CHA,NYK,20151117,Sean Corbin,David Guthrie,Marat Kogut,94,102,L2M-CHA-NYK-11-17-15.pdf,http://www.basketball-reference.com/boxscores/201511170NYK.html,NYK,CHA
Q4,00:03.9,3.9,Instant Replay: Support Ruling,,,CC,"After communicating with the Replay Center, the ruling on the court that the foul committed by Hawes (CHA) occurred prior to the clock expiring was upheld. 00:03.9 was placed back on the game clock.",http://official.nba.com/last-two-minute-report/?gameNo=0021500162&eventNum=529,20151117CHANYK,20151117CHANYK-7,CHA,NYK,20151117,Sean Corbin,David Guthrie,Marat Kogut,94,102,L2M-CHA-NYK-11-17-15.pdf,http://www.basketball-reference.com/boxscores/201511170NYK.html,,
Q4,00:03.9,3.9,Foul: Personal,Spencer Hawes,Carmelo Anthony,CC,Hawes (CHA) commits a take foul on Anthony (NYK).,http://official.nba.com/last-two-minute-report/?gameNo=0021500162&eventNum=528,20151117CHANYK,20151117CHANYK-8,CHA,NYK,20151117,Sean Corbin,David Guthrie,Marat Kogut,94,102,L2M-CHA-NYK-11-17-15.pdf,http://www.basketball-reference.com/boxscores/201511170NYK.html,NYK,CHA