period,time,seconds_left,call_type,committing_player,disadvantaged_player,review_decision,comment,video,game_id,play_id,away,home,date,ref_1,ref_2,ref_3,ref_4,score_away,score_home,original_pdf,box_score_url,disadvantaged_team,committing_team
Q4,01:56.0,116,Foul: Personal,Iman Shumpert,Arron Afflalo,CNC,Shumpert (CLE) and Afflalo (NYK) briefly engage and separate away from the ball.,http://official.nba.com/last-two-minute-report/?gameNo=0021500424&eventNum=1249,20151223NYKCLE,20151223NYKCLE-0,NYK,CLE,20151223,Tony Brown,Jason Phillips,Kevin Scott,,84,91,L2M-NYK-CLE-12-23-15.pdf,https://www.basketball-reference.com/boxscores/201512230CLE.html,NYK,CLE
Q4,01:29.0,89,Foul: Personal,Arron Afflalo,LeBron James,CNC,Afflalo (NYK) maintains a legal guarding position as he defends James's (CLE) drive. James loses control of the ball as he dribbles behind his back.,http://official.nba.com/last-two-minute-report/?gameNo=0021500424&eventNum=1250,20151223NYKCLE,20151223NYKCLE-1,NYK,CLE,20151223,Tony Brown,Jason Phillips,Kevin Scott,,84,91,L2M-NYK-CLE-12-23-15.pdf,https://www.basketball-reference.com/boxscores/201512230CLE.html,CLE,NYK
Q4,01:28.0,88,Foul: Loose Ball,Lance Thomas,LeBron James,CNC,Thomas (NYK) and James (CLE) make incidental contact when they dive to gain possession of the loose ball.,http://official.nba.com/last-two-minute-report/?gameNo=0021500424&eventNum=1251,20151223NYKCLE,20151223NYKCLE-2,NYK,CLE,20151223,Tony Brown,Jason Phillips,Kevin Scott,,84,91,L2M-NYK-CLE-12-23-15.pdf,https://www.basketball-reference.com/boxscores/201512230CLE.html,CLE,NYK
Q4,01:09.0,69,Foul: Shooting,Iman Shumpert,Arron Afflalo,CNC,Shumpert (CLE) legally contests Afflalo's (NYK) jump shot attempt and allows him to land.,http://official.nba.com/last-two-minute-report/?gameNo=0021500424&eventNum=1252,20151223NYKCLE,20151223NYKCLE-3,NYK,CLE,20151223,Tony Brown,Jason Phillips,Kevin Scott,,84,91,L2M-NYK-CLE-12-23-15.pdf,https://www.basketball-reference.com/boxscores/201512230CLE.html,NYK,CLE
Q4,00:41.7,41.7,Foul: Personal,Kevin Love,Lance Thomas,CNC,Love (CLE) maintains a legal guarding position at the start of Thomas's (NYK) drive.,http://official.nba.com/last-two-minute-report/?gameNo=0021500424&eventNum=1253,20151223NYKCLE,20151223NYKCLE-4,NYK,CLE,20151223,Tony Brown,Jason Phillips,Kevin Scott,,84,91,L2M-NYK-CLE-12-23-15.pdf,https://www.basketball-reference.com/boxscores/201512230CLE.html,NYK,CLE
Q4,00:12.2,12.2,Foul: Shooting,Matthew Dellavedova,Langston Galloway,CNC,LATR shows that Dellavedova (CLE) and Love (CLE) maintain legal guarding positions as they contest Galloway's (NYK) driving shot attempt.,http://official.nba.com/last-two-minute-report/?gameNo=0021500424&eventNum=1255,20151223NYKCLE,20151223NYKCLE-5,NYK,CLE,20151223,Tony Brown,Jason Phillips,Kevin Scott,,84,91,L2M-NYK-CLE-12-23-15.pdf,https://www.basketball-reference.com/boxscores/201512230CLE.html,NYK,CLE
Q4,00:11.6,11.6,Foul: Loose Ball,Langston Galloway,Kevin Love,,[Incidental or immaterial] LHH shows that Galloway (NYK) initiates contact with Love (CLE) after his shot.,http://official.nba.com/last-two-minute-report/?gameNo=0021500424&eventNum=1255,20151223NYKCLE,20151223NYKCLE-6,NYK,CLE,20151223,Tony Brown,Jason Phillips,Kevin Scott,,84,91,L2M-NYK-CLE-12-23-15.pdf,https://www.basketball-reference.com/boxscores/201512230CLE.html,CLE,NYK
Q4,00:10.0,10,Foul: Personal,Arron Afflalo,Tristan Thompson,CC,Afflalo (NYK) commits a take foul on Thompson (CLE).,http://official.nba.com/last-two-minute-report/?gameNo=0021500424&eventNum=525,20151223NYKCLE,20151223NYKCLE-7,NYK,CLE,20151223,Tony Brown,Jason Phillips,Kevin Scott,,84,91,L2M-NYK-CLE-12-23-15.pdf,https://www.basketball-reference.com/boxscores/201512230CLE.html,CLE,NYK
Q4,00:02.5,2.5,Foul: Personal,Lance Thomas,LeBron James,CC,Thomas (NYK) commits a take foul on James (CLE).,http://official.nba.com/last-two-minute-report/?gameNo=0021500424&eventNum=541,20151223NYKCLE,20151223NYKCLE-8,NYK,CLE,20151223,Tony Brown,Jason Phillips,Kevin Scott,,84,91,L2M-NYK-CLE-12-23-15.pdf,https://www.basketball-reference.com/boxscores/201512230CLE.html,CLE,NYK