period,time,seconds_left,call_type,committing_player,disadvantaged_player,review_decision,comment,video,game_id,play_id,away,home,date,ref_1,ref_2,ref_3,ref_4,score_away,score_home,original_pdf,box_score_url,disadvantaged_team,committing_team
Q4,01:09.0,69,Foul: Shooting,Garrett Temple,Tyler Johnson,CNC,"Temple (WAS) makes slight contact to the body with Johnson (MIA) as he goes up for the putback, but the contact does not affect his shot attempt.",http://official.nba.com/last-two-minute-report/?gameNo=0021400920&eventNum=1233,20150306MIAWAS,20150306MIAWAS-0,MIA,WAS,20150306,Mark Ayotte,Jason Phillips,Haywoode Workman,,97,99,L2M-MIA@WAS-3-6-15.pdf,https://www.basketball-reference.com/boxscores/201503060WAS.html,MIA,WAS
Q4,01:08.0,68,Instant Replay: Overturn Ruling,,,IC,"After communicating with the Replay Center, the ruling on the court that the ball was inside the cylinder when touched by Johnson (MIA) is incorrectly overturned and the basket is counted. After the initial legal tap, there is a subsequent illegal tap inside the cylinder.",http://official.nba.com/last-two-minute-report/?gameNo=0021400920&eventNum=491,20150306MIAWAS,20150306MIAWAS-1,MIA,WAS,20150306,Mark Ayotte,Jason Phillips,Haywoode Workman,,97,99,L2M-MIA@WAS-3-6-15.pdf,https://www.basketball-reference.com/boxscores/201503060WAS.html,,
Q4,00:54.0,54,Foul: Personal,Michael Beasley,Nene,CNC,Beasley (MIA) does not dislodge Nene (WAS) with the contact in the post.,http://official.nba.com/last-two-minute-report/?gameNo=0021400920&eventNum=1234,20150306MIAWAS,20150306MIAWAS-2,MIA,WAS,20150306,Mark Ayotte,Jason Phillips,Haywoode Workman,,97,99,L2M-MIA@WAS-3-6-15.pdf,https://www.basketball-reference.com/boxscores/201503060WAS.html,WAS,MIA
Q4,00:07.2,7.2,Foul: Shooting,Paul Pierce,Henry Walker,CNC,"Pierce (WAS) makes slight contact with Walker's (MIA) hand after the ball is released, but it does not affect his ability to follow-through.",http://official.nba.com/last-two-minute-report/?gameNo=0021400920&eventNum=1235,20150306MIAWAS,20150306MIAWAS-3,MIA,WAS,20150306,Mark Ayotte,Jason Phillips,Haywoode Workman,,97,99,L2M-MIA@WAS-3-6-15.pdf,https://www.basketball-reference.com/boxscores/201503060WAS.html,MIA,WAS
Q4,00:01.9,1.9,Foul: Personal,Tyler Johnson,Bradley Beal,CC,Johnson (MIA) commits a take foul on Beal (WAS).,http://official.nba.com/last-two-minute-report/?gameNo=0021400920&eventNum=501,20150306MIAWAS,20150306MIAWAS-4,MIA,WAS,20150306,Mark Ayotte,Jason Phillips,Haywoode Workman,,97,99,L2M-MIA@WAS-3-6-15.pdf,https://www.basketball-reference.com/boxscores/201503060WAS.html,WAS,MIA
Q4,00:01.6,1.6,Foul: Personal,Shabazz Napier,Bradley Beal,CC,Napier (MIA) commits a take foul on Beal (WAS).,http://official.nba.com/last-two-minute-report/?gameNo=0021400920&eventNum=507,20150306MIAWAS,20150306MIAWAS-5,MIA,WAS,20150306,Mark Ayotte,Jason Phillips,Haywoode Workman,,97,99,L2M-MIA@WAS-3-6-15.pdf,https://www.basketball-reference.com/boxscores/201503060WAS.html,WAS,MIA