period,time,seconds_left,call_type,committing_player,disadvantaged_player,review_decision,comment,video,game_id,play_id,away,home,date,ref_1,ref_2,ref_3,ref_4,score_away,score_home,original_pdf,box_score_url,disadvantaged_team,committing_team
Q4,01:55.0,115,Foul: Personal,Bradley Beal,James Harden,CNC,R-Slash shows that Beal (WAS) maintains legal guarding position as he defends Harden's (HOU) drive and step back shot attempt. The two players make incidental foot to foot contact.,http://official.nba.com/last-two-minute-report/?gameNo=0021500321&eventNum=1314,20151209HOUWAS,20151209HOUWAS-0,HOU,WAS,20151209,Kane Fitzgerald,Tyler Ford,John Goble,,109,103,L2M-HOU-WAS-12-9-15.pdf,https://www.basketball-reference.com/boxscores/201512090WAS.html,HOU,WAS
Q4,01:06.0,66,Foul: Offensive,Marcin Gortat,Jason Terry,CNC,Gortat (WAS) sets the screen on Terry (HOU) and gives him room to avoid the contact.,http://official.nba.com/last-two-minute-report/?gameNo=0021500321&eventNum=1315,20151209HOUWAS,20151209HOUWAS-1,HOU,WAS,20151209,Kane Fitzgerald,Tyler Ford,John Goble,,109,103,L2M-HOU-WAS-12-9-15.pdf,https://www.basketball-reference.com/boxscores/201512090WAS.html,HOU,WAS
Q4,00:51.3,51.3,Foul: Offensive,James Harden,Gary Neal,CNC,Harden (HOU) sets the screen on Neal (WAS) and gives him room to avoid the contact.,http://official.nba.com/last-two-minute-report/?gameNo=0021500321&eventNum=1316,20151209HOUWAS,20151209HOUWAS-2,HOU,WAS,20151209,Kane Fitzgerald,Tyler Ford,John Goble,,109,103,L2M-HOU-WAS-12-9-15.pdf,https://www.basketball-reference.com/boxscores/201512090WAS.html,WAS,HOU
Q4,00:46.8,46.8,Foul: Personal,Patrick Beverley,John Wall,CNC,RHH shows that Beverley (HOU) and Howard (HOU) maintain legal guarding position as they defend Wall's (WAS) drive to the basket. Any contact on the play is initiated by Wall.,http://official.nba.com/last-two-minute-report/?gameNo=0021500321&eventNum=1317,20151209HOUWAS,20151209HOUWAS-3,HOU,WAS,20151209,Kane Fitzgerald,Tyler Ford,John Goble,,109,103,L2M-HOU-WAS-12-9-15.pdf,https://www.basketball-reference.com/boxscores/201512090WAS.html,WAS,HOU
Q4,00:39.3,39.3,Foul: Offensive,Otto Porter,Corey Brewer,CNC,Porter (WAS) sets the screen on Brewer (HOU) and gives him room to avoid the contact.,http://official.nba.com/last-two-minute-report/?gameNo=0021500321&eventNum=1318,20151209HOUWAS,20151209HOUWAS-4,HOU,WAS,20151209,Kane Fitzgerald,Tyler Ford,John Goble,,109,103,L2M-HOU-WAS-12-9-15.pdf,https://www.basketball-reference.com/boxscores/201512090WAS.html,HOU,WAS
Q4,00:37.3,37.3,Foul: Offensive,Marcin Gortat,James Harden,INC,Gortat (WAS) continues moving as he sets the screen on Harden (HOU) without giving him room to avoid the contact.,http://official.nba.com/last-two-minute-report/?gameNo=0021500321&eventNum=1319,20151209HOUWAS,20151209HOUWAS-5,HOU,WAS,20151209,Kane Fitzgerald,Tyler Ford,John Goble,,109,103,L2M-HOU-WAS-12-9-15.pdf,https://www.basketball-reference.com/boxscores/201512090WAS.html,HOU,WAS
Q4,00:22.3,22.3,Foul: Personal,Bradley Beal,James Harden,CC,Beal (WAS) does not obtain a legal guarding position and makes body to body contact with Harden (HOU) that affects his RSBQ.,http://official.nba.com/last-two-minute-report/?gameNo=0021500321&eventNum=580,20151209HOUWAS,20151209HOUWAS-6,HOU,WAS,20151209,Kane Fitzgerald,Tyler Ford,John Goble,,109,103,L2M-HOU-WAS-12-9-15.pdf,https://www.basketball-reference.com/boxscores/201512090WAS.html,HOU,WAS
Q4,00:12.0,12,Foul: Personal,Marcin Gortat,Dwight Howard,CC,Gortat (WAS) commits a take foul on Howard (HOU).,http://official.nba.com/last-two-minute-report/?gameNo=0021500321&eventNum=587,20151209HOUWAS,20151209HOUWAS-7,HOU,WAS,20151209,Kane Fitzgerald,Tyler Ford,John Goble,,109,103,L2M-HOU-WAS-12-9-15.pdf,https://www.basketball-reference.com/boxscores/201512090WAS.html,HOU,WAS
Q4,00:03.9,3.9,Foul: Shooting,Jason Terry,Gary Neal,CC,Terry (HOU) makes contact with Neal's (WAS) arm that affects his jump shot attempt.,http://official.nba.com/last-two-minute-report/?gameNo=0021500321&eventNum=594,20151209HOUWAS,20151209HOUWAS-8,HOU,WAS,20151209,Kane Fitzgerald,Tyler Ford,John Goble,,109,103,L2M-HOU-WAS-12-9-15.pdf,https://www.basketball-reference.com/boxscores/201512090WAS.html,WAS,HOU