period,time,seconds_left,call_type,committing_player,disadvantaged_player,review_decision,comment,video,game_id,play_id,away,home,date,ref_1,ref_2,ref_3,score_away,score_home,original_pdf,box_score_url,disadvantaged_team,committing_team
Q4,01:50.0,110,Foul: Personal,Gordon Hayward,Kevin Durant,CNC,Hayward (UTA) makes incidental contact with Durant (OKC) that does not affect his ability to catch the pass.,http://official.nba.com/last-two-minute-report/?gameNo=0021500341&eventNum=1259,20151211OKCUTA,20151211OKCUTA-0,OKC,UTA,20151211,Derrick Collins,Jason Phillips,Dedric Taylor,94,90,L2M-OKC-UTA-12-11-15.pdf,http://www.basketball-reference.com/boxscores/201512110UTA.html,OKC,UTA
Q4,01:36.0,96,Foul: Personal,Trevor Booker,Russell Westbrook,CNC,"LATR shows that Booker (UTA) and Burke (UTA) maintain legal guarding position as they defend Westbrook's (OKC) drive into the paint. Westbrook trips, but not as a result of any contact.",http://official.nba.com/last-two-minute-report/?gameNo=0021500341&eventNum=1260,20151211OKCUTA,20151211OKCUTA-1,OKC,UTA,20151211,Derrick Collins,Jason Phillips,Dedric Taylor,94,90,L2M-OKC-UTA-12-11-15.pdf,http://www.basketball-reference.com/boxscores/201512110UTA.html,OKC,UTA
Q4,01:26.0,86,Foul: Loose Ball,Serge Ibaka,Derrick Favors,CNC,Ibaka (OKC) and Favors (UTA) engage and separate during rebounding.,http://official.nba.com/last-two-minute-report/?gameNo=0021500341&eventNum=1262,20151211OKCUTA,20151211OKCUTA-2,OKC,UTA,20151211,Derrick Collins,Jason Phillips,Dedric Taylor,94,90,L2M-OKC-UTA-12-11-15.pdf,http://www.basketball-reference.com/boxscores/201512110UTA.html,UTA,OKC
Q4,01:24.0,84,Foul: Personal,Serge Ibaka,Trevor Booker,CC,"After Booker (UTA) secures the rebound, Ibaka (OKC) grabs and holds him.",http://official.nba.com/last-two-minute-report/?gameNo=0021500341&eventNum=453,20151211OKCUTA,20151211OKCUTA-3,OKC,UTA,20151211,Derrick Collins,Jason Phillips,Dedric Taylor,94,90,L2M-OKC-UTA-12-11-15.pdf,http://www.basketball-reference.com/boxscores/201512110UTA.html,UTA,OKC
Q4,00:44.6,44.6,Foul: Personal,Gordon Hayward,Steven Adams,CNC,Hayward (UTA) and Adams (OKC) briefly engage and separate away from the ball.,http://official.nba.com/last-two-minute-report/?gameNo=0021500341&eventNum=1263,20151211OKCUTA,20151211OKCUTA-4,OKC,UTA,20151211,Derrick Collins,Jason Phillips,Dedric Taylor,94,90,L2M-OKC-UTA-12-11-15.pdf,http://www.basketball-reference.com/boxscores/201512110UTA.html,OKC,UTA
Q4,00:35.6,35.6,Foul: Loose Ball,Steven Adams,Rodney Hood,INC,"Adams (OKC) and Hayward (UTA) briefly engage and separate during rebounding. However, as Adams jumps for the rebound, Hood (UTA) comes over his back and dislodges him, affecting his ability to retrieve the rebound.",http://official.nba.com/last-two-minute-report/?gameNo=0021500341&eventNum=1264,20151211OKCUTA,20151211OKCUTA-5,OKC,UTA,20151211,Derrick Collins,Jason Phillips,Dedric Taylor,94,90,L2M-OKC-UTA-12-11-15.pdf,http://www.basketball-reference.com/boxscores/201512110UTA.html,UTA,OKC
Q4,00:03.3,3.3,Foul: Personal,Gordon Hayward,Kevin Durant,CC,Hayward (UTA) commits a take foul on Durant (OKC).,http://official.nba.com/last-two-minute-report/?gameNo=0021500341&eventNum=475,20151211OKCUTA,20151211OKCUTA-6,OKC,UTA,20151211,Derrick Collins,Jason Phillips,Dedric Taylor,94,90,L2M-OKC-UTA-12-11-15.pdf,http://www.basketball-reference.com/boxscores/201512110UTA.html,OKC,UTA
Q4,00:02.0,2,Foul: Personal,Trevor Booker,Kevin Durant,CC,Booker (UTA) commits a take foul on Durant (OKC).,http://official.nba.com/last-two-minute-report/?gameNo=0021500341&eventNum=483,20151211OKCUTA,20151211OKCUTA-7,OKC,UTA,20151211,Derrick Collins,Jason Phillips,Dedric Taylor,94,90,L2M-OKC-UTA-12-11-15.pdf,http://www.basketball-reference.com/boxscores/201512110UTA.html,OKC,UTA