period,time,seconds_left,call_type,committing_player,disadvantaged_player,review_decision,comment,video,game_id,play_id,away,home,date,ref_1,ref_2,ref_3,ref_4,score_away,score_home,original_pdf,box_score_url,disadvantaged_team,committing_team
Q4,01:41.0,101,Foul: Offensive,Marcus Smart,Seth Curry,CNC,Smart (BOS) sets the screen on Curry (DAL) and gives him room to avoid the contact.,http://official.nba.com/last-two-minute-report/?gameNo=0021600161&eventNum=1110,20161116DALBOS,20161116DALBOS-0,DAL,BOS,20161116,Steve Anderson,James Capers,Pat Fraher,,83,90,L2M-DAL-BOS-11-16-16.pdf,https://www.basketball-reference.com/boxscores/201611160BOS.html,DAL,BOS
Q4,01:32.0,92,Foul: Shooting,Wesley Matthews,Isaiah Thomas,CNC,Matthews (DAL) allows Thomas (BOS) to land following the jump shot attempt.,http://official.nba.com/last-two-minute-report/?gameNo=0021600161&eventNum=1111,20161116DALBOS,20161116DALBOS-1,DAL,BOS,20161116,Steve Anderson,James Capers,Pat Fraher,,83,90,L2M-DAL-BOS-11-16-16.pdf,https://www.basketball-reference.com/boxscores/201611160BOS.html,BOS,DAL
Q4,01:18.0,78,Foul: Personal,Isaiah Thomas,Harrison Barnes,CNC,Thomas (BOS) makes marginal contact with Barnes (DAL) that does not affect his movement to the basket.,http://official.nba.com/last-two-minute-report/?gameNo=0021600161&eventNum=1113,20161116DALBOS,20161116DALBOS-2,DAL,BOS,20161116,Steve Anderson,James Capers,Pat Fraher,,83,90,L2M-DAL-BOS-11-16-16.pdf,https://www.basketball-reference.com/boxscores/201611160BOS.html,DAL,BOS
Q4,01:11.0,71,Turnover: Punched Ball,Justin Anderson,,INC,Anderson (DAL) keeps the ball in play by striking it with a fist.,http://official.nba.com/last-two-minute-report/?gameNo=0021600161&eventNum=1145,20161116DALBOS,20161116DALBOS-3,DAL,BOS,20161116,Steve Anderson,James Capers,Pat Fraher,,83,90,L2M-DAL-BOS-11-16-16.pdf,https://www.basketball-reference.com/boxscores/201611160BOS.html,BOS,DAL
Q4,00:41.4,41.4,Foul: Personal,Harrison Barnes,Isaiah Thomas,CC,Barnes (DAL) makes contact with Thomas (BOS) that affects his SQBR.,http://official.nba.com/last-two-minute-report/?gameNo=0021600161&eventNum=467,20161116DALBOS,20161116DALBOS-4,DAL,BOS,20161116,Steve Anderson,James Capers,Pat Fraher,,83,90,L2M-DAL-BOS-11-16-16.pdf,https://www.basketball-reference.com/boxscores/201611160BOS.html,BOS,DAL
Q4,00:39.8,39.8,Foul: Shooting,Isaiah Thomas,Harrison Barnes,CNC,Thomas (BOS) reaches in but does not make any contact with Barnes (DAL) that affects his SQBR to the basket.,http://official.nba.com/last-two-minute-report/?gameNo=0021600161&eventNum=1116,20161116DALBOS,20161116DALBOS-5,DAL,BOS,20161116,Steve Anderson,James Capers,Pat Fraher,,83,90,L2M-DAL-BOS-11-16-16.pdf,https://www.basketball-reference.com/boxscores/201611160BOS.html,DAL,BOS
Q4,00:31.1,31.1,Turnover: Traveling,Marcus Smart,,,[Observable in enhanced video] Smart (BOS) moves his pivot foot. The official is looking for any illegal contact and does not pick up the pivot foot.,http://official.nba.com/last-two-minute-report/?gameNo=0021600161&eventNum=1117,20161116DALBOS,20161116DALBOS-6,DAL,BOS,20161116,Steve Anderson,James Capers,Pat Fraher,,83,90,L2M-DAL-BOS-11-16-16.pdf,https://www.basketball-reference.com/boxscores/201611160BOS.html,DAL,BOS
Q4,00:22.4,22.4,Foul: Personal,Harrison Barnes,Isaiah Thomas,CC,Barnes (DAL) makes contact with Thomas (BOS) that affects his SQBR.,http://official.nba.com/last-two-minute-report/?gameNo=0021600161&eventNum=482,20161116DALBOS,20161116DALBOS-7,DAL,BOS,20161116,Steve Anderson,James Capers,Pat Fraher,,83,90,L2M-DAL-BOS-11-16-16.pdf,https://www.basketball-reference.com/boxscores/201611160BOS.html,BOS,DAL
Q4,00:14.4,14.4,Foul: Personal,Avery Bradley,Seth Curry,CNC,Bradley (BOS) makes marginal contact with Curry (DAL) that does not affect his SQBR.,http://official.nba.com/last-two-minute-report/?gameNo=0021600161&eventNum=1118,20161116DALBOS,20161116DALBOS-8,DAL,BOS,20161116,Steve Anderson,James Capers,Pat Fraher,,83,90,L2M-DAL-BOS-11-16-16.pdf,https://www.basketball-reference.com/boxscores/201611160BOS.html,DAL,BOS