period,time,seconds_left,call_type,committing_player,disadvantaged_player,review_decision,comment,video,game_id,play_id,away,home,date,ref_1,ref_2,ref_3,score_away,score_home,original_pdf,box_score_url,disadvantaged_team,committing_team
Q4,01:32.0,92,Foul: Personal,Manu Ginobili,Langston Galloway,CNC,Ginobili (SAS) makes incidental contact that does not affect Galloway's (NYK) RSBQ.,http://official.nba.com/last-two-minute-report/?gameNo=0021500546&eventNum=1254,20160108NYKSAS,20160108NYKSAS-0,NYK,SAS,20160108,Nick Buchert,Ed Malloy,J.T. Orr,99,100,L2M-NYK-SAS-1-8-16.pdf,http://www.basketball-reference.com/boxscores/201601080SAS.html,NYK,SAS
Q4,00:52.6,52.6,Foul: Offensive,Carmelo Anthony,Manu Ginobili,CNC,Anthony (NYK) sets the screen on Ginobili (SAS) and gives him room to avoid the contact.,http://official.nba.com/last-two-minute-report/?gameNo=0021500546&eventNum=1255,20160108NYKSAS,20160108NYKSAS-1,NYK,SAS,20160108,Nick Buchert,Ed Malloy,J.T. Orr,99,100,L2M-NYK-SAS-1-8-16.pdf,http://www.basketball-reference.com/boxscores/201601080SAS.html,SAS,NYK
Q4,00:50.8,50.8,Foul: Shooting,Danny Green,Arron Afflalo,CNC,Green (SAS) legally contests Afflalo's (NYK) jump shot attempt.,http://official.nba.com/last-two-minute-report/?gameNo=0021500546&eventNum=1256,20160108NYKSAS,20160108NYKSAS-2,NYK,SAS,20160108,Nick Buchert,Ed Malloy,J.T. Orr,99,100,L2M-NYK-SAS-1-8-16.pdf,http://www.basketball-reference.com/boxscores/201601080SAS.html,NYK,SAS
Q4,00:41.8,41.8,Foul: Personal,Kristaps Porzingis,LaMarcus Aldridge,CNC,Porzingis (NYK) and Aldridge (SAS) briefly engage and separate away from the ball.,http://official.nba.com/last-two-minute-report/?gameNo=0021500546&eventNum=1257,20160108NYKSAS,20160108NYKSAS-3,NYK,SAS,20160108,Nick Buchert,Ed Malloy,J.T. Orr,99,100,L2M-NYK-SAS-1-8-16.pdf,http://www.basketball-reference.com/boxscores/201601080SAS.html,SAS,NYK
Q4,00:33.3,33.3,Foul: Offensive,Carmelo Anthony,LaMarcus Aldridge,CNC,Anthony (NYK) sets the back screen on Aldridge (SAS) and gives him room to avoid the contact.,http://official.nba.com/last-two-minute-report/?gameNo=0021500546&eventNum=1258,20160108NYKSAS,20160108NYKSAS-4,NYK,SAS,20160108,Nick Buchert,Ed Malloy,J.T. Orr,99,100,L2M-NYK-SAS-1-8-16.pdf,http://www.basketball-reference.com/boxscores/201601080SAS.html,SAS,NYK
Q4,00:20.6,20.6,Foul: Personal,Arron Afflalo,Manu Ginobili,CNC,Afflalo (NYK) and Ginobili (SAS) briefly engage and separate away from the ball.,http://official.nba.com/last-two-minute-report/?gameNo=0021500546&eventNum=1259,20160108NYKSAS,20160108NYKSAS-5,NYK,SAS,20160108,Nick Buchert,Ed Malloy,J.T. Orr,99,100,L2M-NYK-SAS-1-8-16.pdf,http://www.basketball-reference.com/boxscores/201601080SAS.html,SAS,NYK
Q4,00:03.9,3.9,Foul: Personal,Kawhi Leonard,Carmelo Anthony,CNC,Leonard (SAS) maintains legal guarding position as he defends Anthony's (NYK) drive.,http://official.nba.com/last-two-minute-report/?gameNo=0021500546&eventNum=1260,20160108NYKSAS,20160108NYKSAS-6,NYK,SAS,20160108,Nick Buchert,Ed Malloy,J.T. Orr,99,100,L2M-NYK-SAS-1-8-16.pdf,http://www.basketball-reference.com/boxscores/201601080SAS.html,NYK,SAS
Q4,00:01.9,1.9,Foul: Shooting,Manu Ginobili,Jose Calderon,CNC,Ginobili (SAS) legally contests Calderon's (NYK) jump shot attempt.,http://official.nba.com/last-two-minute-report/?gameNo=0021500546&eventNum=1261,20160108NYKSAS,20160108NYKSAS-7,NYK,SAS,20160108,Nick Buchert,Ed Malloy,J.T. Orr,99,100,L2M-NYK-SAS-1-8-16.pdf,http://www.basketball-reference.com/boxscores/201601080SAS.html,NYK,SAS
Q4,00:00.0,0,Foul: Loose Ball,LaMarcus Aldridge,Kristaps Porzingis,CNC,Aldridge (SAS) and Porzingis (NYK) makes incidental contact with one another during rebounding after the game clock has already expired.,http://official.nba.com/last-two-minute-report/?gameNo=0021500546&eventNum=1262,20160108NYKSAS,20160108NYKSAS-8,NYK,SAS,20160108,Nick Buchert,Ed Malloy,J.T. Orr,99,100,L2M-NYK-SAS-1-8-16.pdf,http://www.basketball-reference.com/boxscores/201601080SAS.html,NYK,SAS