period,time,seconds_left,call_type,committing_player,disadvantaged_player,review_decision,comment,video,game_id,play_id,away,home,date,ref_1,ref_2,ref_3,ref_4,score_away,score_home,original_pdf,box_score_url,disadvantaged_team,committing_team
Q4,01:48.0,108,Foul: Personal,Alexis Ajinca,Ian Mahinmi,CNC,Ajinca (NOP) and Mahinmi (IND) make incidental contact with one another away from the ball.,http://official.nba.com/last-two-minute-report/?gameNo=0021500544&eventNum=1242,20160108INDNOP,20160108INDNOP-0,IND,NOP,20160108,Mike Callahan,Tyler Ford,David Jones,,91,86,L2M-IND-NOP-1-8-16.pdf,https://www.basketball-reference.com/boxscores/201601080NOP.html,IND,NOP
Q4,01:25.0,85,Foul: Personal,Norris Cole,Monta Ellis,CNC,Cole (NOP) cleanly strips the ball from Ellis (IND),http://official.nba.com/last-two-minute-report/?gameNo=0021500544&eventNum=1243,20160108INDNOP,20160108INDNOP-1,IND,NOP,20160108,Mike Callahan,Tyler Ford,David Jones,,91,86,L2M-IND-NOP-1-8-16.pdf,https://www.basketball-reference.com/boxscores/201601080NOP.html,IND,NOP
Q4,00:59.0,59,Foul: Personal,Norris Cole,Monta Ellis,CNC,Evans (NOP) and Cole (NOP) maintain legal guarding position as they defend Ellis (IND) at the start of the drive. Ellis dribbles the ball off of Cole and the two players make incidental contact with one another while diving for the loose ball.,http://official.nba.com/last-two-minute-report/?gameNo=0021500544&eventNum=1244,20160108INDNOP,20160108INDNOP-2,IND,NOP,20160108,Mike Callahan,Tyler Ford,David Jones,,91,86,L2M-IND-NOP-1-8-16.pdf,https://www.basketball-reference.com/boxscores/201601080NOP.html,IND,NOP
Q4,00:45.7,45.7,Foul: Offensive,Alexis Ajinca,George Hill,INC,Ajinca (NOP) sets the screen on Hill (IND) without giving him room to avoid the contact.,http://official.nba.com/last-two-minute-report/?gameNo=0021500544&eventNum=1245,20160108INDNOP,20160108INDNOP-3,IND,NOP,20160108,Mike Callahan,Tyler Ford,David Jones,,91,86,L2M-IND-NOP-1-8-16.pdf,https://www.basketball-reference.com/boxscores/201601080NOP.html,IND,NOP
Q4,00:20.3,20.3,Foul: Loose Ball,Paul George,Ryan Anderson,CNC,George (IND) and Anderson (NOP) make incidental contact with one another during rebounding.,http://official.nba.com/last-two-minute-report/?gameNo=0021500544&eventNum=1246,20160108INDNOP,20160108INDNOP-4,IND,NOP,20160108,Mike Callahan,Tyler Ford,David Jones,,91,86,L2M-IND-NOP-1-8-16.pdf,https://www.basketball-reference.com/boxscores/201601080NOP.html,NOP,IND
Q4,00:20.2,20.2,Foul: Shooting,Ryan Anderson,George Hill,CNC,RHH shows that Anderson (NOP) makes incidental contact with Hill (IND) that does not affect his putback layup attempt.,http://official.nba.com/last-two-minute-report/?gameNo=0021500544&eventNum=1246,20160108INDNOP,20160108INDNOP-5,IND,NOP,20160108,Mike Callahan,Tyler Ford,David Jones,,91,86,L2M-IND-NOP-1-8-16.pdf,https://www.basketball-reference.com/boxscores/201601080NOP.html,IND,NOP
Q4,00:12.3,12.3,Foul: Shooting,Monta Ellis,Eric Gordon,CNC,Ellis (IND) legally contests Gordon's (NOP) jump shot attempt.,http://official.nba.com/last-two-minute-report/?gameNo=0021500544&eventNum=1247,20160108INDNOP,20160108INDNOP-6,IND,NOP,20160108,Mike Callahan,Tyler Ford,David Jones,,91,86,L2M-IND-NOP-1-8-16.pdf,https://www.basketball-reference.com/boxscores/201601080NOP.html,NOP,IND
Q4,00:05.6,5.6,Foul: Personal,Ryan Anderson,Paul George,CC,Anderson (NOP) commits a take foul on George (IND).,http://official.nba.com/last-two-minute-report/?gameNo=0021500544&eventNum=533,20160108INDNOP,20160108INDNOP-7,IND,NOP,20160108,Mike Callahan,Tyler Ford,David Jones,,91,86,L2M-IND-NOP-1-8-16.pdf,https://www.basketball-reference.com/boxscores/201601080NOP.html,IND,NOP
Q4,00:05.6,5.6,Foul: Personal,Paul George,Ryan Anderson,CNC,George (IND) and Anderson (NOP) make incidental foot to foot contact that causes both players to stumble.,http://official.nba.com/last-two-minute-report/?gameNo=0021500544&eventNum=1248,20160108INDNOP,20160108INDNOP-8,IND,NOP,20160108,Mike Callahan,Tyler Ford,David Jones,,91,86,L2M-IND-NOP-1-8-16.pdf,https://www.basketball-reference.com/boxscores/201601080NOP.html,NOP,IND