period,time,seconds_left,call_type,committing_player,disadvantaged_player,review_decision,comment,video,game_id,play_id,away,home,date,ref_1,ref_2,ref_3,ref_4,score_away,score_home,original_pdf,box_score_url,disadvantaged_team,committing_team
Q4,01:48.0,108,Foul: Personal,David West,Kobe Bryant,CNC,West (SAS) maintains legal guarding position and makes incidental contact with Bryant (LAL) that does not affect his RSBQ.,http://official.nba.com/last-two-minute-report/?gameNo=0021500767&eventNum=1322,20160206LALSAS,20160206LALSAS-0,LAL,SAS,20160206,Sean Corbin,Leroy Richardson,Gary Zielinski,,102,106,L2M-LAL-SAS-2-6-16.pdf,https://www.basketball-reference.com/boxscores/201602060SAS.html,LAL,SAS
Q4,01:46.0,106,Foul: Personal,Kawhi Leonard,Kobe Bryant,CNC,Leonard (SAS) makes incidental contact that does not affect Bryant's (LAL) RSBQ.,http://official.nba.com/last-two-minute-report/?gameNo=0021500767&eventNum=1323,20160206LALSAS,20160206LALSAS-1,LAL,SAS,20160206,Sean Corbin,Leroy Richardson,Gary Zielinski,,102,106,L2M-LAL-SAS-2-6-16.pdf,https://www.basketball-reference.com/boxscores/201602060SAS.html,LAL,SAS
Q4,01:12.0,72,Foul: Shooting,David West,Julius Randle,CC,West (SAS) makes contact with Randle's (LAL) body that affects his driving shot attempt.,http://official.nba.com/last-two-minute-report/?gameNo=0021500767&eventNum=500,20160206LALSAS,20160206LALSAS-2,LAL,SAS,20160206,Sean Corbin,Leroy Richardson,Gary Zielinski,,102,106,L2M-LAL-SAS-2-6-16.pdf,https://www.basketball-reference.com/boxscores/201602060SAS.html,LAL,SAS
Q4,01:02.0,62,Violation: Defensive Goaltending,Brandon Bass,,CC,Bass (LAL) makes contact with the ball after it makes contact with the backboard.,http://official.nba.com/last-two-minute-report/?gameNo=0021500767&eventNum=508,20160206LALSAS,20160206LALSAS-3,LAL,SAS,20160206,Sean Corbin,Leroy Richardson,Gary Zielinski,,102,106,L2M-LAL-SAS-2-6-16.pdf,https://www.basketball-reference.com/boxscores/201602060SAS.html,SAS,LAL
Q4,00:31.6,31.6,Foul: Shooting,Jordan Clarkson,LaMarcus Aldridge,CC,Clarkson (LAL) makes contact with Aldridge's (SAS) body that affects his shot attempt.,http://official.nba.com/last-two-minute-report/?gameNo=0021500767&eventNum=519,20160206LALSAS,20160206LALSAS-4,LAL,SAS,20160206,Sean Corbin,Leroy Richardson,Gary Zielinski,,102,106,L2M-LAL-SAS-2-6-16.pdf,https://www.basketball-reference.com/boxscores/201602060SAS.html,SAS,LAL
Q4,00:31.3,31.3,Foul: Loose Ball,Kawhi Leonard,Kobe Bryant,CC,"Leonard (SAS) makes contact with Bryant's (LAL) arm, affecting his ability to retrieve the rebound.",http://official.nba.com/last-two-minute-report/?gameNo=0021500767&eventNum=523,20160206LALSAS,20160206LALSAS-5,LAL,SAS,20160206,Sean Corbin,Leroy Richardson,Gary Zielinski,,102,106,L2M-LAL-SAS-2-6-16.pdf,https://www.basketball-reference.com/boxscores/201602060SAS.html,LAL,SAS
Q4,00:13.5,13.5,Foul: Offensive,Boris Diaw,Lou Williams,CNC,Diaw (SAS) sets the screen on Williams (LAL) and gives him room to avoid the contact.,http://official.nba.com/last-two-minute-report/?gameNo=0021500767&eventNum=1325,20160206LALSAS,20160206LALSAS-6,LAL,SAS,20160206,Sean Corbin,Leroy Richardson,Gary Zielinski,,102,106,L2M-LAL-SAS-2-6-16.pdf,https://www.basketball-reference.com/boxscores/201602060SAS.html,LAL,SAS
Q4,00:10.5,10.5,Foul: Shooting,Lou Williams,Danny Green,CNC,Williams (LAL) legally contests Green's (SAS) jump shot attempt. Green initiates any contact on the play when he extends his right leg into Williams.,http://official.nba.com/last-two-minute-report/?gameNo=0021500767&eventNum=1327,20160206LALSAS,20160206LALSAS-7,LAL,SAS,20160206,Sean Corbin,Leroy Richardson,Gary Zielinski,,102,106,L2M-LAL-SAS-2-6-16.pdf,https://www.basketball-reference.com/boxscores/201602060SAS.html,SAS,LAL
Q4,00:01.2,1.2,Foul: Personal,Kobe Bryant,Boris Diaw,IC,"Bryant (LAL) commits a take foul on Diaw (SAS), which is correctly called, but the clock be reset to 00:01.8.",http://official.nba.com/last-two-minute-report/?gameNo=0021500767&eventNum=532,20160206LALSAS,20160206LALSAS-8,LAL,SAS,20160206,Sean Corbin,Leroy Richardson,Gary Zielinski,,102,106,L2M-LAL-SAS-2-6-16.pdf,https://www.basketball-reference.com/boxscores/201602060SAS.html,SAS,LAL