period,time,seconds_left,call_type,committing_player,disadvantaged_player,review_decision,comment,video,game_id,play_id,away,home,date,ref_1,ref_2,ref_3,score_away,score_home,original_pdf,box_score_url,disadvantaged_team,committing_team
Q4,01:55.0,115,Foul: Personal,Jae Crowder,Michael Kidd-Gilchrist,CNC,Crowder (BOS) makes marginal contact with Kidd-Gilchrist (CHA) that does not affect his ability to control the pass.,http://official.nba.com/last-two-minute-report/?gameNo=0021601189&eventNum=1056,20170408BOSCHA,20170408BOSCHA-0,BOS,CHA,20170408,Steve Anderson,Scott Foster,Rodney Mott,121,114,L2M-BOS-CHA-04-08-17.pdf,http://www.basketball-reference.com/boxscores/201704080CHO.html,CHA,BOS
Q4,01:54.0,114,Foul: Shooting,Marcus Smart,Michael Kidd-Gilchrist,CNC,Smart (BOS) cleanly strips the ball from Kidd-Gilchrist (CHA).,http://official.nba.com/last-two-minute-report/?gameNo=0021601189&eventNum=1057,20170408BOSCHA,20170408BOSCHA-1,BOS,CHA,20170408,Steve Anderson,Scott Foster,Rodney Mott,121,114,L2M-BOS-CHA-04-08-17.pdf,http://www.basketball-reference.com/boxscores/201704080CHO.html,CHA,BOS
Q4,01:52.0,112,Foul: Personal,Michael Kidd-Gilchrist,Marcus Smart,CC,Kidd-Gilchrist (CHA) makes body to body contact with Smart (BOS) that affects his SQBR.,http://official.nba.com/last-two-minute-report/?gameNo=0021601189&eventNum=468,20170408BOSCHA,20170408BOSCHA-2,BOS,CHA,20170408,Steve Anderson,Scott Foster,Rodney Mott,121,114,L2M-BOS-CHA-04-08-17.pdf,http://www.basketball-reference.com/boxscores/201704080CHO.html,BOS,CHA
Q4,01:44.0,104,Foul: Offensive,Al Horford,Kemba Walker,CNC,Horford (BOS) sets the screen on Walker (CHA) and gives him room to avoid the contact.,http://official.nba.com/last-two-minute-report/?gameNo=0021601189&eventNum=1058,20170408BOSCHA,20170408BOSCHA-3,BOS,CHA,20170408,Steve Anderson,Scott Foster,Rodney Mott,121,114,L2M-BOS-CHA-04-08-17.pdf,http://www.basketball-reference.com/boxscores/201704080CHO.html,CHA,BOS
Q4,01:42.0,102,Foul: Shooting,Cody Zeller,Isaiah Thomas,CC,Zeller (CHA) makes contact to Thomas' (BOS) arm that affects his jump shot attempt.,http://official.nba.com/last-two-minute-report/?gameNo=0021601189&eventNum=469,20170408BOSCHA,20170408BOSCHA-4,BOS,CHA,20170408,Steve Anderson,Scott Foster,Rodney Mott,121,114,L2M-BOS-CHA-04-08-17.pdf,http://www.basketball-reference.com/boxscores/201704080CHO.html,BOS,CHA
Q4,01:33.0,93,Foul: Shooting,Avery Bradley,Nicolas Batum,CC,Bradley (BOS) makes contact to Batum's (CHA) arm that affects his jump shot attempt.,http://official.nba.com/last-two-minute-report/?gameNo=0021601189&eventNum=476,20170408BOSCHA,20170408BOSCHA-5,BOS,CHA,20170408,Steve Anderson,Scott Foster,Rodney Mott,121,114,L2M-BOS-CHA-04-08-17.pdf,http://www.basketball-reference.com/boxscores/201704080CHO.html,CHA,BOS
Q4,01:33.0,93,Instant Replay: Support Ruling,,,CC,"After communicating with the Replay Center, the ruling on the floor that Batum (CHA) was attempting a 3pt field goal when fouled is confirmed.",http://official.nba.com/last-two-minute-report/?gameNo=0021601189&eventNum=476,20170408BOSCHA,20170408BOSCHA-6,BOS,CHA,20170408,Steve Anderson,Scott Foster,Rodney Mott,121,114,L2M-BOS-CHA-04-08-17.pdf,http://www.basketball-reference.com/boxscores/201704080CHO.html,,
Q4,01:23.0,83,Foul: Shooting,Cody Zeller,Isaiah Thomas,CNC,"Zeller (CHA) legally contests Thomas' (BOS) jump shot attempt. Any ""high-five"" contact after the release is considered incidental.",http://official.nba.com/last-two-minute-report/?gameNo=0021601189&eventNum=1059,20170408BOSCHA,20170408BOSCHA-7,BOS,CHA,20170408,Steve Anderson,Scott Foster,Rodney Mott,121,114,L2M-BOS-CHA-04-08-17.pdf,http://www.basketball-reference.com/boxscores/201704080CHO.html,BOS,CHA
Q4,00:59.0,59,Foul: Defense 3 Second,Nicolas Batum,,,[Observable in enhanced video] Batum (CHA) fails to fully clear the lane and is in the paint without actively guarding an opponent for longer than three seconds.,http://official.nba.com/last-two-minute-report/?gameNo=0021601189&eventNum=1061,20170408BOSCHA,20170408BOSCHA-8,BOS,CHA,20170408,Steve Anderson,Scott Foster,Rodney Mott,121,114,L2M-BOS-CHA-04-08-17.pdf,http://www.basketball-reference.com/boxscores/201704080CHO.html,BOS,CHA
Q4,00:58.8,58.8,Foul: Offensive,Isaiah Thomas,Kemba Walker,CNC,Thomas (BOS) makes marginal contact with Walker (CHA) on the perimeter. The foot to foot contact is considered incidental.,http://official.nba.com/last-two-minute-report/?gameNo=0021601189&eventNum=1063,20170408BOSCHA,20170408BOSCHA-9,BOS,CHA,20170408,Steve Anderson,Scott Foster,Rodney Mott,121,114,L2M-BOS-CHA-04-08-17.pdf,http://www.basketball-reference.com/boxscores/201704080CHO.html,CHA,BOS
Q4,00:48.4,48.4,Foul: Personal,Marcus Smart,Cody Zeller,CNC,Smart (BOS) and Zeller (CHA) briefly engage and separate off the ball.,http://official.nba.com/last-two-minute-report/?gameNo=0021601189&eventNum=1063,20170408BOSCHA,20170408BOSCHA-10,BOS,CHA,20170408,Steve Anderson,Scott Foster,Rodney Mott,121,114,L2M-BOS-CHA-04-08-17.pdf,http://www.basketball-reference.com/boxscores/201704080CHO.html,CHA,BOS
Q4,00:45.6,45.6,Foul: Shooting,Isaiah Thomas,Jeremy Lamb,CNC,Thomas (BOS) legally contests Lamb's (CHA) jump shot attempt.,http://official.nba.com/last-two-minute-report/?gameNo=0021601189&eventNum=1064,20170408BOSCHA,20170408BOSCHA-11,BOS,CHA,20170408,Steve Anderson,Scott Foster,Rodney Mott,121,114,L2M-BOS-CHA-04-08-17.pdf,http://www.basketball-reference.com/boxscores/201704080CHO.html,CHA,BOS
Q4,00:43.3,43.3,Turnover: Offensive Goaltending,Marvin Williams,,CC,Williams (CHA) makes contact with the ball while part of it still remains in the cylinder above the basket ring.,http://official.nba.com/last-two-minute-report/?gameNo=0021601189&eventNum=495,20170408BOSCHA,20170408BOSCHA-12,BOS,CHA,20170408,Steve Anderson,Scott Foster,Rodney Mott,121,114,L2M-BOS-CHA-04-08-17.pdf,http://www.basketball-reference.com/boxscores/201704080CHO.html,BOS,CHA
Q4,00:43.3,43.3,Instant Replay: Support Ruling,,,CC,"After communicating with the Replay Center, the ruling on the floor of offensive basket interference is confirmed.",http://official.nba.com/last-two-minute-report/?gameNo=0021601189&eventNum=496,20170408BOSCHA,20170408BOSCHA-13,BOS,CHA,20170408,Steve Anderson,Scott Foster,Rodney Mott,121,114,L2M-BOS-CHA-04-08-17.pdf,http://www.basketball-reference.com/boxscores/201704080CHO.html,,
Q4,00:41.4,41.4,Foul: Personal,Brian Roberts,Isaiah Thomas,CNC,Roberts (CHA) makes incidental contact with Thomas (BOS) that does not affect his SQBR.,http://official.nba.com/last-two-minute-report/?gameNo=0021601189&eventNum=1065,20170408BOSCHA,20170408BOSCHA-14,BOS,CHA,20170408,Steve Anderson,Scott Foster,Rodney Mott,121,114,L2M-BOS-CHA-04-08-17.pdf,http://www.basketball-reference.com/boxscores/201704080CHO.html,BOS,CHA
Q4,00:27.6,27.6,Foul: Shooting,Isaiah Thomas,Brian Roberts,CC,Thomas (BOS) makes contact to Roberts' (CHA) arm that affects his jump shot attempt.,http://official.nba.com/last-two-minute-report/?gameNo=0021601189&eventNum=499,20170408BOSCHA,20170408BOSCHA-15,BOS,CHA,20170408,Steve Anderson,Scott Foster,Rodney Mott,121,114,L2M-BOS-CHA-04-08-17.pdf,http://www.basketball-reference.com/boxscores/201704080CHO.html,CHA,BOS
Q4,00:24.7,24.7,Foul: Personal,Marvin Williams,Marcus Smart,CC,Williams (CHA) commits a take foul on Smart (BOS).,http://official.nba.com/last-two-minute-report/?gameNo=0021601189&eventNum=506,20170408BOSCHA,20170408BOSCHA-16,BOS,CHA,20170408,Steve Anderson,Scott Foster,Rodney Mott,121,114,L2M-BOS-CHA-04-08-17.pdf,http://www.basketball-reference.com/boxscores/201704080CHO.html,BOS,CHA
Q4,00:15.4,15.4,Foul: Personal,Isaiah Thomas,Jeremy Lamb,CNC,Thomas (BOS) makes incidental contact with Lamb (CHA) that does not affect his FOM.,http://official.nba.com/last-two-minute-report/?gameNo=0021601189&eventNum=1066,20170408BOSCHA,20170408BOSCHA-17,BOS,CHA,20170408,Steve Anderson,Scott Foster,Rodney Mott,121,114,L2M-BOS-CHA-04-08-17.pdf,http://www.basketball-reference.com/boxscores/201704080CHO.html,CHA,BOS