period,time,seconds_left,call_type,committing_player,disadvantaged_player,review_decision,comment,video,game_id,play_id,away,home,date,ref_1,ref_2,ref_3,ref_4,score_away,score_home,original_pdf,box_score_url,disadvantaged_team,committing_team
Q4,01:56.0,116,Foul: Offensive,Nikola Jokic,Goran Dragic,CNC,Jokic (DEN) makes marginal contact with Dragic (MIA) following the screen.,http://official.nba.com/last-two-minute-report/?gameNo=0021700127&eventNum=1019,20171103MIADEN,20171103MIADEN-0,MIA,DEN,20171103,James Capers,Kevin Scott,Jonathan Sterling,,94,95,L2M-MIA-DEN-11-03-2017.pdf,https://www.basketball-reference.com/boxscores/201711030DEN.html,MIA,DEN
Q4,01:53.0,113,Turnover: Palming,Paul Millsap,,CNC,Millsap (DEN) does not bring his hand underneath the ball when he brings his dribble to a pause.,http://official.nba.com/last-two-minute-report/?gameNo=0021700127&eventNum=1020,20171103MIADEN,20171103MIADEN-1,MIA,DEN,20171103,James Capers,Kevin Scott,Jonathan Sterling,,94,95,L2M-MIA-DEN-11-03-2017.pdf,https://www.basketball-reference.com/boxscores/201711030DEN.html,MIA,DEN
Q4,01:53.0,113,Foul: Shooting,James Johnson,Paul Millsap,CNC,Johnson (MIA) maintains legal guarding position and makes contact with ball on the drive to the basket by Millsap (DEN).,http://official.nba.com/last-two-minute-report/?gameNo=0021700127&eventNum=1020,20171103MIADEN,20171103MIADEN-2,MIA,DEN,20171103,James Capers,Kevin Scott,Jonathan Sterling,,94,95,L2M-MIA-DEN-11-03-2017.pdf,https://www.basketball-reference.com/boxscores/201711030DEN.html,DEN,MIA
Q4,01:48.0,108,Foul: Shooting,Josh Richardson,Paul Millsap,CC,Richardson (MIA) makes contact to Millsap's (DEN) arm that affects his driving shot attempt.,http://official.nba.com/last-two-minute-report/?gameNo=0021700127&eventNum=605,20171103MIADEN,20171103MIADEN-3,MIA,DEN,20171103,James Capers,Kevin Scott,Jonathan Sterling,,94,95,L2M-MIA-DEN-11-03-2017.pdf,https://www.basketball-reference.com/boxscores/201711030DEN.html,DEN,MIA
Q4,01:41.0,101,Foul: Offensive,Hassan Whiteside,Gary Harris,INC,Whiteside (MIA) sets the screen on Harris (DEN) from a wide stance and the contact occurs to his leg.,http://official.nba.com/last-two-minute-report/?gameNo=0021700127&eventNum=1021,20171103MIADEN,20171103MIADEN-4,MIA,DEN,20171103,James Capers,Kevin Scott,Jonathan Sterling,,94,95,L2M-MIA-DEN-11-03-2017.pdf,https://www.basketball-reference.com/boxscores/201711030DEN.html,DEN,MIA
Q4,01:36.0,96,Foul: Offensive,Dion Waiters,Wilson Chandler,CNC,Waiters (MIA) makes marginal contact with Chandler (DEN) that does not affect his ability to defend the play.,http://official.nba.com/last-two-minute-report/?gameNo=0021700127&eventNum=1022,20171103MIADEN,20171103MIADEN-5,MIA,DEN,20171103,James Capers,Kevin Scott,Jonathan Sterling,,94,95,L2M-MIA-DEN-11-03-2017.pdf,https://www.basketball-reference.com/boxscores/201711030DEN.html,DEN,MIA
Q4,01:35.0,95,Foul: Personal,Paul Millsap,Dion Waiters,CNC,Millsap (DEN) maintains legal guarding position and makes incidental contact with Waiters (MIA) that does not affect his ability to make the pass.,http://official.nba.com/last-two-minute-report/?gameNo=0021700127&eventNum=1023,20171103MIADEN,20171103MIADEN-6,MIA,DEN,20171103,James Capers,Kevin Scott,Jonathan Sterling,,94,95,L2M-MIA-DEN-11-03-2017.pdf,https://www.basketball-reference.com/boxscores/201711030DEN.html,MIA,DEN
Q4,01:31.0,91,Foul: Personal,Paul Millsap,Hassan Whiteside,CNC,Millsap (DEN) makes contact with the ball and the contact with Whiteside (MIA) is considered incidental. 01:26.1 01:26.1,http://official.nba.com/last-two-minute-report/?gameNo=0021700127&eventNum=1024,20171103MIADEN,20171103MIADEN-7,MIA,DEN,20171103,James Capers,Kevin Scott,Jonathan Sterling,,94,95,L2M-MIA-DEN-11-03-2017.pdf,https://www.basketball-reference.com/boxscores/201711030DEN.html,MIA,DEN
Q4,01:15.0,75,Foul: Personal,Josh Richardson,Will Barton,CNC,Richardson (MIA) makes marginal contact with Barton (DEN) that does not affect his SQBR.,http://official.nba.com/last-two-minute-report/?gameNo=0021700127&eventNum=1025,20171103MIADEN,20171103MIADEN-8,MIA,DEN,20171103,James Capers,Kevin Scott,Jonathan Sterling,,94,95,L2M-MIA-DEN-11-03-2017.pdf,https://www.basketball-reference.com/boxscores/201711030DEN.html,DEN,MIA
Q4,01:13.0,73,Foul: Shooting,Goran Dragic,Nikola Jokic,CNC,Dragic (MIA) makes marginal contact with Jokic (DEN) following the release of his jump shot attempt.,http://official.nba.com/last-two-minute-report/?gameNo=0021700127&eventNum=1026,20171103MIADEN,20171103MIADEN-9,MIA,DEN,20171103,James Capers,Kevin Scott,Jonathan Sterling,,94,95,L2M-MIA-DEN-11-03-2017.pdf,https://www.basketball-reference.com/boxscores/201711030DEN.html,DEN,MIA
Q4,00:59.2,59.2,Foul: Shooting,Hassan Whiteside,Will Barton,INC,Whiteside (MIA) makes contact to Barton's (DEN) head that affects his driving shot attempt.,http://official.nba.com/last-two-minute-report/?gameNo=0021700127&eventNum=1027,20171103MIADEN,20171103MIADEN-10,MIA,DEN,20171103,James Capers,Kevin Scott,Jonathan Sterling,,94,95,L2M-MIA-DEN-11-03-2017.pdf,https://www.basketball-reference.com/boxscores/201711030DEN.html,DEN,MIA
Q4,00:56.6,56.6,Violation: Kicked Ball,Hassan Whiteside,,CC,Whiteside (MIA) intentionally kicks the ball.,http://official.nba.com/last-two-minute-report/?gameNo=0021700127&eventNum=617,20171103MIADEN,20171103MIADEN-11,MIA,DEN,20171103,James Capers,Kevin Scott,Jonathan Sterling,,94,95,L2M-MIA-DEN-11-03-2017.pdf,https://www.basketball-reference.com/boxscores/201711030DEN.html,DEN,MIA
Q4,00:49.5,49.5,Foul: Shooting,Dion Waiters,Gary Harris,CNC,Waiters (MIA) maintains legal guarding position and makes incidental contact with Harris (DEN) that does not affect his drive to the basket and shot attempt. 00:47.4 00:47.4,http://official.nba.com/last-two-minute-report/?gameNo=0021700127&eventNum=1028,20171103MIADEN,20171103MIADEN-12,MIA,DEN,20171103,James Capers,Kevin Scott,Jonathan Sterling,,94,95,L2M-MIA-DEN-11-03-2017.pdf,https://www.basketball-reference.com/boxscores/201711030DEN.html,DEN,MIA
Q4,00:47.1,47.1,Turnover: Backcourt Turnover,Goran Dragic,,CNC,"Dragic's (MIA) momentum carries him into the backcourt, where he fully possesses the ball.",http://official.nba.com/last-two-minute-report/?gameNo=0021700127&eventNum=1029,20171103MIADEN,20171103MIADEN-13,MIA,DEN,20171103,James Capers,Kevin Scott,Jonathan Sterling,,94,95,L2M-MIA-DEN-11-03-2017.pdf,https://www.basketball-reference.com/boxscores/201711030DEN.html,DEN,MIA
Q4,00:32.5,32.5,Foul: Shooting,Will Barton,Dion Waiters,CNC,Barton (DEN) maintains legal guarding position and makes incidental contact with Waiters (MIA) that does not affect his drive to the basket and shot attempt. Period 00:31.0 00:31.0,http://official.nba.com/last-two-minute-report/?gameNo=0021700127&eventNum=1030,20171103MIADEN,20171103MIADEN-14,MIA,DEN,20171103,James Capers,Kevin Scott,Jonathan Sterling,,94,95,L2M-MIA-DEN-11-03-2017.pdf,https://www.basketball-reference.com/boxscores/201711030DEN.html,MIA,DEN
Q4,00:26.2,26.2,Foul: Shooting,Josh Richardson,Paul Millsap,CC,Richardson (MIA) makes contact to Millsap's (DEN) arm that affects his shot attempt.,http://official.nba.com/last-two-minute-report/?gameNo=0021700127&eventNum=628,20171103MIADEN,20171103MIADEN-15,MIA,DEN,20171103,James Capers,Kevin Scott,Jonathan Sterling,,94,95,L2M-MIA-DEN-11-03-2017.pdf,https://www.basketball-reference.com/boxscores/201711030DEN.html,DEN,MIA
Q4,00:24.6,24.6,Foul: Personal,Nikola Jokic,James Johnson,IC,Jokic (DEN) does not make contact with Johnson's (MIA) arm when he reaches in. 00:24.7 00:24.7,http://official.nba.com/last-two-minute-report/?gameNo=0021700127&eventNum=638,20171103MIADEN,20171103MIADEN-16,MIA,DEN,20171103,James Capers,Kevin Scott,Jonathan Sterling,,94,95,L2M-MIA-DEN-11-03-2017.pdf,https://www.basketball-reference.com/boxscores/201711030DEN.html,MIA,DEN
Q4,00:23.4,23.4,Foul: Personal,Wilson Chandler,Goran Dragic,CC,Chandler (DEN) commits a take foul on Dragic (MIA).,http://official.nba.com/last-two-minute-report/?gameNo=0021700127&eventNum=646,20171103MIADEN,20171103MIADEN-17,MIA,DEN,20171103,James Capers,Kevin Scott,Jonathan Sterling,,94,95,L2M-MIA-DEN-11-03-2017.pdf,https://www.basketball-reference.com/boxscores/201711030DEN.html,MIA,DEN
Q4,00:13.8,13.8,Foul: Offensive,Nikola Jokic,James Johnson,CNC,Jokic (DEN) makes marginal contact with Johnson (MIA) on the screen.,http://official.nba.com/last-two-minute-report/?gameNo=0021700127&eventNum=1031,20171103MIADEN,20171103MIADEN-18,MIA,DEN,20171103,James Capers,Kevin Scott,Jonathan Sterling,,94,95,L2M-MIA-DEN-11-03-2017.pdf,https://www.basketball-reference.com/boxscores/201711030DEN.html,MIA,DEN
Q4,00:11.8,11.8,Foul: Shooting,James Johnson,Paul Millsap,CC,Johnson (MIA) jumps from point A to point B into Millsap's (DEN) body and the contact affects his jump shot attempt. 00:11.9 00:11.9,http://official.nba.com/last-two-minute-report/?gameNo=0021700127&eventNum=650,20171103MIADEN,20171103MIADEN-19,MIA,DEN,20171103,James Capers,Kevin Scott,Jonathan Sterling,,94,95,L2M-MIA-DEN-11-03-2017.pdf,https://www.basketball-reference.com/boxscores/201711030DEN.html,DEN,MIA
Q4,00:03.3,3.3,Foul: Shooting,Will Barton,Dion Waiters,CNC,"Barton (DEN) legally contests Waiters' (MIA) jump shot attempt. Event Assessments: CC = Correct Call, IC = Incorrect Call, CNC = Correct Non-Call, INC = Incorrect Non-Call",http://official.nba.com/last-two-minute-report/?gameNo=0021700127&eventNum=1032,20171103MIADEN,20171103MIADEN-20,MIA,DEN,20171103,James Capers,Kevin Scott,Jonathan Sterling,,94,95,L2M-MIA-DEN-11-03-2017.pdf,https://www.basketball-reference.com/boxscores/201711030DEN.html,MIA,DEN