period,time,seconds_left,call_type,committing_player,disadvantaged_player,review_decision,comment,video,game_id,play_id,away,home,date,ref_1,ref_2,ref_3,ref_4,score_away,score_home,original_pdf,box_score_url,disadvantaged_team,committing_team
Q4,01:45.0,105,Foul: Personal,Lance Stephenson,Wilson Chandler,CNC,Stephenson (IND) makes marginal contact with Chandler (DEN) that does not affect his SQBR.,http://official.nba.com/last-two-minute-report/?gameNo=0021700387&eventNum=1084,20171210DENIND,20171210DENIND-0,DEN,IND,20171210,Brent Barnaky,Monty McCutchen,Dedric Taylor,,116,126,L2M-DEN-IND-12-10-2017.pdf,https://www.basketball-reference.com/boxscores/201712100IND.html,DEN,IND
Q4,01:44.0,104,Foul: Personal,Lance Stephenson,Wilson Chandler,CNC,Stephenson (IND) makes marginal contact with Chandler (DEN) that does not affect his ability to make the pass. 01:42.1 01:42.1,http://official.nba.com/last-two-minute-report/?gameNo=0021700387&eventNum=1085,20171210DENIND,20171210DENIND-1,DEN,IND,20171210,Brent Barnaky,Monty McCutchen,Dedric Taylor,,116,126,L2M-DEN-IND-12-10-2017.pdf,https://www.basketball-reference.com/boxscores/201712100IND.html,DEN,IND
Q4,01:36.0,96,Foul: Offensive,Thaddeus Young,Gary Harris,CNC,Young (IND) sets the screen on Harris (DEN) and gives him room to avoid the contact.,http://official.nba.com/last-two-minute-report/?gameNo=0021700387&eventNum=1086,20171210DENIND,20171210DENIND-2,DEN,IND,20171210,Brent Barnaky,Monty McCutchen,Dedric Taylor,,116,126,L2M-DEN-IND-12-10-2017.pdf,https://www.basketball-reference.com/boxscores/201712100IND.html,DEN,IND
Q4,01:34.0,94,Foul: Shooting,Gary Harris,Victor Oladipo,CNC,Harris (DEN) makes incidental contact with Oladipo (IND) that does not affect his drive to the basket and shot attempt. 01:32.1 01:32.1,http://official.nba.com/last-two-minute-report/?gameNo=0021700387&eventNum=1087,20171210DENIND,20171210DENIND-3,DEN,IND,20171210,Brent Barnaky,Monty McCutchen,Dedric Taylor,,116,126,L2M-DEN-IND-12-10-2017.pdf,https://www.basketball-reference.com/boxscores/201712100IND.html,IND,DEN
Q4,01:16.0,76,Foul: Offensive,Kenneth Faried,Bojan Bogdanovic,CNC,Faried (DEN) sets the screen on Bogdanovic (IND) and gives him room to avoid the contact.,http://official.nba.com/last-two-minute-report/?gameNo=0021700387&eventNum=1088,20171210DENIND,20171210DENIND-4,DEN,IND,20171210,Brent Barnaky,Monty McCutchen,Dedric Taylor,,116,126,L2M-DEN-IND-12-10-2017.pdf,https://www.basketball-reference.com/boxscores/201712100IND.html,IND,DEN
Q4,01:09.0,69,Foul: Personal,Bojan Bogdanovic,Wilson Chandler,CNC,Bogdanovic (IND) makes incidental contact with Chandler (DEN) that does not affect his SQBR.,http://official.nba.com/last-two-minute-report/?gameNo=0021700387&eventNum=1090,20171210DENIND,20171210DENIND-5,DEN,IND,20171210,Brent Barnaky,Monty McCutchen,Dedric Taylor,,116,126,L2M-DEN-IND-12-10-2017.pdf,https://www.basketball-reference.com/boxscores/201712100IND.html,DEN,IND
Q4,01:08.0,68,Turnover: 24 Second Violation,,,CC,Correctly called 24 second violation.,http://official.nba.com/last-two-minute-report/?gameNo=0021700387&eventNum=574,20171210DENIND,20171210DENIND-6,DEN,IND,20171210,Brent Barnaky,Monty McCutchen,Dedric Taylor,,116,126,L2M-DEN-IND-12-10-2017.pdf,https://www.basketball-reference.com/boxscores/201712100IND.html,,
Q4,01:08.0,68,Instant Replay: Support Ruling,,,CC,"After communicating with the Replay Center, the ruling on the floor of a 24 second violation is confirmed. 01:08.1 01:08.1",http://official.nba.com/last-two-minute-report/?gameNo=0021700387&eventNum=575,20171210DENIND,20171210DENIND-7,DEN,IND,20171210,Brent Barnaky,Monty McCutchen,Dedric Taylor,,116,126,L2M-DEN-IND-12-10-2017.pdf,https://www.basketball-reference.com/boxscores/201712100IND.html,,
Q4,00:56.3,56.3,Foul: Shooting,Wilson Chandler,Victor Oladipo,CNC,Chandler (DEN) makes marginal contact with Oladipo (IND) that does not affect his drive to the basket and shot attempt. 00:55.2 00:55.2,http://official.nba.com/last-two-minute-report/?gameNo=0021700387&eventNum=1092,20171210DENIND,20171210DENIND-8,DEN,IND,20171210,Brent Barnaky,Monty McCutchen,Dedric Taylor,,116,126,L2M-DEN-IND-12-10-2017.pdf,https://www.basketball-reference.com/boxscores/201712100IND.html,IND,DEN
Q4,00:38.6,38.6,Foul: Offensive,Kenneth Faried,Bojan Bogdanovic,CNC,Faried (DEN) sets the screen on Bogdanovic (IND) and gives him room to avoid the contact.,http://official.nba.com/last-two-minute-report/?gameNo=0021700387&eventNum=1093,20171210DENIND,20171210DENIND-9,DEN,IND,20171210,Brent Barnaky,Monty McCutchen,Dedric Taylor,,116,126,L2M-DEN-IND-12-10-2017.pdf,https://www.basketball-reference.com/boxscores/201712100IND.html,IND,DEN
Q4,00:36.6,36.6,Foul: Shooting,Thaddeus Young,Will Barton,CNC,"Young (IND) legally contests Barton's (DEN) jump shot attempt. Any ""high-five"" contact after the release is considered incidental.",http://official.nba.com/last-two-minute-report/?gameNo=0021700387&eventNum=1094,20171210DENIND,20171210DENIND-10,DEN,IND,20171210,Brent Barnaky,Monty McCutchen,Dedric Taylor,,116,126,L2M-DEN-IND-12-10-2017.pdf,https://www.basketball-reference.com/boxscores/201712100IND.html,DEN,IND
Q4,00:35.1,35.1,Foul: Loose Ball,Kenneth Faried,Myles Turner,CNC,Faried (DEN) makes marginal contact with Turner (IND) that does not affect his ability to retrieve the rebound. Period 00:31.0 00:31.0,http://official.nba.com/last-two-minute-report/?gameNo=0021700387&eventNum=1095,20171210DENIND,20171210DENIND-11,DEN,IND,20171210,Brent Barnaky,Monty McCutchen,Dedric Taylor,,116,126,L2M-DEN-IND-12-10-2017.pdf,https://www.basketball-reference.com/boxscores/201712100IND.html,IND,DEN
Q4,00:27.4,27.4,Foul: Shooting,Kenneth Faried,Victor Oladipo,CNC,"Faried (DEN) legally contests Oladipo's (IND) jump shot attempt. Any ""high-five"" contact after the release is considered incidental.",http://official.nba.com/last-two-minute-report/?gameNo=0021700387&eventNum=1096,20171210DENIND,20171210DENIND-12,DEN,IND,20171210,Brent Barnaky,Monty McCutchen,Dedric Taylor,,116,126,L2M-DEN-IND-12-10-2017.pdf,https://www.basketball-reference.com/boxscores/201712100IND.html,IND,DEN
Q4,00:26.0,26,Foul: Loose Ball,Gary Harris,Thaddeus Young,CNC,Harris (DEN) and Young (IND) make incidental contact with one another during rebounding.,http://official.nba.com/last-two-minute-report/?gameNo=0021700387&eventNum=1097,20171210DENIND,20171210DENIND-13,DEN,IND,20171210,Brent Barnaky,Monty McCutchen,Dedric Taylor,,116,126,L2M-DEN-IND-12-10-2017.pdf,https://www.basketball-reference.com/boxscores/201712100IND.html,IND,DEN
Q4,00:15.5,15.5,Foul: Personal,Gary Harris,Thaddeus Young,CNC,Harris (DEN) and Young (IND) briefly engage and separate off ball.,http://official.nba.com/last-two-minute-report/?gameNo=0021700387&eventNum=1098,20171210DENIND,20171210DENIND-14,DEN,IND,20171210,Brent Barnaky,Monty McCutchen,Dedric Taylor,,116,126,L2M-DEN-IND-12-10-2017.pdf,https://www.basketball-reference.com/boxscores/201712100IND.html,IND,DEN
Q4,00:06.6,6.6,Foul: Shooting,Kenneth Faried,Victor Oladipo,CNC,Faried (DEN) makes incidental contact with Oladipo (IND) after the release of his driving shot attempt. 00:05.6 00:05.6,http://official.nba.com/last-two-minute-report/?gameNo=0021700387&eventNum=1099,20171210DENIND,20171210DENIND-15,DEN,IND,20171210,Brent Barnaky,Monty McCutchen,Dedric Taylor,,116,126,L2M-DEN-IND-12-10-2017.pdf,https://www.basketball-reference.com/boxscores/201712100IND.html,IND,DEN
Q4,00:04.8,4.8,Turnover: Traveling,Will Barton,,,[Observable in enhanced video] Barton (DEN) moves his pivot foot.,http://official.nba.com/last-two-minute-report/?gameNo=0021700387&eventNum=1100,20171210DENIND,20171210DENIND-16,DEN,IND,20171210,Brent Barnaky,Monty McCutchen,Dedric Taylor,,116,126,L2M-DEN-IND-12-10-2017.pdf,https://www.basketball-reference.com/boxscores/201712100IND.html,IND,DEN
Q4,00:01.9,1.9,Foul: Shooting,Bojan Bogdanovic,Will Barton,CNC,"Bogdanovic (IND) legally contests Barton's (DEN) jump shot attempt. Any ""high-five"" contact after the release is considered incidental. Event Assessments: CC = Correct Call, IC = Incorrect Call, CNC = Correct Non-Call, INC = Incorrect Non-Call",http://official.nba.com/last-two-minute-report/?gameNo=0021700387&eventNum=1100,20171210DENIND,20171210DENIND-17,DEN,IND,20171210,Brent Barnaky,Monty McCutchen,Dedric Taylor,,116,126,L2M-DEN-IND-12-10-2017.pdf,https://www.basketball-reference.com/boxscores/201712100IND.html,DEN,IND