period,time,seconds_left,call_type,committing_player,disadvantaged_player,review_decision,comment,video,game_id,play_id,away,home,date,ref_1,ref_2,ref_3,score_away,score_home,original_pdf,box_score_url,disadvantaged_team,committing_team
Q4,01:46.0,106,Foul: Shooting,Robin Lopez,Courtney Lee,CNC,Lopez (CHI) makes incidental contact to Lee's (NYK) body after his release. 01:46.1 01:46.1,http://official.nba.com/last-two-minute-report/?gameNo=0021700380&eventNum=1017,20171209NYKCHI,20171209NYKCHI-0,NYK,CHI,20171209,Leroy Richardson,Ben Taylor,Tom Washington,102,104,L2M-NYK-CHI-12-09-2017.pdf,https://www.basketball-reference.com/boxscores/201712090CHI.html,NYK,CHI
Q4,01:33.0,93,Foul: Offensive,Robin Lopez,Lance Thomas,CC,Lopez (CHI) sets the screen on Thomas (NYK) without giving him room to avoid the contact and he delivers the contact. 01:33.1 01:33.1,http://official.nba.com/last-two-minute-report/?gameNo=0021700380&eventNum=583,20171209NYKCHI,20171209NYKCHI-1,NYK,CHI,20171209,Leroy Richardson,Ben Taylor,Tom Washington,102,104,L2M-NYK-CHI-12-09-2017.pdf,https://www.basketball-reference.com/boxscores/201712090CHI.html,NYK,CHI
Q4,01:27.0,87,Turnover: Traveling,Courtney Lee,Justin Holiday,,[Observable in enhanced video] Lee (NYK) splits his feet on the perimeter.,http://official.nba.com/last-two-minute-report/?gameNo=0021700380&eventNum=1018,20171209NYKCHI,20171209NYKCHI-2,NYK,CHI,20171209,Leroy Richardson,Ben Taylor,Tom Washington,102,104,L2M-NYK-CHI-12-09-2017.pdf,https://www.basketball-reference.com/boxscores/201712090CHI.html,CHI,NYK
Q4,01:26.0,86,Foul: Shooting,Justin Holiday,Courtney Lee,CNC,Holiday (CHI) makes incidental contact with Lee (NYK) after his release that does not affect his jump shot attempt. 01:25.1 01:25.1,http://official.nba.com/last-two-minute-report/?gameNo=0021700380&eventNum=1019,20171209NYKCHI,20171209NYKCHI-3,NYK,CHI,20171209,Leroy Richardson,Ben Taylor,Tom Washington,102,104,L2M-NYK-CHI-12-09-2017.pdf,https://www.basketball-reference.com/boxscores/201712090CHI.html,NYK,CHI
Q4,01:11.0,71,Foul: Offensive,Robin Lopez,Jarrett Jack,CNC,Lopez (CHI) sets the screen on Jack (NYK) and gives him room to avoid the contact.,http://official.nba.com/last-two-minute-report/?gameNo=0021700380&eventNum=1020,20171209NYKCHI,20171209NYKCHI-4,NYK,CHI,20171209,Leroy Richardson,Ben Taylor,Tom Washington,102,104,L2M-NYK-CHI-12-09-2017.pdf,https://www.basketball-reference.com/boxscores/201712090CHI.html,NYK,CHI
Q4,01:07.0,67,Foul: Loose Ball,Robin Lopez,Kristaps Porzingis,CNC,Lopez (CHI) and Porzingis (NYK) engage and separate without affecting each other's ability to retrieve the rebound. 01:02.1 01:02.1,http://official.nba.com/last-two-minute-report/?gameNo=0021700380&eventNum=1021,20171209NYKCHI,20171209NYKCHI-5,NYK,CHI,20171209,Leroy Richardson,Ben Taylor,Tom Washington,102,104,L2M-NYK-CHI-12-09-2017.pdf,https://www.basketball-reference.com/boxscores/201712090CHI.html,NYK,CHI
Q4,01:00.0,60,Foul: Personal,David Nwaba,Kristaps Porzingis,CC,Nwaba (CHI) makes contact with Porzingis (NYK) that affects his FOM. 01:00.1 01:00.1,http://official.nba.com/last-two-minute-report/?gameNo=0021700380&eventNum=590,20171209NYKCHI,20171209NYKCHI-6,NYK,CHI,20171209,Leroy Richardson,Ben Taylor,Tom Washington,102,104,L2M-NYK-CHI-12-09-2017.pdf,https://www.basketball-reference.com/boxscores/201712090CHI.html,NYK,CHI
Q4,00:47.1,47.1,Foul: Personal,Lance Thomas,Lauri Markkanen,CNC,Thomas (NYK) makes incidental contact with Markkanen (CHI) that does not affect his FOM.,http://official.nba.com/last-two-minute-report/?gameNo=0021700380&eventNum=1022,20171209NYKCHI,20171209NYKCHI-7,NYK,CHI,20171209,Leroy Richardson,Ben Taylor,Tom Washington,102,104,L2M-NYK-CHI-12-09-2017.pdf,https://www.basketball-reference.com/boxscores/201712090CHI.html,CHI,NYK
Q4,00:39.0,39,Turnover: 3 Second Violation,Doug McDermott,,CNC,McDermott (NYK) is in the paint for less than three seconds.,http://official.nba.com/last-two-minute-report/?gameNo=0021700380&eventNum=1023,20171209NYKCHI,20171209NYKCHI-8,NYK,CHI,20171209,Leroy Richardson,Ben Taylor,Tom Washington,102,104,L2M-NYK-CHI-12-09-2017.pdf,https://www.basketball-reference.com/boxscores/201712090CHI.html,CHI,NYK
Q4,00:38.5,38.5,Turnover: Traveling,Lauri Markkanen,,,[Observable in enhanced video] Markkanen (CHI) moves his pivot foot.,http://official.nba.com/last-two-minute-report/?gameNo=0021700380&eventNum=1023,20171209NYKCHI,20171209NYKCHI-9,NYK,CHI,20171209,Leroy Richardson,Ben Taylor,Tom Washington,102,104,L2M-NYK-CHI-12-09-2017.pdf,https://www.basketball-reference.com/boxscores/201712090CHI.html,NYK,CHI
Q4,00:36.9,36.9,Foul: Shooting,Doug McDermott,Lauri Markkanen,INC,McDermott (NYK) makes contact to Markkanen's (CHI) arm and affects his driving shot attempt.,http://official.nba.com/last-two-minute-report/?gameNo=0021700380&eventNum=1024,20171209NYKCHI,20171209NYKCHI-10,NYK,CHI,20171209,Leroy Richardson,Ben Taylor,Tom Washington,102,104,L2M-NYK-CHI-12-09-2017.pdf,https://www.basketball-reference.com/boxscores/201712090CHI.html,CHI,NYK
Q4,00:36.8,36.8,Turnover: 24 Second Violation,,,CC,Correctly called 24 second violation. Period 00:36.9 00:36.9,http://official.nba.com/last-two-minute-report/?gameNo=0021700380&eventNum=598,20171209NYKCHI,20171209NYKCHI-11,NYK,CHI,20171209,Leroy Richardson,Ben Taylor,Tom Washington,102,104,L2M-NYK-CHI-12-09-2017.pdf,https://www.basketball-reference.com/boxscores/201712090CHI.html,,
Q4,00:32.7,32.7,Turnover: Traveling,Courtney Lee,,CNC,Lee (NYK) gathers the ball and legally takes two steps.,http://official.nba.com/last-two-minute-report/?gameNo=0021700380&eventNum=1025,20171209NYKCHI,20171209NYKCHI-12,NYK,CHI,20171209,Leroy Richardson,Ben Taylor,Tom Washington,102,104,L2M-NYK-CHI-12-09-2017.pdf,https://www.basketball-reference.com/boxscores/201712090CHI.html,CHI,NYK
Q4,00:31.9,31.9,Foul: Shooting,Nikola Mirotic,Courtney Lee,CNC,Mirotic (CHI) makes incidental body contact with Lee (NYK) that does not affect his driving shot attempt. 00:30.8 00:30.8,http://official.nba.com/last-two-minute-report/?gameNo=0021700380&eventNum=1026,20171209NYKCHI,20171209NYKCHI-13,NYK,CHI,20171209,Leroy Richardson,Ben Taylor,Tom Washington,102,104,L2M-NYK-CHI-12-09-2017.pdf,https://www.basketball-reference.com/boxscores/201712090CHI.html,NYK,CHI
Q4,00:21.8,21.8,Foul: Personal,Kristaps Porzingis,Nikola Mirotic,INC,Porzingis (NYK) makes contact to Mirotic's (CHI) arm and affects his ability to receive the pass. Referees cannot assess a foul during a replay review for an out of bounds call.,http://official.nba.com/last-two-minute-report/?gameNo=0021700380&eventNum=1027,20171209NYKCHI,20171209NYKCHI-14,NYK,CHI,20171209,Leroy Richardson,Ben Taylor,Tom Washington,102,104,L2M-NYK-CHI-12-09-2017.pdf,https://www.basketball-reference.com/boxscores/201712090CHI.html,CHI,NYK
Q4,00:20.5,20.5,Instant Replay: Support Ruling,,,CC,"After communicating with the Replay Center, the ruling on the floor of Knicks possession is confirmed. 00:08.1 00:08.1",http://official.nba.com/last-two-minute-report/?gameNo=0021700380&eventNum=603,20171209NYKCHI,20171209NYKCHI-15,NYK,CHI,20171209,Leroy Richardson,Ben Taylor,Tom Washington,102,104,L2M-NYK-CHI-12-09-2017.pdf,https://www.basketball-reference.com/boxscores/201712090CHI.html,,
Q4,00:05.1,5.1,Foul: Offensive,Robin Lopez,Jarrett Jack,CNC,Lopez (CHI) sets the screen on Jack (NYK) and gives him room to avoid the contact.,http://official.nba.com/last-two-minute-report/?gameNo=0021700380&eventNum=1028,20171209NYKCHI,20171209NYKCHI-16,NYK,CHI,20171209,Leroy Richardson,Ben Taylor,Tom Washington,102,104,L2M-NYK-CHI-12-09-2017.pdf,https://www.basketball-reference.com/boxscores/201712090CHI.html,NYK,CHI
Q4,00:02.9,2.9,Foul: Shooting,Courtney Lee,Kris Dunn,IC,Lee (NYK) makes forearm contact to Dunn's (CHI) body that affects his SQBR prior to the shot attempt and a personal foul should be called. There is no illegal contact on the shot attempt.,http://official.nba.com/last-two-minute-report/?gameNo=0021700380&eventNum=609,20171209NYKCHI,20171209NYKCHI-17,NYK,CHI,20171209,Leroy Richardson,Ben Taylor,Tom Washington,102,104,L2M-NYK-CHI-12-09-2017.pdf,https://www.basketball-reference.com/boxscores/201712090CHI.html,CHI,NYK
Q4,00:02.9,2.9,Foul: Offensive,Enes Kanter,Lauri Markkanen,CNC,Kanter (NYK) sets the screen on Markkanen (CHI) and gives him room to avoid the contact. 00:03.0 00:03.0,http://official.nba.com/last-two-minute-report/?gameNo=0021700380&eventNum=1029,20171209NYKCHI,20171209NYKCHI-18,NYK,CHI,20171209,Leroy Richardson,Ben Taylor,Tom Washington,102,104,L2M-NYK-CHI-12-09-2017.pdf,https://www.basketball-reference.com/boxscores/201712090CHI.html,CHI,NYK
Q4,00:00.4,0.4,Foul: Shooting,David Nwaba,Courtney Lee,CNC,"Nwaba (CHI) makes incidental contact with Lee (NYK) that does not affect his putback shot attempt. Event Assessments: CC = Correct Call, IC = Incorrect Call, CNC = Correct Non-Call, INC = Incorrect Non-Call",http://official.nba.com/last-two-minute-report/?gameNo=0021700380&eventNum=1030,20171209NYKCHI,20171209NYKCHI-19,NYK,CHI,20171209,Leroy Richardson,Ben Taylor,Tom Washington,102,104,L2M-NYK-CHI-12-09-2017.pdf,https://www.basketball-reference.com/boxscores/201712090CHI.html,NYK,CHI