period,time,seconds_left,call_type,committing_player,disadvantaged_player,review_decision,comment,video,game_id,play_id,away,home,date,ref_1,ref_2,ref_3,ref_4,score_away,score_home,original_pdf,box_score_url,disadvantaged_team,committing_team
Q4,01:48.0,108,Foul: Loose Ball,Tyreke Evans,Ed Davis,CNC,Evans (MEM) and Davis (POR) briefly engage and separate during rebounding. 01:46.1 01:46.1,http://official.nba.com/last-two-minute-report/?gameNo=0021700157&eventNum=1055,20171107MEMPOR,20171107MEMPOR-0,MEM,POR,20171107,Nick Buchert,Pat Fraher,Justin Van Duyne,,98,97,L2M-MEM-POR-11-07-2017.pdf,https://www.basketball-reference.com/boxscores/201711070POR.html,POR,MEM
Q4,01:30.0,90,Foul: Personal,Marc Gasol,Ed Davis,INC,"LHH shows Davis (POR) reaches in and Gasol (MEM) clamps his arm, affecting his ability to defend the play. 01:25.1 01:25.1",http://official.nba.com/last-two-minute-report/?gameNo=0021700157&eventNum=1056,20171107MEMPOR,20171107MEMPOR-1,MEM,POR,20171107,Nick Buchert,Pat Fraher,Justin Van Duyne,,98,97,L2M-MEM-POR-11-07-2017.pdf,https://www.basketball-reference.com/boxscores/201711070POR.html,POR,MEM
Q4,01:21.0,81,Foul: Shooting,Mike Conley,Evan Turner,CNC,Conley (MEM) maintains legal guarding position and makes incidental contact with Turner (POR) that does not affect his drive to the basket and shot attempt.,http://official.nba.com/last-two-minute-report/?gameNo=0021700157&eventNum=1057,20171107MEMPOR,20171107MEMPOR-2,MEM,POR,20171107,Nick Buchert,Pat Fraher,Justin Van Duyne,,98,97,L2M-MEM-POR-11-07-2017.pdf,https://www.basketball-reference.com/boxscores/201711070POR.html,POR,MEM
Q4,01:20.0,80,Foul: Loose Ball,Marc Gasol,Ed Davis,CNC,Gasol (MEM) and Davis (POR) make incidental contact with one another during rebounding. 00:52.1 00:52.1,http://official.nba.com/last-two-minute-report/?gameNo=0021700157&eventNum=1058,20171107MEMPOR,20171107MEMPOR-3,MEM,POR,20171107,Nick Buchert,Pat Fraher,Justin Van Duyne,,98,97,L2M-MEM-POR-11-07-2017.pdf,https://www.basketball-reference.com/boxscores/201711070POR.html,POR,MEM
Q4,00:44.4,44.4,Foul: Shooting,Dillon Brooks,Ed Davis,CNC,Brooks (MEM) deflects the ball away from Davis (POR). 00:41.4 00:41.4,http://official.nba.com/last-two-minute-report/?gameNo=0021700157&eventNum=1059,20171107MEMPOR,20171107MEMPOR-4,MEM,POR,20171107,Nick Buchert,Pat Fraher,Justin Van Duyne,,98,97,L2M-MEM-POR-11-07-2017.pdf,https://www.basketball-reference.com/boxscores/201711070POR.html,POR,MEM
Q4,00:39.4,39.4,Foul: Shooting,CJ McCollum,Dillon Brooks,CC,McCollum (POR) jumps from point A to point B and makes contact with Brooks (MEM) that affects his driving shot attempt. 00:39.5 00:39.5,http://official.nba.com/last-two-minute-report/?gameNo=0021700157&eventNum=572,20171107MEMPOR,20171107MEMPOR-5,MEM,POR,20171107,Nick Buchert,Pat Fraher,Justin Van Duyne,,98,97,L2M-MEM-POR-11-07-2017.pdf,https://www.basketball-reference.com/boxscores/201711070POR.html,MEM,POR
Q4,00:31.9,31.9,Turnover: 3 Second Violation,Maurice Harkless,,CNC,Harkless (POR) is in the paint for less than three seconds.,http://official.nba.com/last-two-minute-report/?gameNo=0021700157&eventNum=1060,20171107MEMPOR,20171107MEMPOR-6,MEM,POR,20171107,Nick Buchert,Pat Fraher,Justin Van Duyne,,98,97,L2M-MEM-POR-11-07-2017.pdf,https://www.basketball-reference.com/boxscores/201711070POR.html,MEM,POR
Q4,00:31.0,31,Foul: Personal,Mike Conley,Evan Turner,CNC,Conley (MEM) makes incidental contact with Turner (POR) that does not affect his SQBR.,http://official.nba.com/last-two-minute-report/?gameNo=0021700157&eventNum=1061,20171107MEMPOR,20171107MEMPOR-7,MEM,POR,20171107,Nick Buchert,Pat Fraher,Justin Van Duyne,,98,97,L2M-MEM-POR-11-07-2017.pdf,https://www.basketball-reference.com/boxscores/201711070POR.html,POR,MEM
Q4,00:30.9,30.9,Turnover: 3 Second Violation,Ed Davis,,,[Observable in enhanced video] Davis (POR) is in the paint for longer than three seconds.,http://official.nba.com/last-two-minute-report/?gameNo=0021700157&eventNum=1061,20171107MEMPOR,20171107MEMPOR-8,MEM,POR,20171107,Nick Buchert,Pat Fraher,Justin Van Duyne,,98,97,L2M-MEM-POR-11-07-2017.pdf,https://www.basketball-reference.com/boxscores/201711070POR.html,MEM,POR
Q4,00:28.1,28.1,Foul: Shooting,Mike Conley,Evan Turner,CC,Conley (MEM) makes contact to Turner's (POR) arm that affects his jump shot attempt.,http://official.nba.com/last-two-minute-report/?gameNo=0021700157&eventNum=576,20171107MEMPOR,20171107MEMPOR-9,MEM,POR,20171107,Nick Buchert,Pat Fraher,Justin Van Duyne,,98,97,L2M-MEM-POR-11-07-2017.pdf,https://www.basketball-reference.com/boxscores/201711070POR.html,POR,MEM
Q4,00:28.1,28.1,Foul: Personal,Maurice Harkless,Marc Gasol,CNC,Harkless (POR) makes marginal contact with Gasol (MEM) that does not affect his FOM. Period 00:28.2 00:28.2,http://official.nba.com/last-two-minute-report/?gameNo=0021700157&eventNum=1062,20171107MEMPOR,20171107MEMPOR-10,MEM,POR,20171107,Nick Buchert,Pat Fraher,Justin Van Duyne,,98,97,L2M-MEM-POR-11-07-2017.pdf,https://www.basketball-reference.com/boxscores/201711070POR.html,MEM,POR
Q4,00:23.1,23.1,Foul: Personal Take,Maurice Harkless,Mike Conley,CC,Harkless (POR) commits a take foul on Conley (MEM).,http://official.nba.com/last-two-minute-report/?gameNo=0021700157&eventNum=584,20171107MEMPOR,20171107MEMPOR-11,MEM,POR,20171107,Nick Buchert,Pat Fraher,Justin Van Duyne,,98,97,L2M-MEM-POR-11-07-2017.pdf,https://www.basketball-reference.com/boxscores/201711070POR.html,MEM,POR
Q4,00:23.1,23.1,Foul: Personal,Mike Conley,Damian Lillard,CC,Conley (MEM) makes contact with Lillard (POR) that affects his FOM. 00:23.2 00:23.2,http://official.nba.com/last-two-minute-report/?gameNo=0021700157&eventNum=597,20171107MEMPOR,20171107MEMPOR-12,MEM,POR,20171107,Nick Buchert,Pat Fraher,Justin Van Duyne,,98,97,L2M-MEM-POR-11-07-2017.pdf,https://www.basketball-reference.com/boxscores/201711070POR.html,POR,MEM
Q4,00:18.6,18.6,Foul: Offensive,Ed Davis,Marc Gasol,CNC,Davis (POR) makes marginal contact with Gasol (MEM) and does not affect his ability to defend the play.,http://official.nba.com/last-two-minute-report/?gameNo=0021700157&eventNum=1063,20171107MEMPOR,20171107MEMPOR-13,MEM,POR,20171107,Nick Buchert,Pat Fraher,Justin Van Duyne,,98,97,L2M-MEM-POR-11-07-2017.pdf,https://www.basketball-reference.com/boxscores/201711070POR.html,MEM,POR
Q4,00:18.3,18.3,Turnover: Traveling,Damian Lillard,,INC,"After losing control of the ball, Lillard (POR) regains possession, takes two steps, and then takes an additional step. 00:13.5 00:13.5",http://official.nba.com/last-two-minute-report/?gameNo=0021700157&eventNum=1064,20171107MEMPOR,20171107MEMPOR-14,MEM,POR,20171107,Nick Buchert,Pat Fraher,Justin Van Duyne,,98,97,L2M-MEM-POR-11-07-2017.pdf,https://www.basketball-reference.com/boxscores/201711070POR.html,MEM,POR
Q4,00:12.9,12.9,Foul: Personal,Shabazz Napier,Mike Conley,CNC,Napier (POR) makes incidental contact with Conley (MEM) that does not affect his FOM. 00:13.0 00:13.0,http://official.nba.com/last-two-minute-report/?gameNo=0021700157&eventNum=1065,20171107MEMPOR,20171107MEMPOR-15,MEM,POR,20171107,Nick Buchert,Pat Fraher,Justin Van Duyne,,98,97,L2M-MEM-POR-11-07-2017.pdf,https://www.basketball-reference.com/boxscores/201711070POR.html,MEM,POR
Q4,00:12.1,12.1,Instant Replay: Overturn Ruling,,,CC,"After communicating with the Replay Center, the ruling on the floor of Grizzlies possession is overturned and the Trail Blazers are awarded possession. 00:12.2 00:12.2",http://official.nba.com/last-two-minute-report/?gameNo=0021700157&eventNum=608,20171107MEMPOR,20171107MEMPOR-16,MEM,POR,20171107,Nick Buchert,Pat Fraher,Justin Van Duyne,,98,97,L2M-MEM-POR-11-07-2017.pdf,https://www.basketball-reference.com/boxscores/201711070POR.html,,
Q4,00:04.6,4.6,Foul: Shooting,Dillon Brooks,CJ McCollum,CNC,Brooks (MEM) legally contests McCollum's (POR) jump shot attempt.,http://official.nba.com/last-two-minute-report/?gameNo=0021700157&eventNum=1066,20171107MEMPOR,20171107MEMPOR-17,MEM,POR,20171107,Nick Buchert,Pat Fraher,Justin Van Duyne,,98,97,L2M-MEM-POR-11-07-2017.pdf,https://www.basketball-reference.com/boxscores/201711070POR.html,POR,MEM
Q4,00:04.0,4,Foul: Loose Ball,Marc Gasol,Ed Davis,CNC,"Gasol (MEM) and Davis (POR) briefly engage and separate during rebounding. Event Assessments: CC = Correct Call, IC = Incorrect Call, CNC = Correct Non-Call, INC = Incorrect Non-Call",http://official.nba.com/last-two-minute-report/?gameNo=0021700157&eventNum=1067,20171107MEMPOR,20171107MEMPOR-18,MEM,POR,20171107,Nick Buchert,Pat Fraher,Justin Van Duyne,,98,97,L2M-MEM-POR-11-07-2017.pdf,https://www.basketball-reference.com/boxscores/201711070POR.html,POR,MEM