period,time,seconds_left,call_type,committing_player,disadvantaged_player,review_decision,comment,video,game_id,play_id,away,home,date,ref_1,ref_2,ref_3,ref_4,score_away,score_home,original_pdf,box_score_url,disadvantaged_team,committing_team
Q4,01:56.0,116,Foul: Offensive,Mike Muscala,Jerian Grant,CNC,Muscala (ATL) sets the screen on Grant (CHI) and gives him room to avoid the contact. 01:52.1 01:52.1,http://official.nba.com/last-two-minute-report/?gameNo=0021700065&eventNum=1037,20171026ATLCHI,20171026ATLCHI-0,ATL,CHI,20171026,James Capers,Karl Lane,J.T. Orr,,86,91,L2M-ATL-CHI-10-26-2017.pdf,https://www.basketball-reference.com/boxscores/201710260CHI.html,CHI,ATL
Q4,01:48.0,108,Foul: Personal,John Collins,Robin Lopez,CNC,Collins (ATL) and Lopez (CHI) briefly engage and separate off ball. 01:48.1 01:48.1,http://official.nba.com/last-two-minute-report/?gameNo=0021700065&eventNum=1038,20171026ATLCHI,20171026ATLCHI-1,ATL,CHI,20171026,James Capers,Karl Lane,J.T. Orr,,86,91,L2M-ATL-CHI-10-26-2017.pdf,https://www.basketball-reference.com/boxscores/201710260CHI.html,CHI,ATL
Q4,01:36.0,96,Foul: Shooting,Kent Bazemore,Justin Holiday,CNC,Bazemore (ATL) makes incidental contact with Holiday (CHI) that does not affect his shot attempt. 01:35.1 01:35.1,http://official.nba.com/last-two-minute-report/?gameNo=0021700065&eventNum=1039,20171026ATLCHI,20171026ATLCHI-2,ATL,CHI,20171026,James Capers,Karl Lane,J.T. Orr,,86,91,L2M-ATL-CHI-10-26-2017.pdf,https://www.basketball-reference.com/boxscores/201710260CHI.html,CHI,ATL
Q4,01:21.0,81,Foul: Shooting,Jerian Grant,Mike Muscala,CNC,Grant (CHI) allows Muscala (ATL) to land following his jump shot attempt. 01:10.1 01:10.1,http://official.nba.com/last-two-minute-report/?gameNo=0021700065&eventNum=1040,20171026ATLCHI,20171026ATLCHI-3,ATL,CHI,20171026,James Capers,Karl Lane,J.T. Orr,,86,91,L2M-ATL-CHI-10-26-2017.pdf,https://www.basketball-reference.com/boxscores/201710260CHI.html,ATL,CHI
Q4,01:07.0,67,Turnover: 3 Second Violation,Robin Lopez,,INC,Lopez (CHI) never fully clears and is in the paint for longer than three seconds.,http://official.nba.com/last-two-minute-report/?gameNo=0021700065&eventNum=1041,20171026ATLCHI,20171026ATLCHI-4,ATL,CHI,20171026,James Capers,Karl Lane,J.T. Orr,,86,91,L2M-ATL-CHI-10-26-2017.pdf,https://www.basketball-reference.com/boxscores/201710260CHI.html,ATL,CHI
Q4,01:00.0,60,Foul: Loose Ball,Robin Lopez,John Collins,INC,Lopez (CHI) clamps Collins' (ATL) arm and affects his ability to retrieve the rebound.,http://official.nba.com/last-two-minute-report/?gameNo=0021700065&eventNum=1043,20171026ATLCHI,20171026ATLCHI-5,ATL,CHI,20171026,James Capers,Karl Lane,J.T. Orr,,86,91,L2M-ATL-CHI-10-26-2017.pdf,https://www.basketball-reference.com/boxscores/201710260CHI.html,ATL,CHI
Q4,00:59.0,59,Instant Replay: Support Ruling,,,CC,"After communicating with the Replay Center, the ruling on the floor of Bulls possession is confirmed.",http://official.nba.com/last-two-minute-report/?gameNo=0021700065&eventNum=608,20171026ATLCHI,20171026ATLCHI-6,ATL,CHI,20171026,James Capers,Karl Lane,J.T. Orr,,86,91,L2M-ATL-CHI-10-26-2017.pdf,https://www.basketball-reference.com/boxscores/201710260CHI.html,,
Q4,00:56.9,56.9,Foul: Offensive,Jerian Grant,Malcolm Delaney,CNC,Grant (CHI) makes marginal contact with Delaney (ATL) off ball.,http://official.nba.com/last-two-minute-report/?gameNo=0021700065&eventNum=1044,20171026ATLCHI,20171026ATLCHI-7,ATL,CHI,20171026,James Capers,Karl Lane,J.T. Orr,,86,91,L2M-ATL-CHI-10-26-2017.pdf,https://www.basketball-reference.com/boxscores/201710260CHI.html,ATL,CHI
Q4,00:52.1,52.1,Foul: Offensive,Lauri Markkanen,Malcolm Delaney,CNC,Markkanen (CHI) sets the screen on Delaney (ATL) and gives him room to avoid the contact. 00:49.1 00:49.1,http://official.nba.com/last-two-minute-report/?gameNo=0021700065&eventNum=1045,20171026ATLCHI,20171026ATLCHI-8,ATL,CHI,20171026,James Capers,Karl Lane,J.T. Orr,,86,91,L2M-ATL-CHI-10-26-2017.pdf,https://www.basketball-reference.com/boxscores/201710260CHI.html,ATL,CHI
Q4,00:46.8,46.8,Foul: Offensive,Mike Muscala,Justin Holiday,CNC,Muscala (ATL) sets the screen on Holiday (CHI) and gives him room to avoid the contact.,http://official.nba.com/last-two-minute-report/?gameNo=0021700065&eventNum=1046,20171026ATLCHI,20171026ATLCHI-9,ATL,CHI,20171026,James Capers,Karl Lane,J.T. Orr,,86,91,L2M-ATL-CHI-10-26-2017.pdf,https://www.basketball-reference.com/boxscores/201710260CHI.html,CHI,ATL
Q4,00:42.0,42,Foul: Loose Ball,Lauri Markkanen,Dewayne Dedmon,CNC,Markkanen (CHI) makes marginal contact with Dedmon (ATL) that does not affect his ability to retrieve the rebound.,http://official.nba.com/last-two-minute-report/?gameNo=0021700065&eventNum=1047,20171026ATLCHI,20171026ATLCHI-10,ATL,CHI,20171026,James Capers,Karl Lane,J.T. Orr,,86,91,L2M-ATL-CHI-10-26-2017.pdf,https://www.basketball-reference.com/boxscores/201710260CHI.html,ATL,CHI
Q4,00:38.3,38.3,Foul: Personal,Malcolm Delaney,Jerian Grant,CNC,Delaney (ATL) makes incidental contact with Grant (CHI) that does not affect his SQBR. Period 00:36.1 00:36.1,http://official.nba.com/last-two-minute-report/?gameNo=0021700065&eventNum=1048,20171026ATLCHI,20171026ATLCHI-11,ATL,CHI,20171026,James Capers,Karl Lane,J.T. Orr,,86,91,L2M-ATL-CHI-10-26-2017.pdf,https://www.basketball-reference.com/boxscores/201710260CHI.html,CHI,ATL
Q4,00:23.5,23.5,Foul: Offensive,Lauri Markkanen,Marco Belinelli,CNC,Markkanen (CHI) sets the screen on Belinelli (ATL) and gives him room to avoid the contact.,http://official.nba.com/last-two-minute-report/?gameNo=0021700065&eventNum=1049,20171026ATLCHI,20171026ATLCHI-12,ATL,CHI,20171026,James Capers,Karl Lane,J.T. Orr,,86,91,L2M-ATL-CHI-10-26-2017.pdf,https://www.basketball-reference.com/boxscores/201710260CHI.html,ATL,CHI
Q4,00:21.0,21,Foul: Shooting,Taurean Prince,Denzel Valentine,CNC,"Prince (ATL) legally contests Valentine's (CHI) jump shot attempt. Any ""high-five"" contact after the release is considered incidental.",http://official.nba.com/last-two-minute-report/?gameNo=0021700065&eventNum=1050,20171026ATLCHI,20171026ATLCHI-13,ATL,CHI,20171026,James Capers,Karl Lane,J.T. Orr,,86,91,L2M-ATL-CHI-10-26-2017.pdf,https://www.basketball-reference.com/boxscores/201710260CHI.html,CHI,ATL
Q4,00:18.0,18,Foul: Loose Ball,Dewayne Dedmon,Robin Lopez,,[Incidental or immaterial] Dedmon (ATL) grabs Lopez' (CHI) arm during the loose ball. 00:17.1 00:17.1,http://official.nba.com/last-two-minute-report/?gameNo=0021700065&eventNum=1051,20171026ATLCHI,20171026ATLCHI-14,ATL,CHI,20171026,James Capers,Karl Lane,J.T. Orr,,86,91,L2M-ATL-CHI-10-26-2017.pdf,https://www.basketball-reference.com/boxscores/201710260CHI.html,CHI,ATL
Q4,00:11.8,11.8,Foul: Offensive,Dewayne Dedmon,Justin Holiday,CNC,Dedmon (ATL) sets the screen on Holiday (CHI) and gives him room to avoid the contact.,http://official.nba.com/last-two-minute-report/?gameNo=0021700065&eventNum=1052,20171026ATLCHI,20171026ATLCHI-15,ATL,CHI,20171026,James Capers,Karl Lane,J.T. Orr,,86,91,L2M-ATL-CHI-10-26-2017.pdf,https://www.basketball-reference.com/boxscores/201710260CHI.html,CHI,ATL
Q4,00:10.5,10.5,Foul: Shooting,Robin Lopez,Marco Belinelli,CNC,Lopez (CHI) makes incidental contact with Belinelli (ATL) and allows for him to land following his jump shot attempt.,http://official.nba.com/last-two-minute-report/?gameNo=0021700065&eventNum=1053,20171026ATLCHI,20171026ATLCHI-16,ATL,CHI,20171026,James Capers,Karl Lane,J.T. Orr,,86,91,L2M-ATL-CHI-10-26-2017.pdf,https://www.basketball-reference.com/boxscores/201710260CHI.html,ATL,CHI
Q4,00:08.5,8.5,Foul: Loose Ball,Dewayne Dedmon,Jerian Grant,CNC,Dedmon (ATL) makes marginal contact with Grant (CHI) during rebounding.,http://official.nba.com/last-two-minute-report/?gameNo=0021700065&eventNum=1054,20171026ATLCHI,20171026ATLCHI-17,ATL,CHI,20171026,James Capers,Karl Lane,J.T. Orr,,86,91,L2M-ATL-CHI-10-26-2017.pdf,https://www.basketball-reference.com/boxscores/201710260CHI.html,CHI,ATL
Q4,00:06.1,6.1,Foul: Personal,Mike Muscala,Jerian Grant,CC,Muscala (ATL) commits a take foul on Grant (CHI). 00:06.2 00:06.2,http://official.nba.com/last-two-minute-report/?gameNo=0021700065&eventNum=630,20171026ATLCHI,20171026ATLCHI-18,ATL,CHI,20171026,James Capers,Karl Lane,J.T. Orr,,86,91,L2M-ATL-CHI-10-26-2017.pdf,https://www.basketball-reference.com/boxscores/201710260CHI.html,CHI,ATL
Q4,00:04.7,4.7,Foul: Personal,Jerian Grant,Kent Bazemore,CNC,"Grant (CHI) makes incidental contact with Bazemore (ATL) that does not affect his SQBR. Event Assessments: CC = Correct Call, IC = Incorrect Call, CNC = Correct Non-Call, INC = Incorrect Non-Call",http://official.nba.com/last-two-minute-report/?gameNo=0021700065&eventNum=1055,20171026ATLCHI,20171026ATLCHI-19,ATL,CHI,20171026,James Capers,Karl Lane,J.T. Orr,,86,91,L2M-ATL-CHI-10-26-2017.pdf,https://www.basketball-reference.com/boxscores/201710260CHI.html,ATL,CHI