period,time,seconds_left,call_type,committing_player,disadvantaged_player,review_decision,comment,video,game_id,play_id,away,home,date,ref_1,ref_2,ref_3,ref_4,score_away,score_home,original_pdf,box_score_url,disadvantaged_team,committing_team
Q4,01:48.0,108,Foul: Loose Ball,Jaylen Brown,Rudy Gobert,CNC,Brown (BOS) and Gobert (UTA) make incidental contact with one another during rebounding. 01:44.1 01:44.1,http://official.nba.com/last-two-minute-report/?gameNo=0021701121&eventNum=1120,20180328BOSUTA,20180328BOSUTA-0,BOS,UTA,20180328,Courtney Kirkland,Leroy Richardson,Zach Zarba,,97,94,L2M-BOS-UTA-03-28-2018.pdf,https://www.basketball-reference.com/boxscores/201803280UTA.html,UTA,BOS
Q4,01:37.0,97,Foul: Shooting,Rudy Gobert,Jayson Tatum,CNC,Gobert (UTA) legally contests Tatum's (BOS) jump shot attempt.,http://official.nba.com/last-two-minute-report/?gameNo=0021701121&eventNum=1121,20180328BOSUTA,20180328BOSUTA-1,BOS,UTA,20180328,Courtney Kirkland,Leroy Richardson,Zach Zarba,,97,94,L2M-BOS-UTA-03-28-2018.pdf,https://www.basketball-reference.com/boxscores/201803280UTA.html,BOS,UTA
Q4,01:35.0,95,Foul: Loose Ball,Ricky Rubio,Shane Larkin,CNC,Rubio (UTA) makes incidental contact with Larkin (BOS) that does not affect his ability to retrieve the rebound.,http://official.nba.com/last-two-minute-report/?gameNo=0021701121&eventNum=1122,20180328BOSUTA,20180328BOSUTA-2,BOS,UTA,20180328,Courtney Kirkland,Leroy Richardson,Zach Zarba,,97,94,L2M-BOS-UTA-03-28-2018.pdf,https://www.basketball-reference.com/boxscores/201803280UTA.html,BOS,UTA
Q4,01:33.0,93,Foul: Shooting,Donovan Mitchell,Greg Monroe,CC,Mitchell (UTA) makes contact to Monroe's (BOS) arm and affects his shot attempt. 01:33.1 01:33.1,http://official.nba.com/last-two-minute-report/?gameNo=0021701121&eventNum=601,20180328BOSUTA,20180328BOSUTA-3,BOS,UTA,20180328,Courtney Kirkland,Leroy Richardson,Zach Zarba,,97,94,L2M-BOS-UTA-03-28-2018.pdf,https://www.basketball-reference.com/boxscores/201803280UTA.html,BOS,UTA
Q4,01:24.0,84,Foul: Offensive,Rudy Gobert,Terry Rozier,CNC,Gobert (UTA) sets the screen on Rozier (BOS) and gives him room to avoid the contact.,http://official.nba.com/last-two-minute-report/?gameNo=0021701121&eventNum=1123,20180328BOSUTA,20180328BOSUTA-4,BOS,UTA,20180328,Courtney Kirkland,Leroy Richardson,Zach Zarba,,97,94,L2M-BOS-UTA-03-28-2018.pdf,https://www.basketball-reference.com/boxscores/201803280UTA.html,BOS,UTA
Q4,01:16.0,76,Foul: Offensive,Rudy Gobert,Terry Rozier,CNC,Gobert (UTA) sets the screen on Rozier (BOS) and gives him room to avoid the contact.,http://official.nba.com/last-two-minute-report/?gameNo=0021701121&eventNum=1124,20180328BOSUTA,20180328BOSUTA-5,BOS,UTA,20180328,Courtney Kirkland,Leroy Richardson,Zach Zarba,,97,94,L2M-BOS-UTA-03-28-2018.pdf,https://www.basketball-reference.com/boxscores/201803280UTA.html,BOS,UTA
Q4,01:14.0,74,Foul: Shooting,Jaylen Brown,Donovan Mitchell,CNC,Brown (BOS) cleanly steals the ball from Mitchell (UTA). 01:09.1 01:09.1,http://official.nba.com/last-two-minute-report/?gameNo=0021701121&eventNum=1125,20180328BOSUTA,20180328BOSUTA-6,BOS,UTA,20180328,Courtney Kirkland,Leroy Richardson,Zach Zarba,,97,94,L2M-BOS-UTA-03-28-2018.pdf,https://www.basketball-reference.com/boxscores/201803280UTA.html,UTA,BOS
Q4,01:07.0,67,Foul: Offensive,Jae Crowder,Jaylen Brown,CNC,Crowder (UTA) sets the screen on Brown (BOS) and gives him room to avoid the contact.,http://official.nba.com/last-two-minute-report/?gameNo=0021701121&eventNum=1127,20180328BOSUTA,20180328BOSUTA-7,BOS,UTA,20180328,Courtney Kirkland,Leroy Richardson,Zach Zarba,,97,94,L2M-BOS-UTA-03-28-2018.pdf,https://www.basketball-reference.com/boxscores/201803280UTA.html,BOS,UTA
Q4,01:02.0,62,Foul: Shooting,Terry Rozier,Donovan Mitchell,CNC,Rozier (BOS) maintains legal guarding position and makes incidental contact with Mitchell (UTA) that does not affect his drive to the basket and shot attempt.,http://official.nba.com/last-two-minute-report/?gameNo=0021701121&eventNum=1128,20180328BOSUTA,20180328BOSUTA-8,BOS,UTA,20180328,Courtney Kirkland,Leroy Richardson,Zach Zarba,,97,94,L2M-BOS-UTA-03-28-2018.pdf,https://www.basketball-reference.com/boxscores/201803280UTA.html,UTA,BOS
Q4,01:00.0,60,Foul: Loose Ball,Aron Baynes,Rudy Gobert,CNC,Baynes (BOS) makes marginal contact with Gobert (UTA) that does not affect his ability to retrieve the rebound. 00:58.3 00:58.3,http://official.nba.com/last-two-minute-report/?gameNo=0021701121&eventNum=1129,20180328BOSUTA,20180328BOSUTA-9,BOS,UTA,20180328,Courtney Kirkland,Leroy Richardson,Zach Zarba,,97,94,L2M-BOS-UTA-03-28-2018.pdf,https://www.basketball-reference.com/boxscores/201803280UTA.html,UTA,BOS
Q4,00:43.3,43.3,Foul: Personal,Shane Larkin,Ricky Rubio,CNC,Larkin (BOS) cleanly deflects the ball away from Rubio (UTA). Period 00:40.4 00:40.4,http://official.nba.com/last-two-minute-report/?gameNo=0021701121&eventNum=1130,20180328BOSUTA,20180328BOSUTA-10,BOS,UTA,20180328,Courtney Kirkland,Leroy Richardson,Zach Zarba,,97,94,L2M-BOS-UTA-03-28-2018.pdf,https://www.basketball-reference.com/boxscores/201803280UTA.html,UTA,BOS
Q4,00:26.0,26,Foul: Personal,Jayson Tatum,Jae Crowder,CNC,Tatum (BOS) makes marginal contact with Crowder (BOS) that does not affect his SQBR.,http://official.nba.com/last-two-minute-report/?gameNo=0021701121&eventNum=1131,20180328BOSUTA,20180328BOSUTA-11,BOS,UTA,20180328,Courtney Kirkland,Leroy Richardson,Zach Zarba,,97,94,L2M-BOS-UTA-03-28-2018.pdf,https://www.basketball-reference.com/boxscores/201803280UTA.html,BOS,BOS
Q4,00:22.7,22.7,Foul: Shooting,Jayson Tatum,Jae Crowder,CNC,Tatum (BOS) blocks the jump shot attempt by Crowder (UTA) and any contact to the arm after the block is considered incidental.,http://official.nba.com/last-two-minute-report/?gameNo=0021701121&eventNum=1132,20180328BOSUTA,20180328BOSUTA-12,BOS,UTA,20180328,Courtney Kirkland,Leroy Richardson,Zach Zarba,,97,94,L2M-BOS-UTA-03-28-2018.pdf,https://www.basketball-reference.com/boxscores/201803280UTA.html,UTA,BOS
Q4,00:20.6,20.6,Foul: Shooting,Aron Baynes,Joe Ingles,CNC,Baynes (BOS) makes incidental contact with Ingles (UTA) that does not affect his driving shot attempt.,http://official.nba.com/last-two-minute-report/?gameNo=0021701121&eventNum=1133,20180328BOSUTA,20180328BOSUTA-13,BOS,UTA,20180328,Courtney Kirkland,Leroy Richardson,Zach Zarba,,97,94,L2M-BOS-UTA-03-28-2018.pdf,https://www.basketball-reference.com/boxscores/201803280UTA.html,UTA,BOS
Q4,00:19.7,19.7,Foul: Loose Ball,Rudy Gobert,Jaylen Brown,CNC,Gobert (UTA) makes marginal contact with Brown (BOS) that does not affect his ability to retrieve the rebound. 00:14.8 00:14.8,http://official.nba.com/last-two-minute-report/?gameNo=0021701121&eventNum=1134,20180328BOSUTA,20180328BOSUTA-14,BOS,UTA,20180328,Courtney Kirkland,Leroy Richardson,Zach Zarba,,97,94,L2M-BOS-UTA-03-28-2018.pdf,https://www.basketball-reference.com/boxscores/201803280UTA.html,BOS,UTA
Q4,00:06.2,6.2,Foul: Personal,Joe Ingles,Jaylen Brown,CNC,Ingles (UTA) and Brown (BOS) briefly engage and disengage.,http://official.nba.com/last-two-minute-report/?gameNo=0021701121&eventNum=1135,20180328BOSUTA,20180328BOSUTA-15,BOS,UTA,20180328,Courtney Kirkland,Leroy Richardson,Zach Zarba,,97,94,L2M-BOS-UTA-03-28-2018.pdf,https://www.basketball-reference.com/boxscores/201803280UTA.html,BOS,UTA
Q4,00:04.6,4.6,Foul: Personal,Ricky Rubio,Shane Larkin,CNC,Rubio (UTA) maintains legal guarding position and makes incidental contact with Larkin (BOS) during his drive to the basket.,http://official.nba.com/last-two-minute-report/?gameNo=0021701121&eventNum=1136,20180328BOSUTA,20180328BOSUTA-16,BOS,UTA,20180328,Courtney Kirkland,Leroy Richardson,Zach Zarba,,97,94,L2M-BOS-UTA-03-28-2018.pdf,https://www.basketball-reference.com/boxscores/201803280UTA.html,BOS,UTA
Q4,00:02.0,2,Turnover: Traveling,Jaylen Brown,,CNC,"Brown (BOS) makes a legal move prior to the jump shot attempt. Event Assessments: CC = Correct Call, IC = Incorrect Call, CNC = Correct Non-Call, INC = Incorrect Non-Call",http://official.nba.com/last-two-minute-report/?gameNo=0021701121&eventNum=1618,20180328BOSUTA,20180328BOSUTA-17,BOS,UTA,20180328,Courtney Kirkland,Leroy Richardson,Zach Zarba,,97,94,L2M-BOS-UTA-03-28-2018.pdf,https://www.basketball-reference.com/boxscores/201803280UTA.html,UTA,BOS